;question
2011;arret medic 35=acn
2012;combien lyon dan boit medic
2013;medic sevrag
2014;j avoir patient qui veut soign malad cuir chevelu avec huil essentiel que conseil
2015;enchain plaquet adepal et repris
2016;medic pour le malad
2017;ou achet arkogellul lami blanc
2018;copin pren pilul medic depuis an medecin medic chang pilul pour dal gai etre normal ne puls voir libido
2019;medic ca perim
2020;quel etre utilis premi medic
2021;je dois prendr medic matin mid ou soir
2022;medecin vient prescrir medic pour trait endometrios combien temp faut prendr
2023;comment mettr betadin sur fissur a entre vagin
2024;etre alle achet medic san prescript medecin et pharmacien medic don medic composit san rien demand etre normal ou prescript avoir etre demand
2025;medic peut fair avort
2026;avoir pris deux cachet panthoprazol composit par inadvert etre grav
2027;lutenil inform sur medic
2028;medic trait nouveau
2029;etre qu medic risqu malad avec sterilet medic
2030;quel etre indiqu dos medic a composit
2031;depuis dizain jour prend medic etre composit par jour qui fait total composit medic en jour etre surdosag
2032;etre qu etre possibl tomb enceint sous medic
2033;quel etre le different sterilet
2034;demangeaison medic
2035;medic et malad
2036;comment agit molecul dan medic
2037;si prend plusieur barr medic risqu quoi
2038;etre possibl comm pilul classiqu prendr luteran en continu en cas oubl luteran quel etre del pour reprendr cp san avoir a proteg autr car risqu
2039;bonjour qui medic deja pris pilul median et gener avoir avoir problem au chang normal devr etre mem chos pour part avoir avoir quelqu pert marron clair spotting au chang attend repons merc
2040;ne support pas pilul medic et gyneco medic don medic a plac gym medic dit arret medic jeud soir dc prendr derni et prendr medic mard etre a dir comm hab avec medic et ensuit pend semain et semain repos etre que etre ca compt etre que etre proteg en chang pilul et etre que etre proteg dur period repos et le jour repos entre medic et medic qui medic deja pris medic et ad avoir v avoir regl
2041;cel fais mois que pren plus pilul la etre a pos jour avoir pas regl etre normal
2042;une patient trait par medic composit souhait savoir si peut prendr medic avec trait
2043;medic
2044;seropam peut etre pris avec autr antidepresseur
2045;le granul homeopath peuvent elle etre dilu dan medic
2046;pilul medic qui connait
2047;quel etre le effet secondair medic
2048;avoir commenc pilul medic enver depuis jour que dois fair mainten
2049;medic et malad
2050;etre que min etre somnifer
2051;vien commenc holgyem medic jour le heur qui suivent pris comprim avoir malad au coeur malad et malad au cran etre que symptom prolongent dan temp
2052;le sec et le sart peuvent il provoqu insuffis renal fonctionnel
2053;quel etre le risqu medic et medic si etre enceint
2054;quel risqu a prendr medic plusieur mois suit
2055;medic a prendr en continu ou pas
2056;xylol visqueux et medic chez enfant an pour syndrom pied main bouch qu en pens
2057;j avoir oubli plaquet medic et pharmacien medic don gener pour termin cycl exist risqu sach qu agit mem molecul
2058;avoir fais arret jour entre medic et medic etre grav avoir fait arret jour entre derni medic et premi medic
2059;avoir deja avoir ordon pour medic chez femm age sous medic
2060;etre que medic peut entrain insomn
2061;etre sous trait chimiotherap depuis novembr etre util voir prudent ou bien carr danger fair inject medic anti malad
2062;comment prepar medic medic
2063;parl medic expidet qui fond dan bouch a composit combien temp apres pris medic commenc a fair effet
2064;medic hydn
2065;medecin medic prescr medic cel va permettr tomb rapid enceint
2066;etre danger prendr medic comprim dont dat perempt etre pass medic mois
2067;prend medic continu medic etre premi contracept et jusqu avoir jam avoir cycl reguli avoir donc quelqu peur medic approch fin premi plaquet dois commenc deuxiem plaquet comm etre prevu avec typ medic mem si avoir pas encor regl medic fin premi plaquet oui au contrair dois attendr arriv regl avant commenc suiv pens que ca coup effet ban
2068;etre que comm pilul medic provoqu fort migrain
2069;medic et medic enceint
2070;dosag medic enfant
2071;la levur bier peut etre utilis pour restaur flor intestinal quand etre sujet a malad
2072;qu etre que arpagophyton
2073;spotting pend anneau pas regl dur paus
2074;prend medic depuis jour et ne fais que pleur et deprim plus spotting pir en pir chaqu jour que dois fair
2075;pens commenc folliculin combien ca cout
2076;avoir regl or que fait semain que avoir enchain ordinal plaquet etre entrain fair fauss couch
2077;inform officiel medic
2078;quand commenc ordinal pris pilul apres medic
2079;avoir arret seroplex depuis deux semain car veux chang que puis prendr
2080;maman age an vient apprendr qu medic malad generalis cel medic commenc par malad col ulterus qui etre propag aux ovair aux rein vess et estomac le medecin avoir pratiqu hysterectom cel medic pas suff trait etre possibl
2081;avoir commenc medic gai mois ci et depuis quelqu jour avoir commenc a avoir malad abdominal comm lor regl et pert brunatr parfois roug etre normal
2082;plus regl depuis retr medic
2083;paracetamol etait pas anti inflammatoir antalg bloqu influx nerveux doulour dan cerveau etre quelqu saur comment bloqu cet influx
2084;prend pilul medic que avoir reprendr samed avoir repris dimanch apres arret non pas jour demand si etre grav ou pas
2085;altern san ordon pour medic composit
2086;trimgel et medic etre compatibl n
2087;minoxydil a deconseil pour le femm
2088;avoir oubli pilul medic gai chez parent rest vieil pilul androc puis prendr en remplac medic gai pend quelqu jour
2089;bonjour vien enlev medic medic heur suit souc regl depuis mois medic avoir an et souc depuis que avoir sterilet gyneco medic prescr medic micro dos rembours dois attendr regl sais etre que peux prendr pilul man quel etre le risqu avoir pas envi attendr car fais bip natat et aim savoir ad vais etre regl conseil merc
2090;j avoir oubli prendr holonom dois prendr pilul consecut
2091;le sipralex etre efficac contr malad
2092;la pharmacien recoit ordon inhabituel medic crem pour enfant moin an pour soign irrit elle demand si tel cas medic deja etre recens
2093;dosag medic chez enfant
2094;quel effet therapeut medic
2095;medic dan frigo
2096;y medic period adapt au medic
2097;phaev entrain problem gynecolog
2098;etre tout temp fatigu et pens que cel vient medic et
2099;avoir impress avoir perdu pet depuis que prend medic depuis petit semain pourt par que ca stimul pet et que ca fait prendr poud etre normal perdr appet le premi jour
2100;medic et bois band
2101;client voudr soulag petit fill qui souffr terreur nocturn par voi homeopath le cris durent parfois jusqu a minut et enfant ensuit rendort normal que propos
2102;aujourd huy medecin medic prescr magnesium inject medic dit boir melang avec peu medic alor que sur notic etre ecrit intravein qu en pens
2103;le troubl erect sous medic etre il connus
2104;avoir pris medic ia deux jour aujourd huy avoir le mem symptom q malad urinair que avoir fait medic ca an etre normal
2105;quel nom commercial pour medic
2106;vaccin ou fair
2107;avoir fait medic malad jaun medic mainten jour suit apres piqur avoir ressent espec leg picot sous pied gauch puis rien ne etre pass pend jour hi soir le picot etre revenus avec gross malad etre normal
2108;hom medic prescr dos medic album a 200k etre quoi cet dilut
2109;peut aval medic au lieu fair fondr sous langu
2110;prend medic depuis mois et dem depuis avoir pris kg etre souvent enerv et moral a zero avoir impress deprim etre a pilul
2111;fum avec passiflor mauv
2112;la medic pour combattr le infect nosocomial
2113;voil avoir enchain deux plaquet pilul et avoir commenc troisiem avoir prit cachet sur troisiem plaquet avoir prit ordinal hi ne avoir pas pris aujourd huy car voudr avoir regl cet semain pour etre tranquill geek en avec doudou etre sous gener fianc puisqu avoir prit derni pilul dimanch matin doit recommenc pilul quand etre premi fois que fais arret et etre que peux recommenc avec troisiem plaquet entam comm enchain toujour le plaquet ca veux dir que arret dan plaquet et dem ou plaquet et dem pour arret avec fin plaquet ou etre oblig recommenc nouvel plaquet
2114;pourquoi medic etre indiqu seul a part an
2115;effet secondair medic
2116;fil etre sous medic vien apercevoir qu fois ouvert faut conserv au frigo quel etre risqu laiss a symptom ambi
2117;avoir commenc nouvel pilul medic gai auparav pren medic avoir arret car cel ci don saign entre regl problem etre que depuis deux jour saign recommencent voul savoir si cel peut etre effet secondair mem si etre pilul fort ou etre que cel peut ven fait que fum encor
2118;etre que medic que prend peut etre caus malad sech
2119;etre sous efexor depuis an et etre souvent malad malad fievr faringit medecin dit que san dout medic qui medic reduit defens sen pens
2120;peut utilis medic chez femm enceint
2121;comment utilis le huil essentiel contr le etat depress
2122;rap merdaillon
2123;pourquoi medic
2124;etre sous medic au point peut etre arret trait avoir agress irrit enerv sort symptom dan le bras et sensat que tout muscl crispent surtout ceux machoir et cou avec temp cel etre apais
2125;sais que certain pilul peuvent favoris le episod mycos et voul savoir si medic etre dan cas
2126;medic et malad
2127;medecin medic prescr medic medic dit qu en jour avoir nouveau regl etre au ordinal jour et toujour rien etre normal
2128;medic etre gener medic
2129;medic hpv que fair
2130;ou achet arkogellul lami blanc
2131;problem etre en rapport avec maudit bouff chaleur qui etre install depuis age exist trait homeopath ou phytotherap efficac
2132;etre que medic developp kyst ovarien
2133;etre que peux prendr medic pour symptom
2134;medic fait gross
2135;utilis medic depuis mois avoir constat progress diminu regl en quantit et en dur et del plus en plus long avant commenc devr fair test malad tous le mois
2136;etre que melatonin ne peut etre delivr que sur ordon
2137;peut substitu medic prescr a par capteur freestyl libr si ordon etre pas securis
2138;qu etre qu produit contrast
2139;dang huil essentiel et malad
2140;etre qu fill au dessous an peut prendr medic
2141;medic quoi sert medic
2142;le medic enfant fait encor
2143;je avoir pas avoir regl apres jour san pilul medic risqu que etre enceint
2144;del entre medic et malad
2145;etre qu peut avoir rapport sexuel non proteg pend semain arret medic
2146;etre que peux prendr compl alimentair protein avec medic
2147;medic plus medic
2148;faut prescrir medic sur ordon special
2149;etre sous gener medic en discontinu plaquet comprim apres jour arret etre alle a pharmac et medic avoir medic don gener medic en continu comprim medic risqu malad
2150;exist sep solut pour retrouv libido normal malgr pris antidepresseur et anxiolyt
2151;quelqu connait remed pour diminu quint malad
2152;bonjour prend melod depuis jour et voul savoir si possibl ovul et si soi quand mem prendr pilul lendemain
2153;que pens medic medic y medic risqu
2154;cherch q chos san ordon pour ne plus deprim et ne plus fair coler
2155;etre actuel sous medic mois ci avoir avoir douleur aux sein voudr essai medic comment doit proced
2156;quand vaccin par medic
2157;pastill pur gorg laquel
2158;etre possibl associ medic medic et medic medic
2159;qui medic deja avoir cerazet que pouv en dir
2160;erupt bouton medic medic
2161;pourquoi prendr medic
2162;avec quoi trait diabet par medic
2163;prend medic depuis mois souffr malad const et surtout social handicap avoir plus rien a perdr avec manipul hasard a mois trait et etre persuad que doubl composit 6cmp dos maximal composit 3cmp pourr amplement soulag malad cepend dir que dos max ne doit pas etre dep chacun medic plus ou seuil dos maximal propr a mem
2164;medic composit pour symptom vrai ou faux
2165;prend pilul medic correct et pend period arret 7j composit regl et composit avoir rapport non proteg avec copain debut regl jou voulu savoir si medic ris que tomb enceint
2166;hemoclar
2167;medic aux bouff chaleur
2168;fiu au medic combien temp le douleur
2169;decontractyl retir march
2170;avoir chang antidepresseur pren medic et avoir arret jour pour medic pas effet secondair le premi jour pourquoi avoir effet secondair au bout jour etre parc que avoir encor medic dan sang etre pour ca ou etre parc que avoir arret medic coup
2171;medic sur le sein
2172;qui connait medic
2173;faut prendr medic avant ou pend le rep
2174;transpir excess pas beaucoup solut quel trait exist
2175;desagr sous medic
2176;voul just demand si connaiss medic
2177;prend medic et en peux plus malad etre devenu chroniqu avoir vertig malad crois que vais arret coup sen encor plus malad car plus capabl avoir activ etre que ca pourr etre effet secondair
2178;le medic etre placebo
2179;bonjour avoir medic boostrixterr depuis mois dan frigo etre encor utilis
2180;puis don medic pour malad seborrhe sur visag
2181;apres oubl obel gai plus heur etre proteg
2182;quel etre le effet indesir medic
2183;medic san ordon etre toujour possibl
2184;medic don symptom ains que chang percept
2185;peut prendr melatonin en mem temp que medic
2186;quel etre posolog maximal pour ami par rapport au medic
2187;si le vaccin causent reaction indesir medic peut nettoi le effet secondair et le symptom caus par le vaccin
2188;peut prescrir medic pend malad
2189;puis associ medic et griffon san dang
2190;etre sous medic avoir oubli prendr medic deux semain avoir pris comprim oubli ne sais pas si etre comprim veil donc prefer fair comm si avoir complet oubli comprim il ne disent pas march a suivr dan cas utilis preserv seul semain auss
2191;bonjour copin samed pass medic oubli prendr pilul et medic pris lendemain heur retard etre dan deuxiem semain avoir avoir rapport lund soir avoir pris pilul et comm avoir conseil avoir utilis preserv malad pot medic craqu pend rapport san que en rendion compt aujourd huy etre alle achet pilul lendemain demand mainten etre util prendr ou si ne etre pas entrain stress pour rien pilul etre desorelle20 et pilul lendemain pas encor pris etre marqu medic merc avanc pour repons p si prend doit proteg par suit jusqu au prochain regl
2192;medic pharmacien souhait savoir si medic etre list comm medic except
2193;avoir avoir deux vaccin hi malad et malad etre sent vit fatigu et etre tomb endorm et aujourd huy etre dan etat febril avoir deja avoir effet similair
2194;etre que medic e et b favorisent fertil
2195;medic tous le comprim etre dos pareil
2196;avoir repr medic et aujourd huy apercois que reperd sang etre retour couch si oui etre que fin cet plaquet pilul et ad reprendr ancien pilul qui etait medic
2197;prend melod depuis mois avoir pas avoir regl premi mois et le attend depuis avoir sein enorm avoir gross kg en mois etre normal
2198;de quel taill etre le gelul duloxetin krak
2199;fill medic fait medic et polio hi medic age et la matin medic fort fievr et etre roug etre peu enfle la ou ia avoir piqur etre ordinal fois qu fait ca normal ou pas
2200;medic et malad
2201;apparit bleus san coup sou medic etre normal
2202;gardasil
2203;peut cumul medic et medic avec medic
2204;prend medic depuis deux mois vais mieux dan tet par contr avoir demangeaison sur tout corp qu etre qu peut prendr pour soulag
2205;peut consomm medic fois dat perempt pass
2206;dat sur monev
2207;medic speciafoldin list
2208;etre sous luteran dois prendr jour par mois et paus jour or en avoir pris si fais paus jour au lieu habitud vais pouvoir recuper comprim pris en plus
2209;medic depuis quand ca exist
2210;epous medic pris seul inject synerg rendus compt qu etait en etat malad quel effet peut avoir cet inject sur futur enfant
2211;medic malad medic
2212;quoi etre que medic etre gener
2213;medic quel etre le risqu
2214;medic et dysfonct erectil
2215;sevrag effort composit jr etre psychosomat
2216;y medic risqu fauss couch avec medic
2217;medic ca sert a quoi
2218;comment present medic
2219;le medic etre caus pris poid
2220;medic fievr jaun danger
2221;etre que medic inhib action pilul
2222;etre medic et antalg peuvent trait gross calcif au poignet
2223;malad malad medic
2224;une dam hi etre venu a pharmac paniqu car avoir oubli prendr progesteron en ovul matin et que but etre favoris nidat trait car deja fauss couch je avoir rassur en dis que oubl sur 20j matin et soir etre pas grav voul quand mem savoir si avoir risqu
2225;suit a medic malad medic plus typhoid avoir atroc malad au bras souffr symptom coud jusqu en haut epaul etre normal
2226;medic nourrisson peut recevoir granito medic
2227;recent medecin medic augment dosag quetain depuis avoir souvent chaud fais cauchemar et etre etourd etre a caus augment
2228;etre danger prendr ibuprofen lor apero bien arros
2229;avoir commenc cur compl medic et magnesium car etre tres carenc et voul savoir au bout combien temp ca fais effet mois mois
2230;malad et egout nourritur sous medic etre normal
2231;medic priv etre danger
2232;pren gener medic le arret medic derni cycl car sent trop faibl depuis sen plus en form et plus vertig avoir douleur en bas ventr et dan dos vien ici pour avoir temoignag fill qui avoir arret pilul et savoir si ca arriv genr douleur
2233;medic peut provoqu bouff chaleur
2234;pris medic heur et a part heur avoir avoir gastro que avoir encor hui il faut que fass quoi comprim hi va fonction ou non
2235;medic fait encor effet
2236;medic perdu que fair
2237;etre que quelqu etre combien cout medic sep
2238;medic magnesium et magnesium
2239;etre que le vitamin peuvent amelior fertil masculin
2240;quel etre galen verapamil sandow
2241;avoir pris cerazet depuis an avoir arret avoir avoir malad et medecin medic prescr aspic et avoir avoir nouveau regl du a medic qui ne arretent pas etre normal
2242;bonjour medic tout voil ia mois ca ai pris medic car suit medic arret pilul avais plus regl octobr ai avoir regl comm prevu depuis hi ai pert sang croir que ai regl qui vont arriv jaimer savoir si normal merc repons
2243;medic part quand medic etre efficac
2244;bonjour prend endrocur depuis presqu bientot an pour problem regl en prend comprim pas jour en plus pilul medic avoir entendu parl que ca seduir pilos pour avoir impress que ca medic avoir effet invers etre possibl
2245;faut prendr medic plutot matin ou soir
2246;hi pens avoir pris 2d pilul san en avoir souven etre grav si avoir rapport dur we
2247;medic et depend
2248;comment appliqu medic onagr
2249;etre sous traitent medic depuis mois et est 31em jour cycl et ai pas regl etre que etre normal
2250;medic connaiss
2251;medic medic mod action
2252;zythromax pst ordinal trimestr malad
2253;puis prendr medic et cefpodoxin en mem temp
2254;puis allait si prend medic
2255;je etre sous medic combien temp faut attendr pour sent mieux
2256;avoir effectu rappel medic quant pour beb mois hi decouvr qu pet bouton roug etre reapparu sur cet cuiss la en pens quoi
2257;medic dos peut appliqu sur tet
2258;tamil doulour effet secondair
2259;connaiss medic medic
2260;medic etre danger
2261;ca fait pas lonten que jpren pilul et parfois oubl jour dc en prend deux mm jour aim savoir si ca peut avoir effet nocif sur sant
2262;medic malad medic effet indesir
2263;medic combien temp dan sang
2264;homo vient prescrir medic medic eh avoir deja pris avant et ca medic pas fonction medic just rajout medic 200k pens que cel va agir en rajout dos medic
2265;prend antibiot medic fort pour trait malad urinair depuis vendred matin et matin sen que ca tiraill peu plus haut que ventr sur part droit etre normal
2266;dan quel cas medic etre contr indiqu
2267;rappel medic antitetan pend pris antibiot
2268;demangeaison sous medic normal
2269;avoir peau front grass qui luit et qui don point noir certain fois qui infectent et deviennent roug medic medic homo pour trait ca
2270;ami medic pris environ cachet medic compren deux ou trois cachet ibuprophen quelqu peut dir qu risqu sep
2271;pourquoi prendr medic
2272;pren medic et medic avoir arret medic depuis mois avoir mainten spotting etre desagre donc pour pali a spotting arret definit medic en fin plaquet ou recomment apres jour paus
2273;voudr savoir si peu melang spagyr medic en medic plus ressu fleur bach car angoiss
2274;arvar peut etre prescr a plac medic
2275;plus regl avec medic etre normal
2276;etre proteg rapport non proteg dur arret pilul medic chaqu fin plaquet
2277;absenc medic en pharmac pourquoi
2278;bonjour prend medic pour avoir beb depuis mois depuis debut trait avoir petit bouton sur le avant bras etre normal
2279;malad medic bichromicum
2280;medic ph et igniac ph malad dilut existent
2281;quel symptom pour allerg au medic
2282;medic douleur musculair articulair
2283;peut prendr medic dan journ en plus deux matin et soir
2284;ose pas prendr medic peur qu interromp efficac pilul adepal quand pens
2285;medic pas dang
2286;prend medic avoir arret sil medic pas longtemp et puis avoir e reprendr la reessai medic nouveau avoir just choui diminu dos et etre bas complet etre normal
2287;medic rembours
2288;prend medic gyneco medic chang pilul pour medic car etre loin dos etre anti malad
2289;une patient trait par metropol milan ressent douleur abdominal depuis que milan medic chang composit produit elle pens donc ne pas support le nouveau compos oxyd medic roug polydextros triacetin jaun quinolein elle souhait savoir composit medic sandow
2290;medic quelqu connait
2291;peut aval medic au lieu fair fondr sous langu
2292;quel altern therapeut au medic crem
2293;avoir pas pro derni pilul adepal mard mai et avoir repr nouvel pilul efezial mai apres ca avoir avoir gastro pend jour je pens donc que emeu emeu et emeu pilul medic pas fait effet et problem etre que avoir avoir rapport a emeu y medic risqu que etre enceint
2294;gyneco vient prescrir pilul medic voul savoir le principal inconvenient
2295;envi sucr et pris poid sous medic
2296;medic quel moment dois prendr d cur
2297;etre que le huil essentiel per
2298;souffr nevralg pelvien exist medic pour soign
2299;prend melod depuis deja pas malad pt et mois si avoir avoir rapport san preserv eme et eme jour etre que risqu etre enceint
2300;commenc sevrag medic quel etre le effet qu peut ressent physiqu et psychiqu
2301;etre que medic medic beaucoup effet indesir
2302;augment medic sanguin sous medic etre normal
2303;fill age medic etre vaccin avec ftp vendred lendemain et surlendemain epaul etre vrai tres dur et enfle aujourd huy plaqu malad etre apparu et ne caiss gross que fair
2304;remplac temestat par quoi
2305;si fais vaccin contr malad avant malad anticorp proteg il nouveau ne ou puis attendr accouch pour fair vaccin si dois fair avant malad combien temp apres medic dois attendr pour cess contracept medic etre forc combin avec ftp ou exist a part
2306;carenc en medic calcibronat
2307;compagnon etre sous medic depuis mois environ a caus malad discal prend medic composit deux fois par jour plus medic si besoin peuvent entrain modif comport
2308;vien chang pilul pour prendr medic etre que q medic deja avoir effet negat lesquel et au bout combien pt
2309;pens que puiss prendr le cellul konjac apres rep
2310;etre desorm sous medic avoir trais malad medic epaul quelqu peu en dir plus
2311;frer medic developp malad malad peu apres avoir etre vaccin pour malad malad qui caus problem intestinal medic lien
2312;voudr savoir avoir gross en pren neurolept seroquel composit
2313;pourquoi le dat perempt zo etre si court
2314;mon medecin avoir prescr medic composit pour trait malad etre indiqu habituel produit
2315;diminu medic egal augment pet
2316;dan quel cas peut utilis medic
2317;medic composit combien granul prendr
2318;pouv eclair sur le dosag medic dan quel cas don hi
2319;medic contr malad
2320;quel risqu encour si vend baclofen en quantit depass posolog recommand si patient present avec lettr redig par centr addictolog ou engag a ne poursuivr ni pharmacien ni prescripteur
2321;prend medic tout douc avoir effet secondair et ceux ci ne partent pas malad ventr tet drol leger sensat vertigin tet qui tourn quoi ou tet qui sembl flott etre normal
2322;sav si medic autr moyen qu avec sucr prendr medic essentiel estragon
2323;different entre medic et procalmil
2324;medic contr malad a part quel age
2325;androc besoin dosag plasmat
2326;quel peuvent etre le consequent arret trait medic mois prochain
2327;combien temp met lisanxi pour elimin
2328;medic en medic quel list
2329;sous medic avoir retard regl plus semain etre que ca medic rapport
2330;une patient trait par medic crem demand si mar peut continu a fair cunnilingus malgr trait
2331;comment sevr medic a composit
2332;docteur avoir prescr denant pour symptom deanx etre ad tricycl
2333;comment evit que patch medic decoll
2334;pass medic a cyclan dois fair paus
2335;hep medic ca march au bout combien temp
2336;etre sous luteal gai depuis jour avoir pert marron clair etre que cel etre deja arriv
2337;prend medic depuis cycl derni et mois ci rend avoir ete plus court et moin abond etre medic medic medic
2338;medic efficac medic part quand
2339;bonjour voudr savoir si pilul adepal rest efficac pend semain paus ou faut utilis autr contracept pend cet semain la
2340;comment prendr medic en cas malad
2341;e etre actuel enceint mois et dem et voul savoir si pouv vaccin contr malad medic pas risqu pour foetus
2342;etre que stresam trait le douleur thorac
2343;etre sous antibiot voudr quand mem commenc trait anti malad avec medic composit et serum yersin avoir contr indiqu
