;question
0;bonjour etre tromp forum pour question alor repos ici pris pour premi fois hi paroxetin et matin etre catastroph picot dan tous corp annonci symptom froid tres tres massiv et symptom en etre a deux cris depuis heur mat cel sembl pass main rest moit et chaud este normal pour premi fois merc medic tous
1;etre que medic soulag contr le malad
2;medecin medic prescr medic au ordinal cachet malad tet terribl et au ordinal malad symptom froid chaleur intens dan tet symptom fourmill dan levr superieur difficult a respir des arret medic tous le symptom avoir disparu cel etre deja arriv a quelqu
3;etre qu exist form adapt aux enfant age medic
4;medecin soign pour medic pharyngit et medic prescr medic comm anti biotiqu etre vrai pour cet indiqu
5;vien apprendr que etre enceint sav si peux poursuivr medic
6;medic etre pas danger au long term
7;etre sous medic j avoir malad et saign
8;medic medic etre quoi
9;prend medic et a fin premi plaquet avoir avoir premi fois av ln copain pilul etre donc bien efficac des debut avoir symptom dan poitrin avoir impress qu il avoir peu gross auss plus avoir malad o bas vent e dois minkiet ou simpl period adapt
10;medic a dos faibl pour malad
11;psy dit prendr composit medic matin et composit medic soir peut prendr composit etre matin ou medic mid
12;etre sous antibiot depuis bientot semain et etre chop ne sais quoi a nenet ca gratt etre superficiel ca dement a point etre li a antibiot
13;quel medic contr malad col uterus
14;epileps et medic
15;vaccin dup et hepatit medic etre il possibl pend malad
16;vien etre mis sous medic depuis semain souhait savoir au bout combien inject produit commenc a fair effet et au bout combien jour apres chaqu inject effet fais sent
17;comment trait dyshidros si medic et prepar medic medic composit composit medic en bain et dermalibour avoir pas march
18;peu renseign sur medic avoir pris ordinal cachet matin avoir avoir effet indesir
19;medic quel risqu
20;peut prendr medic et fleur bach en mem temp
21;quand termin plaquet peut avoir rapport sexuel
22;quel etre dur conserv tegretol
23;etre que pilul medic fais gross
24;pend le jour san pris fois plaquet pilul termin etre toujour proteg ou non pend cet semain
25;medic peut etre utilis par le homm
26;patch medic commenc a j+4 donc etre que ne etre pas proteg pst mois
27;combien prendr medic
28;medic etre medic ou antidepresseur
29;bonjour depuis presqu an etre sous medic medic prescr medic en cas cris symptom car en avoir fait ou voil depuis jour etre angoiss matin au soir et cel san raison apparent ne peux presqu plus rien aval tel etre nou alor que habitud mang comm vach moindr chos a fair sembl insurmont et provoqu malais ne sais plus quoi fair prend medic par jour alor que medecin avoir prescr pour le cris malgr medic etre meg angoiss non tout entourag medic remarqu et collegu croient enceint avoir peur deven complet agoraphob plus medecin etre en vacanc et ne sais mem pas si pass a medic etre danger sav combien temp peut dur typ cris quel etre le risqu vois psychologu depuis premi cris donc presqu an merc lumi
30;une maman recoit prescript medic composit arroi granul pour beb mois demand si cet form etre adapt alor que beb ne mang pas encor solid
31;la medic aid a maigr
32;etre sens prendr composit hi avoir pris apres avoir pris a chaqu fois que etre sur point endorm entend plein voix qui ven partout etre possibl que symptom etre a irregular pris trait
33;quel etre le effet secondair medic
34;vien commenc trait medic b depuis jour et avoir gaz que puis fair
35;ou procur medic c4
36;la medic peut provoqu bouff chaleur
37;medic medic etre rutil pour malad
38;medecin special gastro medic prescr medic medecin trait medic cit medic composit pour malad et depuis que le prend ensembl reaction form petit point roug tres demeng et embat etre apparus sur suiss droit avoir arret medic le point ne etre pas encor part apres jour que fair ou prendr
39;medic == malad aviair
40;compl alimentair medic naturel ca exist
41;prend pilul medic et avoir oubli pilul or avoir avoir rapport non proteg avoir pas pris cel que avoir oubli et avoir repr derni pilul normal etre qu avoir risqu etre enceint
42;medic neurolept
43;risqu grossess multipl bec medic risqu fill
44;avoir fort brulur estomac prend medic et ca ne fait rien connaiss remed plus efficac
45;etre sous medic et medic etre en ruptur avoir info quant a disponibil
46;j aim connaitr le zon exact appliqu medic medic
47;famill medic medic et medic
48;medic quoi sert medic
49;medic
50;sav combien temp agit le effet medic
51;etre danger si dep dos medic pour malad
52;bonjour avoir problem peu particuli avoir pris premi pilul medic vendred derni avoir pris a heur et regl avoir commenc dan nuit jeud a vendred entre heur et minuit voudr savoir si pilul etre deja efficac ou si avoir pris ordinal pilul trop tard pour qu coincid avec premi jour regl car vien avoir rapport sexuel au cour duquel preserv medic craqu que conseil avoir risqu malad etre judici que pren pilul lendemain merc avanc lucil
53;medic pour le cris symptom
54;methotrexat origin compos
55;avoir commenc melod voul savoir si etre proteg des premi pris
56;prix gener medic composit etre pass subit a etre normal
57;medic etre medic
58;vien reprendr medic a heur habitud prend malad heur sembl avoir compr qu fall reprendr a mem heur apres le jour arret avoir risqu
59;peut coup le comprim medic
60;aim reprendr pilul medic avoir tel peur reprendr poid quel pilul etre censi ne pas fair prendr poid
61;medic sur quoi agit sur quel recepteur
62;medic plus medic composit medic par jour qu en pens
63;mer qui medic oeudem au pied chevill et plant pied etre vu prescrir medic et tenoretic combien temp avant que cel ne partent
64;medic ou medic san ordon
65;a quel moment prend medic
66;combien temp faut pour qu ressent augment dos medic
67;bonjour prend medic depuis semain et dem etre auss tres enrhum et fatigu voir abrut surtout apres mid avoir malad a savoir si etre au medic avoir impress etre symptom frequent et et surtout etre que ca pass par contr avoir impress avoir etre beaucoup moin deprim des premi jour avoir mem peur perdr emot cel etre possibl quelqu pourr aid
68;sterol seul pour le adult
69;bonjour etre en train prendr pilul qui pel medic gai medic problem etre que sein etre toujour gonfl et ca fait malad medecin medic prescr medic par qu etre possibl avoir symptom en pren medic quoi ca sert alor et etre que sein vont redeven normal parc que ca fait vrai malad merc beaucoup
70;medic assomm etre normal
71;enceint et medic malad medic
72;etre sous medic et souffr secheress oculair etre cour
73;quelqu medic avoir mem au tout debut medic enorm pouss malad
74;je pren pilul luteal gai depuis pres an avoir recent chang pour medic aujourd huy avoir symptom malad malad graiss abdominal et malad que pens tout ca
75;souhait savoir quel etre prix vermifug humain
76;je prend medic avoir regl bizarr etre que habituel avec medic
77;y medic medic contr symptom
78;oubl pilul medic plus relat soir oubl
79;hep depend medic
80;par quoi puis remplac medic
81;copin souffr epin cananeen depuis octobr connaiss trait qui marchent
82;medic medic qui peu aid medic calm anxiet car medic ne calm pas vrai
83;arret medic quel effet
84;puis arret medic au cour plaquet
85;malad avec methotrexat
86;quel medic pour malad genital puis avoir en pharmac san ordon
87;on peut port patch medic en continu
88;medic medic etre compatibl avec malad
89;aim savoir le vertus medic favoris memoir
90;bonjour etre reveil dimanch matin avec malad sur le jamb et peu sur le bras etre alle voir medecin hi en medic deduit que etre allerg au medic avoir arret trait des dimanch matin et medic prescr prolamin en avoir pris hi soir en lev matin avoir vu que avoir a present malad sur decollet et sur le bras et le main etre bien moin import que sur le jamb quand mem inquiet etre normal que malad continu mont malgr prolamin dois craindr oedem quinck merc
91;voudr savoir si betaserc medic et medic avoir mem molecul
92;qu etre que medic
93;quel medic conseil pour le naus
94;aspic nourrisson epaiss endometr
95;aim bien fair cur medic vegetal par que charbon absorb tout le medic en annul donc efficac mem pour pilul aim savoir si cel etre vrai
96;medic quart heur apres avoir prix granul medic medic et medic silic colloidal avoir malad et sent malad qu etre
97;j avoir saign avec pilul medic que prend depuis an je ne etre qu au mil plaquet etre normal
98;peut prescrir medic en tant que contracept
99;etre qu peut prendr medic et medic en mem temp
100;etre possibl ovair le sein gonfl avec na
101;medic provoqu vertig
102;quel etre dos optimal dexorat
103;medic entrain cauchemar
104;pren combien composit seroquel
105;medic plus medic quel effet
106;peut prescrir dais stick boiron a femm enceint
107;souffr colopath fonctionnel et aver que seul chos qui fass reel bien etre le anxiolyt malheur etre auss atteint malad et avoir donc pas droit a typ medic medic medic
108;medic plus medic egal quel effet secondair
109;saign sous median
110;surdosag tricelest quel dang
111;avoir utilis medic naxproxen medic petit dos pour problem dos avec medic etre beaucoup spasm dan haut dos entre le cot problem dos a degener en problem malad et prend en moment medic au soir et au couch et desyrel auss au couch toujour malad bien sur pass facil au lev crois que etre le medic en avoir pas certitud que fair
112;medic et soleil
113;prend depuis an pilul medic gai a heur matin matin avoir oubli prendr pilul et vien prendr dc en catastroph a heur medic quelconqu risqu
114;prend medic ou moin gener qi appel medic ethinilestradiol medic pharmac medic redon gener comm dab mem composit tout boit medic pas mem design et fabric etre pas mem dois inquiet
115;connaiss equivalent au pans opsin post operatoir
116;etre prefer prendr matin ou soir
117;medic droit laiss medic proctalg derri comptoir sur le etager bien visibl patient
118;prend medic depuis mois deprim pour rien y medic rapport
119;medic chez patient sous medic
120;medic exist en quel dosag
121;malad aux muscl et aux os apres avoir pris medic etre normal
122;medic phosphorit regl tres doulour
123;dan quel cas medic etre util
124;medic plus malad
125;prend medic depuis an et la avoir qui ressembl a regl qui arrivent en milieu cycl etre toujour proteg contr eventuel malad
126;pilul medic march des premi plaquet et pas apres mois ou plus
127;quel altern a medic
128;medic
129;oubl medic conseil
130;prend pilul triafem quand oubl comprim avec triphas etre que ca pass comm avec monophas veux dir mem avec different dosag peut enchain le plaquet en cas oubl derni semain et si enchain etre seul le comprim derni couleur ou tout plaquet
131;medic curat malad toujour en dang
132;medic medic effet secondair
133;colt prendr medic ordinal fois
134;de quoi etre compos medic
135;medic quoi sert medic
136;qui connait medic
137;quel etre le sign surdosag en medic
138;rotarix et effet secondair
139;etre que medic contr medic malad peut declench malad inflammatoir auto immun
140;bonjour prend medic depuis age et etre tres bien pour voudr arret et en prendr qui ne etre qu contracept quel etre le malad pilul qui ne etre pas nefast pour peu toutefois qui etre uniqu contracept merc rocou
141;haut et bas avec medic etre normal
142;quel etre dur valid medic contr malad jaun
143;medic medic ou placebo
144;medic ftp enfin disponibl
145;avoir plus regl etre a caus pilul medic que avoir pris depuis mois
146;pas de question sur medic medic
147;medic quoi sert medic vulgaris
148;medic et malad
149;phosphor composit et medic composit ca sert medic quoi
150;etre que medic etre mem pilul que yasminel
151;patch medic comment utilis
152;une pharmacien appel car souhait savoir pourquoi exist deux ci ibuprofen disponibl ibuprofen lev composit et ibuprofen lev sant composit et pourquoi medic different prix entre le deux
153;quel etre class therapeut medic
154;quel etre dem vi adalimumab
155;bonjour bonjour voil utilis depuis peu pilul 21jours+arret jour sep aur aim savoir qu faut fair lorsqu medic apparit regl dur le sept jour arret debut second plaquet ou attendr 9e jour pour fair la etre complet perdu car pens que malad etre venu apres le jour merc
156;avec lisanxi medic pas trop problem sevrag
157;aim demand si medic medic medic et medic don malad bras
158;peut don medic a chat sous corticoid
159;mois medic et effet secondair
160;prend chaqu matin composit medic quel etre le effet secondair
161;qu etre que medic
162;medic etre risqu en cas malad
163;quel etre medic contr malad
164;etre normal avoir symptom en pren medic
165;qui connait medic
166;qu etre que gallium medic
167;etre sous medic geek en avoir bu beaucoup ou verr whisky au bout 5e ou 6e avoir commenc a sent tres malad pens que etre medic qui medic fait cet effet
168;info sur medic
169;je etre enceint medic etre deconseil
170;medic contr le reveil nocturn
171;luteal heur ou heur marg
172;bonjour etre actuel sous medic composit etre atteint symptom assez sever ains que troubl paniqu avec depersonnalis etre trait depuis plus mois et aucun amelior toujour auss paniqu eloign domicil et quand etre medic domicil etre pas mieux peur paniqu etre seul peur nuit qui tomb etc vis enfer general medic dis augment medic a composit ca fais peur qu en pens
173;etre que pris gelul medic peut caus augment import malad patient et si oui pourquoi
174;peut propos medic pend malad
175;pst combien temp le effet secondair a arret medic
176;cyclan et malad
177;combien temp dur effet meniscal
178;qu etre que tricilest
179;comparaison medic medic
180;apres mois et dem medic medic gener san effet sur psy medic prescr hi medic q peut temoign a propos action
181;le antibiot provoquent il remont gastriqu
182;medic complex puis en prendr pend malad
183;y medic version gener cyclan
184;quel etre medic contr malad col uterus
185;dois prendr medic cortison pour kyst dan poignet docteur medic bien dit pas sel et ni sucr moin possibl pourquoi cel
186;la sertralin jou sur libido
187;dois fair oper poitrin vaut mieux prendr opium composit veil ou au reveil anesthes
188;etre que pilul medic geo don migrain
189;question sur medic
190;en qui concern delivr transgen si posolog etre par jour que fait
191;levonorgestrel pris avant ovul jusqu ou ca peut proteg
192;trimgel et medic
193;prend medic plus medic soir pour malad et ressent effet invers etre normal
194;effet medic sur malad
195;etre que risqu tomb enceint avec medic
196;medic connaiss
197;quel medic fair mainten que ftp etre plus dispos
198;argil medic vers a utilis sur part intim
199;gener medic
200;medic marron inde ou en trouv
201;medic en caus
202;medic egal medic
203;qu etre different dosag hormon entre median et medic ou implant
204;etre que dos medic etre pas trop faibl
205;j avoir souvent prescript medic ne medic medic tout sous form inject et prescrit ensembl en nebulis tout etre hor ami en voi aerosol et cel medic pas etre test apres le laboratoir que fair
206;que fair si avoir oubli medic gai soir
207;medic contr malad a faibl dosag composit quel en etre le effet secondair
208;medic prescr medic etre que cet pilul etre effect des premi pris qu etre que cel fait si commenc plaquet alor que avoir pas encor regl
209;medic reveil nuit
210;risperidon chez adult hyperact
211;etre que pouvon substitu le prescript medic et medic par gener rembours
212;bonjour etre sous seropram et medic depuis mois vais mieux concern attaqu paniqu et angoiss contr avoir malad a dorm et surtout avoir cris rir partout dan ru chez avoir impress deven debil ris pour rien mem tout seul dev ecran pc le ad
213;medic convient parfait contr le phob qu en pens
214;ou met patch medic pour etre sur qu ne decoll pas
215;question sur medic ou sur pilul min dos etre possibl que regl ne viennent pas san que etre pour aut enceint
216;pren orgametil et mainten prend medic au chang pend premi mois avoir oubli prendr pilul et avoir pris heur apres ensuit avoir avoir saign pend jour tres leger et avoir trouv regl bizarr avoir fait test malad etre negat etre qu medic chanc que etre enceint
217;medic ami en franqu
218;medic peut empech nidat ovul dan endometr
219;medic avec autr antidepresseur
220;medic medic effet secondair
221;medic etre anxiolyt
222;quel altern au meningit en cas ruptur
223;avoir tres malad medic tet avoir donc pris medic habitud ne prend que medic et apres avoir pris etre rendu compt que dat perempt etre inquiet peu pens que etre pas grav
224;quel tisan pour maigr
225;medic haut risqu parkinson
226;medic patient medic demand alkylglycerol contenu dan medic foi requin pour regul malad ne voul plus prendr statin etre qu medic vrai cet propriet
227;enceint et medic
228;etre bon prendr corticoid quand fait vaccin
229;etre que medic gener medic mem composit que medic original
230;medic cel qui utilisent medic effet secondair
231;trait malad simpl en premi intent
232;sterilet au medic et malad
233;visag bouff etre que etre a caus medic
234;faut prendr medic pend le rep pour limit le effet indesir
235;utilis patch medic et ca inquiet peu fois avoir sup malad et malad ventr et demand vrai si etre enceint
236;comment le antidiabet diminuent il glycem
237;avoir pris medic pour ordinal fois au bout jour avoir toujour regl cel veut dir que cet pilul ne convient pas ou dois encor attendr mois ou avant savoir
238;medic et gener
239;medic et pas regl
240;une profond malad peut etre caus medic
241;vais prendr pilul medic et aim savoir si medic stop le regl ou le avoir en avoir flux moin abond etre tout mem efficac ordinal jour regl
242;reprend medic et avoir avoir oubl pourr aid si avoir etre dan tel situat
243;dois prendr medic x jour avoir commenc trait hi soir a heur heur cet nuit avoir oubli reveil et avoir donc pris a heur etre grav
244;medic rembours
245;y medic risqu malad pend semain arret medic
246;qu etre que medic
247;medic trait medic pour fill mois pouv dir medic long term si medic risqu pour sant
248;dois evit certain aliment avec kardefic j avoir peur que efficac var
249;quel etre version non gener medic
250;le person qui avoir avoir medic prendr medic avoir avoir effet secondair a part photosensibilis
251;le l122 aid a brul maigr
252;medic quoi sert medic medic
253;etre qu doit arret medic si medic envi beb
254;medic depend o bout combien jour
255;avoir avoir quelqu problem malad et voul savoir si en fais mettr implant risqu voir affreux bouton reapparaitrent
256;quel typ medic etre medic
257;etre sous cerazet depuis q mois ment depuis semain environ avoir pert blanch bip plus abond que habitud dois inquiet
258;quel medic contr malad col uterus
259;exist gener medic medic composit
260;prend medic mois derni avoir avoir saign lor ordinal semain plaquet mois ci ca recomment plus bel et le saign etre vrai comm pet debut regl et plus import etre medic quoi medic avis
261;medic disponibl au quebec
262;peut utilis phytotherap dan trait malad
263;quand fair medic medic chez nourrisson
264;quel etre le effet secondair medic et medic
265;medic composit connaiss
266;medecin medic prescr medic et medic cepend avoir impress que medic gener commenc medic ne plus fair effet faudr que demand plutot medic et quel etre le effet secondair
267;medic plus medic
268;medic contr anxiet oui ou non
269;etre qu en medic qui avoir deja reuss a diminu le dos medic et a dorm normal
270;quel trait homeopath contr le malad
271;methadon pour remplac medic
272;medic pour quel indiqu +c438
273;quel etre etre risqu rencontr si accouch avant inject medic
274;souffr malad solair medecin medic conseil medic composit problem etre que ne sais pas si peux trouv ca en franqu etre que quelqu peut dir exist medic mem gener typ et si jam faut ordon
275;pilul lendemain et medic
276;gyneco medic fais piqur medic et depuis hi avoir douleur dan ventr etre que person peuvent eclairc peu
277;c quoi medic
278;avoir epanch synov apparu spontan etre alle voir homeopath qui medic prescr comprim rob nigrum foli etre trop cher avoir decouvert que medic etre indiqu dan le epanch ains qu pais mellific pens prendr medic en composit etre correct
279;medic quelqu connait
280;souhait avoir avis sur le effet implant
281;exist interact entre medic et medic
282;medic san ordon
283;quel etre le vaccin possibl dur debut malad
284;medic plus antibiot
285;j avoir eczem suit a pris naz que dois fair
286;qui etre sous medic
287;gyneco medic demand fair medic boostrix malad malad coqueluch etre enceint semain pos donc question si etre danger pour futur beb
288;fiu en cuv disponibl au planning familial
289;etre que medic crister medic hemifumarat peut bien substitu medic medic rat
290;effet ovul medic
291;medic medic etre il reserv aux adult
292;medic entrain malad normal
293;medic risqu pour beb medic naitr prendr omeprazol
294;avoir boit medic qui expir en etre raison le consomm ou etre danger
295;le sag femm avoir droit prescrir pilul contracept dan quel condit
296;carenc en medic quel trait
297;si mauvais reaction ou si compliqu suivent medic contr malad medic combien temp apres inject cel arriv moin a part quand peut dir qu medic pas mauvais reaction ou compliqu
298;avoir fais erreur en utilis medic apres avoir mis ordinal anneau avoir retir semain trop tot et san voir erreur en avoir mis autr tout suit entre temp avoir avoir rapport a risqu etre qu medic donc risqu malad ou etre que risqu etre essart vu que autr anneau medic etre inser just apres
299;sevrag medic tres difficil
300;quel etre nombr limit bas compress delivr en an
301;medic provoqu pris poid
302;malad medic autoris
303;schem vaccinal habituel etre et mois sav quel etre fourchet toler entre chaqu dos
304;desol fair chi mond dit etre que medic peu fair avoir erupt cutan sur corp apres mois pris avoir vu dermato dit allerg medic lessiv ou medic medic douch ou savon ou autr ca fais mois que ca dur medic ne fais rien ca gratt sur corp ventr bras sous le sein entre le cuiss comm roseol ca fais et ca gratt medic ide car en peu plus drol tout ca merc et encor desol
305;prend pilul medic depuis mois et depuis quas premi jour pris moral etre pas top pleur tres souvent et medic malad moment etre tres heureux etre que symptom peuvent etre dus medic pilul
306;hep depend medic
307;une prepar en pharmac demand quel etre quantit lactos contenu dan medic eh
308;carenc en medic que fair
309;medic et apne sommeil
310;qu etre qu orgastoro
311;vien lir notic qui dit que dois prendr medic apres fin pilul holygiem alor que gyneco medic dit prendr ordinal jour regl alor quand dois prendr
312;medic derembours
313;medecin prescr medic par que medic peut fair gross ceux qui en pren etre que avoir gross
314;depuis que avoir pris pilul medic medic quelqu mois avoir petit tach sang ou marron san gravit aujourd huy avoir saign comm debut regl assez leg ne sais pas qu faut que fass
315;qu medic dan medic medic
316;etre que medic augment appet et don env mang
317;medic bug a fil mois
318;prend medic combien temp dur effet rebond decr dan notic
319;luteal gai plus medic gai medic egal bon menag
320;prend drill et avoir du oubli comprim et ne avoir pa repr voul savoir si aret mard comm habitud ou si prend tss le comprim
321;souffr difficult erect quelqu medic deja utilis remed homeopath si oui lequel et avec quel resultat
322;medic et age
323;enceint sous trait medic composit etre problem
324;medic plus medic
325;dang medic a long term
326;comment fonction cholecalciferol
327;peut propos medic pend malad
328;medic fait gross
329;etre pass sous fiu medic avoir mainten plaqu roug bouton sur le deux jou que fair
330;combien temp dur le effet indesir medic medic
331;peut prendr medic et medic en mem temp
332;quel etre le princip actif medic
333;enchain plaquet adepal et repris
334;une patient trait par medic crem et ovul inquiet car urologu mar medic preconis evit le rapport sexuel pend qu etre trait par medic pour evit affect le troubl prostat mar
335;medic plus medic plus avocardil jr
336;femm utilis medic depuis mois vient annonc qu medic douleur dan sein et qu sen presenc petit corp qui fait malad pouv dir si ca peux ven pilul medic
337;termin plaquet obel g dimanch soir vais avoir le regl quelqu jour apres etre a dir jeud si avoir rapport sexuel avec ami etre que pend cet period quelqu jour etre tout mem proteg
338;exist coup fil vendus au detail
339;effet secondair possibl chibroproscar
340;medic medic medic fort liaison au protein plasmat
341;medic et libido quel effet
342;rejet
343;medic retard regl sous medic etre normal
344;une femm enceint peut prendr medic stodal
345;qui connait remicad
346;mard et vendred avoir carr oubli prendr pilul medic et ai fin plaquet dimanch soir avoir pas encor regl depuis hi soir ai bien malad au bas ventr tir et impress que regl vont arriv rien pens qu avoir risqu que etre enceint avec oubl
347;peut prendr anxiolyt en mem temp que medic osa
348;etre que le vitamin en cachet font gross
349;avoir achet aujourd pot spirulin en medic marqu flam vert ne sais pas comment utilis
350;medic quoi sert medic
351;medic etre rembours
352;medecin fait chang pilul actuel etre medic medic enfin avoir pris derni comprim actif hi rest donc le placebo puis commenc medic aujourd huy
353;etre que melatonin etre rembours
354;medic contr malad medic
355;medic quin prestig c etre quoi dedan
356;etre que medic entrain retard regl
357;medic effet secondair
358;medic hypokaliem etre effet indesir medic
359;peut ecras le comprim medic op pour le dissoudr dan medic
360;medic paroxetin perim e risqu connus
361;reaction bizarr medic medic egal allerg
362;medic nitriqu composit indiqu
363;medic et pilul
364;quel etre gener medic
365;medic peut provoqu symptom
366;etre en semain arret et avoir oubli recommenc plaquet suppos que vais devoir attendr le prochain regl pour recommenc plaquet ca peut prendr temp non
367;puis fair test malad semain apres rapport
368;plus fiu comport medic et plus efficac augment medic ne peut pas auss etre toxiqu pour femm medic vrai aucun risqu pour sant mem dan cas exceptionnel
369;piscin apres medic etre possibl
