;question
6054;bonjour medic tout e aim savoir si prendr comprim medic composit etre grav avoir an merc
6055;medic qu en dir
6056;combien temp puis utilis medic apres avoir ouvert
6057;quel medic pour remplac ftp
6058;j avoir avoir arret jour pris pilul dev reprendr ordinal comprim plaquet vendred et ne avoir pris que samed dois proteg
6059;quelqu medic deja pris medic pour arret fum
6060;sav si medic fait gross
6061;conserv medic composit medic
6062;tomb enceint sous medic quel risqu
6063;cyclan par quel pilul commenc
6064;gener medic
6065;combien temp attent apres arret medic
6066;utilis presqu quotidien medic contr le malad voudr savoir si etre danger pour sant
6067;apres oubl melod que fair
6068;peut prendr medic pend malad
6069;pharmacodynam betaserc
6070;le medecin medic oblig mention pharmacien qui delivr medic
6071;medic quel class trait appartient medic
6072;medic medic peut entrain augment medic
6073;quel etre posolog medic olivi medic europ
6074;medic inject medic depuis jour avoir malad a tet quand fais certain mouv pens que etre li a medic
6075;avoir commenc medic pour premi fois et regl viennent just fin voul savoir si peux mainten avoir rapport san cour risqu tomb enceint parcour forum et etre question jour parfois et malad fois etre activ premi pris ne sais plus quoi pens
6076;le medic peut entrain malad
6077;comment separ medic
6078;avec medic medic beaucoup different entre prendr composit par jour et composit
6079;quel etre posolog lauri nobl en inhal humid
6080;medic peut conduir vehicul
6081;pourquoi prendr dexorat
6082;quel etre bilan pre therapeut a realis avant instaur trait par medic
6083;ne support pas le antidepresseur medic
6084;veux prendr tus au bout combien temp cel fait effet
6085;aim savoir si medic nouveau etre disponibl en pharmac actuel
6086;etre possibl decal le regl avec medic etre don qu medic pas arret entre le plaquet
6087;pos question aux sujet medic medic secur social rembours entier le inject
6088;medic quoi sert medic
6089;etre sous medic avoir trais malad medic epaul droit quelqu peu en dir plus
6090;medic gai dur malad
6091;faut realis bilan ophtalmolog avant debut trait par medic
6092;avoir pris medic pst age et aim avoir beb combien temp faut en general pour tomb enceint
6093;patch medic appliqu combien temp avant medic
6094;prescript renouvel pour medic
6095;quand prend ibuprofen puis prendr medic auss
6096;avoir fait surdosag leg 8gr3 au paracetamol peu propfan auss jour apres ordinal surdos raval gr paracetamol deux jour plus tard aval gr medic antalg puis lund gr paracetamol mard gr paracetamol diantalvic mercred mgr jeud gr vendred gr samed et dimanch gr chaqu jour deux jour plus tard reprend gr jour apres aval gr etre derni comprim et cel fait mois que ne prend plus aucun medic tss confondus et encor moin en surdosag malad medicament ne peut surg mois apres alor que medic medic etre incrimin medic etre supprim concret risqu qlq chos ou pir etre derri
6097;j avoir malad avec medic que dois fair
6098;prend pilul melod car ne support pas medic cet pilul etre pris en continu avec comprim inact voudr ne pas avoir regl comment doit mis prendr avec cet pilul pour ne pas le avoir
6099;j avoir souc avec medecin qui prescr medic a patient tous le jour delivr pour jour comment delivr
6100;comment dilu medic mer
6101;en combien temp effet medic dissip
6102;medic contr symptom
6103;combien dos normal medic
6104;qui connait medic
6105;avoir pass medic decontractyl qui etre myorelax pend jour et apres avoir arret avoir avoir violent malad gross plaqu roug et epaiss accompagn violent demangeaison et brulur prend min plus locoid depuis jour etre que etre compos decontractyl qui peut etre a origin cet malad etre possibl que fass allerg
6106;sous medic etre deja arriv enchain plaquet en enchain direct avec le comprim derni couleur vien seul realis que avoir pris ordinal plaquet entier fait que avoir avoir pert sang tout mois peut etre sign quelqu chos
6107;medecin medic prescr medic comm antipaludeen le effet secondair etre si terribl effet deprim
6108;le medic peut etre utilis chez patient myasthen
6109;malad affect reunion collegu medic parl medic palustr composit etre que posolog comprim par jour etre valabl auss pour le enfant
6110;etre sous melod avant sous tricilest et cel fait quelqu jour que avoir saign alor que etre au milieu plaquet quelqu avoir ide etre sign quelqu chos
6111;etre sous medic composit etre vrai danger pour sant
6112;une patient actuel trait par medic crister souhait diminu le dos pour progress arret trait coup donc le comprim en deux peut continu
6113;etre sous sac et a caus produit avoir bip chang personnal avoir plus motiv pour le etud en foutist insensibl et honnet avoir plus interet dan rien et commenc a sent trist cet etat quelqu connait cet etat
6114;etre part en geek en et malheur avoir oubli plaquet medic resultat voila jour que avoir pas pris pilul que dois fair prendr le cachet et prendr celui soir a heur habituel sach que avoir pas rapport avant semain car copain etre en voyag affair
6115;medic en mang
6116;dois fair rappel medic et polio medic voul savoir si pouv fair mem a quel endroit dois piqu
6117;medic si pas pris heur apres heur habituel
6118;avoir recent quitt medic pour medic peu habitu medic nouvel present plaquet avoir oubl le pilul derni semain apres avoir lu notic medic avoir repr normal pilul jour plus tard appret medic reprendr nouvel plaquet ordinal depuis oubl souhait savoir qu vaut mieux fair pour que tout redevien normal arret pilul pend plusieur mois continu prendr normal
6119;effet secondair melod combien temp
6120;depend au medic
6121;pourquoi prendr medic
6122;quel compl pour medic
6123;qu etre que medic
6124;une patient souhait savoir si peut fum avec pris medic composit
6125;medic effet secondair medic long term
6126;medic a long term dang
6127;grossess et medic
6128;medic etre delivr sur ordon seul
6129;etre asthmat et etre sous medic et medic tous le jour etre que medic peuvent avoir influenc sur taux medic
6130;medic et cytochrom p450
6131;etre sous medic depuis plus mois et avoir impress que avoir effet physiqu fourmill vu perturb malad tet lorsqu malad sommeil peut renseign sur problem
6132;lequel agit plus rapid medic en medic ou en medic
6133;medic medic medic lisopain peux
6134;medic propos celesten question sep
6135;le contracept luthenyl medic effet gen
6136;etre normal prescrir medic k pour beb qui etre pas sous lait maternel
6137;etre que medic etre danger
6138;medic quel dosag existent
6139;medic et pris poid envi mang plus
6140;pris medic et silic compatibl
6141;apres mois trait avec medic dermato prescr tetramysal dois prendr toujour deux cachet gelul seul la le pris ne doivent plus fair pend rep en dehor sach que fais muscul et que mang reguli heur heur heur heur heur voudr savoir quand pourr prendr mani optimal le gelul sach que dois fair pris par jour gelul
6142;etre fais pos fiu medic mi mar medic jour avoir toujour pas cycl reguli au bout combien temp cycl etre il devenus reguli
6143;c etre gener quel medic medic
6144;medic efficac medic part quand
6145;medic et methadon mem indiqu
6146;effet secondair medic
6147;medic medic chez nourrisson
6148;etre fait install medic en septembr quand dois chang
6149;medic etre rembours
6150;medic et malad
6151;medic risqu accoutum
6152;bonjour connaiss medic ou medic contr le ronfl
6153;puis procur medic spermicid san ordon
6154;lor instaur medic medic foliqu etre indispens
6155;quelqu connait trait pour le torticol et contractur tres reguli a deux fois par semain
6156;vient arret bustar pour lisanxi medic pas trop problem sevrag
6157;medic jour puis augment
6158;quelqu medic deja avoir effet secondair avec gattili
6159;voudr savoir si fois premi pris pilul lumali etre contracept ou fall attendr
6160;biolectr medic fort qu etre
6161;prend medic par jour medecin medic dit remont donc par jour cel va mieux etre pas top pens qu fall mont ad
6162;je etre sous pilul medic ge etre rendu compt matin a heur que avoir oubli prendr pilul 4e jour etre que peux continu normal pris pilul et fair paus normal
6163;medic sous soleil
6164;quand revient medic quant
6165;medic part quel age peut prescrir dais stick boiron
6166;que fair contr myelit
6167;utilis medic depuis mois et depuis jour avoir plaqu roug qui apparaissent sur corp etre normal
6168;souffr malad tet tres fort souhait suivr trait fond homeopath quelqu pourr indiqu pist plait
6169;j avoir oubli prendr premi pilul plaquet puis demarr avec jour retard tout en etre proteg
6170;pilul et medic etre mauv ou pas
6171;qu etre que medic
6172;medic protein oeuf dan medic medic
6173;quel effet secondair pour medic
6174;medic plus medic etre danger
6175;medic qui adress medic gai
6176;etre danger fair vaccin malad
6177;medic et medic ca va ensembl
6178;quel special etre disponibl pour le malad gorg autr que medic ou medic
6179;debut medic a 2cp
6180;prend actuel tt fond e150 composit medic pour trait malad faut arret trait en cas malad
6181;medic et antibiot
6182;je souhait fair pos sterilet medic aim savoir apres pos sterilet avoir avoir regl pend combien temp quantit regl normal pend jar puis spotting
6183;prend medic composit dosag initial etre comprim si sen bien si ca va bof et quand ca ne va pas suit a problem personnel avoir pris comprim et aim savoir si peut avoir consequent
6184;prendr decongestionen typ delirium etre que etre contr indiqu avec pris steroid
6185;medic sert a dorm
6186;voudr consult pour ami qui medic problem excit personnal avec medic avoir temoignag
6187;connaiss medic contr adne et peau grass
6188;pris medic surdosag dang
6189;quel etre nom gener melod
6190;trinordiol principal effet indesir
6191;avoir avoir regl jour apres debut plaquet medic gai etre inquiet medic avis
6192;etre que oubl mois precedent rend pris pilul plair inefficac
6193;quel etre dem vi medic
6194;comment decal regl avec medic patch
6195;prend habituel medic hui pharmacien medic don luteal gai etre mem pilul
6196;avoir remarqu aujourd huy malad heur que avoir oubli prendr pilul derni plaquet lund mard mercred et avoir avoir rapport non proteg mercred et jeud matin etre que avoir risqu malad
6197;aujourd huy etre tres stress et voudr reprendr calcibronat peut procur en pharmac san ordon
6198;medic etre stimul
6199;quel etre altern therapeut pour ruptur medic
6200;medic malad medic obligatoir
6201;medic quoi servent medic medic et medic
6202;medic dos peut etre utilis pour main
6203;question sur medic
6204;enceint 16sa et ca fais mois qui avoir vaccin malad pens que etre trop tot pour que medic agiss
6205;pour stopp le grignotag au malad fall prendr medic amarr en composit problem etre que ne sais pas combien granul ni combien fois
6206;qui peut prescrir medic
6207;avoir achet medic contr malad hi medic quand dois fair medic
6208;etre que patch medic etre disponibl au quebec
6209;combien temp attendr avant le effet medic
6210;voul savoir si medic medic fait prendr poid
6211;maigr avec medic etre possibl
6212;avoir voulu mettr patch medic en haut fess cepend avoir mis plutot en bas dos etre que ca peut pos problem
6213;medic
6214;gyneco medic prescr medic car depuis que avoir arret pilul regl ne etre pas revenu p etre que ne comprend pas ordon et que avoir pas envi rappel car etre peu aimabl quand dois prendr etre que quelqu etre d situat merc
6215;medic peut etre danger
6216;dois fair vaccin malad seul dit que ca fais en plusieur inject etre vrai merc
6217;medic trait hormonal substitut qui ne fait pas prendr poid
6218;quel malad exact couvr medic tetr
6219;etre que medic peut provoqu malad chez femm enceint
6220;vaccin et malad
6221;quand dois prendr medic
6222;medic egal dodo normal
6223;etre qu peut fair cur medic et mineral et prendr antidepresseur
6224;voudr savoir si adepal fait gross ou don envi mang
6225;medic medic caus effet posit contr le toc obsess pens repetit
6226;quel etre del action medic
6227;prend medic et avoir oubli mercred soir et jeud soir en etre rendu compt vendred matin hi avoir pris pilul matin et soir et pour aujourd huy pareil pour rattrap le pilul etre que corp peut support pilul en jour
6228;ordon etranger medic peut delivr
6229;malad urinair femm que chois comm antibiot
6230;lutenyl et malad
6231;pharmacien medic don medic bichromicum composit pour fill margot mois kg enrhum combien en don
6232;avoir langu enfle quand prend paracetamol qui peu aid
6233;fil fait medic et malad sur malad pediatr medic conseil medic oral etre que ca fait longtemp que ca exist
6234;voudr savoir comment agit medic sur homm puis attendr augment consider testosteron
6235;etre dan ordinal mois malad et souffr hemorooid sav pend combien jour dois prendr le granul
6236;medic pharmacien voudr connaitr taux rembours medic
6237;medic qui en utilis et pourquoi
6238;malad sous medic frequenc
6239;pour ne pas oubli pilul medic avoir pris heur avant heur habituel etre bon action que avoir fais ou avoir fais betis
6240;biceptin dan oeil grav
6241;medic etre bien pilul dos
6242;puc medic avoir premi medic medic jour etre ronchon pleur bip veut le bras dort tres malad et surtout mang peu tres peu pouv dir combien temp il peuvent dur
6243;etre qu peut prendr medic composit pend malad
6244;voul savoir si medic march bien pour symptom
6245;la pris poid etre effet indesir commun medic
6246;voudr savoir qui parm le internaut avoir pris medic cystein et qui medic avoir deregl au niveau regl
6247;ordinal plaquet medic pas regl
6248;medic quoi sert felden
6249;medic contr malad medic
6250;prend systemat poid avec medic
6251;qu etre qu medic
6252;le futur maman peuvent elle prendr medic
6253;medic des beb possibl ou pas
6254;que prendr pour fair pass deprim post parfum
6255;enfant sous trait medic
6256;composit medic risqu quoi
6257;bonjour etre prevu que pren pilul medic prochain en con pas bien le caracterist medic dit qu ne fall pas fum or fum depuis deux an quel etre donc le risqu courus et effet merc
6258;le ciclosporin en malad etre disponibl en vill ou qu en puy
6259;medic pour preven tetanos
6260;combien temp apres arret medic etre possibl boir medic
6261;etre que medic etre efficac pour le cris epileps
6262;etre que quelqu pourr renseign sur le consequent arret pilul medic etre que hormon mettent temp a reprendr activ normal
6263;medic et heur pris
6264;combien cout environ boit ou mem comprim medic
6265;paracetamol peut etre danger tous le jar
6266;hello
6267;avoir deja fait deux inject medic medic et depuis etat moral etre degrad que conseil
6268;medic pour combattr le infect nosocomial
6269;que fair pour preven malad chez enfant an
6270;vien prendr dupahaston pour mieux regul cycl avoir regl bec plus abond que habitud effet connu etre que pris poid peut etre effet indesir
6271;version gener cyclan
6272;regl trais abond avec implant aim savoir quel etre medic
6273;prix vignet medic
6274;qui connait medic
6275;etre sous pilul medic pend mois puis etre repass sous carlin sur notic medic marqu que le regl doivent interven dan le jour suiv pris premi comprim hor ca fait plus semain et toujour rien puis etre enceint
6276;medic medic plus alcool
6277;medic et medic
6278;etre sous medic march pas medecin medic prescr medic composit comprim matin apres combien temp fait effet
6279;j eprouv mont symptom malad musculair sen decupl deprim malad passiv symptom apres arret medic etre sevr
6280;quel etre prix public rosavastatin
6281;medic dan le deprim ou petit depress
6282;avoir avoir rapport non proteg et avoir oubli pilul avoir donc pris pilul lendemain environ heur medic heur pas plus apres relat non proteg etait ecrit sur notic que pour maximum efficac faut prendr pilul lendemain d le heur qui suivent relat dan cas etre que efficac etre bon mem si etre heur tout just
6283;avoir pris poid a kilos sous lutenyl voudr savoir si quelqu et dan mem cas que
6284;comment agit toxin botul
6285;medic arret medic etre que cycl menstruel etre long pour reven
6286;prendr anti psychot peut cre souc chez celui qui le medic pris en longu dur et veut arret par rapport au medic ou dur pris symptom et voix par exempl
6287;medic leo contient medic osid
6288;si prend medic composit jour medic risqu depend
6289;bonjour aim avoir temoignag fill qui etre pass medic a medic comment support medic comment support medic pour part dois commenc medic mois prochain car au bout an medic et quas kg en plus pris de ordinal mois le medecin avoir decid que pour evit en prendr encor plus car etre qui pass de que ne fais plus attent val mieux arret par contr symptom total car medic etre trais efficac par rapport a acne donc dr medic prom etre essai si le bouton reviennent recomment medic bon merc
6290;quel calm peut prendr pour piqur insect
6291;plus effet avec dexorat que fair
6292;avoir perdu plaquet pilul medic gai ne rest dessus que derni cachet que avoir donc pas pu prendr regl avoir etre avanc jour etre que dois entam prochain plaquet avec jour avanc par rapport a habitud merc
6293;quelqu connait medic
6294;aim avoir quelqu infos sur vaccin medic quant et not sur qui etre pris en charg ou non
6295;qu etre que medic
6296;bonjour prend medic depuis an et dem composit pour troubl anxieux et avoir decid arret medic caus effet indesir particuli gen etre pert quas complet libido avoir plus aucun des sexuel au quotidien depuis que prend et etre don que avoir copin depuis peu souhait que libido revien psy medic prescr medic medic plac composit et prend depuis jour pour moment des etre toujour pas revenu pens qu faut certain temp avant que le effet indesir medic disparaissent
6297;the compatibl avec medic
6298;medic nouvel reglement
6299;medic quel etre gener
6300;etre en malad depuis mois et medecin medic prescr temozepam composit pour dorm et medic dit que etre pas recommand pour le person en malad etre vrai
6301;avoir fait vaccin pt bout et an avec vaccin tout en et avoir lu temoignag sur petit avoir fait medic et avoir developp malad pas tres agreabl peu temp apres dois inquiet pour aven ou bien le effet secondair arrivent il dan del assez court
6302;medic lis que etre pir en mati effet secondair sexuel le homm surtout plaignent ne plus avoir orgasm qu en etre
6303;demand pourquoi etre si import fair dissoudr medic dan verr medic que pass si aval cachet comm ca
6304;median plus p ou pas
6305;le epong medic etre elle disponibl quelqu part
6306;retr medic depuis jour symptom import
6307;quel problem attendr avec medic
6308;vient prescrir natron composit etre vrai somnifer
6309;medic quel class therapeut appartient medic
6310;etre sous medic et gyneco vient pass posolog comprim a comprim par jour depuis cet nuit avoir comm malad estomac etre que ca peut etre li
6311;beb souffr ego et malad motriqu system digest medic malad a evacu rot que pourr don pour aid a le evacu
6312;malad malad puis recevoir medic
6313;medic patient souhait connaitr posolog habituel pour medic lyon
6314;medic et enceint
6315;depuis plus an avoir implant par suit avoir regl normal et depuis quelqu temp avoir regl pend plus deux semain et elle etre trais abond aim savoir si certain entre rencontr genr problem
6316;que fair en cas effet secondair avec medic
6317;bonjour medecin medic prescr medic pour malad suit a malad assez longu seul voila cel fait jour que en prend et avoir impress fair retour en arrier et retrouv le symptom malad crois que prefer arret medic voudr savoir si en jou corp etre accoutum a molecul croi que arret va etre doulour esper que repondr rapid merc
6318;paracetamol et malad
6319;medic comm antidepresseur
6320;medic en allemagn
6321;medic part combien temp peut avoir rapport sexuel apres administr medic
6322;qu etre que medic
6323;il medic ovul malgr pris medic etre qu medic risqu
6324;puis prendr medic en etre pas encor enceint en projet pour si ca empech pas par rapport a fertil
6325;y medic nouveau en term rembours pour medic ou etre toujour rembours qu en cas malad et malad hepat
6326;voudr savoir si entre medic rencontr problem avec sterilet medic
6327;gener medic
6328;point cot gauch sous medic et implant
6329;medic contr malad
6330;une dam qui ressent symptom picot petit contract dan jamb temp en temp conseil quoi
6331;prescript medic quel regl
6332;medic contr malad
6333;je prend medic et avoir oubli comprim avoir regl mem si commenc nouvel plaquet san fair arret jour comm etre prevu normal
6334;qui connait medic
6335;pilul medic arret le regl de ordinal pris
6336;que don a beb moin mois pour malad mis a part medic
6337;prend griffon pour etat depress suit medic souc sant et voudr savoir si peux associ thyroxin au griffon
6338;medic caf egal
6339;effet secondair medic
6340;que fair quand tomb enceint sous medic
6341;depuis juin que polio etre plus produit quel medic remplac
6342;mon medecin avoir prescr medic granul enrob en sachet pour trait malad le granul ne dissolvent pas dan verr medic comment doit fair
6343;faudr fair rappel rotarix tous le an
6344;medic courb absorpt
6345;medic plus medic
6346;saign apres medic frequent
6347;ticagrelor peut provoqu bronchospasm
6348;quel etre le different tricycl
6349;cerazet a long term
6350;quel medic essentiel pour trait contr le malad
6351;medic et androc entrainent il photo sensibilis
6352;futur pap medic bien medic risqu pour beb
6353;que conseil comm calm homeopath pour malad
6354;seroxat augment tiqu malad
6355;je demand si fait prendr gelul medic gain absorpt gelul bardan que prend pour soign malad
6356;comment ger factur medic beclometason et medic budesonid pour trait chez adult
6357;bonjour des avoir renseign avoir avoir medic qui appel medic et etre sens etreun pilul contracept ne vois pas ou etre pressi evit tel vrai le malad merc repons messag edit par audreymaz a
6358;pilul medic comment fonction
6359;go syndic peut etre rembours si prescr par medecin general
6360;lumali efficac en combien temp
6361;medic codein en ruptur stock
6362;prend medic pend malad etre ok
6363;question sur medic
6364;comment fonction medic
6365;e pourr en dir plus sur medic medic
6366;le medic qui etre inscrit officiel au repertoir en gener medic et qui medic deux fournisseur sandow et lev pos problem car medic et medic etre indiqu des an dan ami sandow alor qu etre indiqu officiel qu a part an pour celui lev doit neanmoin substitu medic par lev
6367;etre methadon travers barri placentair
6368;medic egal tt malad
6369;c etre depuis quand que medic etre vendu en pharmac
6370;connaiss pilul moin fort que medic qui conviendr
6371;mer pass medic medic ou appliqu
6372;peut prendr medic avec rep arros
6373;medic dur heur en pris
6374;quel etre bilan a realis avant debut trait par medic
6375;pilul medic peu dos
6376;sav si avoir besoin ordo pour procur medic not pour boostrix
6377;docteur vient reduir dos medic a composit car vais beaucoup mieux et que souhait enfant puis commenc a prendr medic foliqu
6378;bonjour prend pilul medic or derni pris pilul dat mercred novembr et avoir avoir regl dimanch decembr depuis avoir pas repr pilul voul savoir si repren des soir si etre proteg ou pas merc repons
6379;je dois auss fair vaccin contr malad apparent le vaccin ne etre pas conseil sous trait medic pouv eclair a sujet
6380;etre que isotretinoin fait baiss moral ou rend depress
6381;quel etre indiqu medic op chez femm
6382;malad combien temp apres medic peut fair test serolog
6383;etre qu peut utilis medic pend malad
6384;sterilet medic et regl tous le jour
6385;peut substitu medic
6386;quid cerazet
6387;que conseil en medic en trait concomit a medic
6388;etre a nouveau enceint et medecin medic prescr medic au ordinal trimestr or avoir lu plusieur fois que medic avoir aucun indiqu pend malad medic risqu pour beb
6389;medecin trait medic prescr antibiot medic seul plus heur apres pris cet antibiot avoir avoir diapr assez sever puis avoir vom quelqu heur apres etre que efficac antibiot va voir diminu
6390;pourquoi sent mieux apres avoir pris medic
6391;peut prescrir corticoid a femm enceint
6392;combien medic dan tub medic boiron
6393;sous amoclan eh composit amoxillin et composit medic claniqu suit a malad avoir malad qui etre developp au niveau genciv et sinus que fair exist autr antibiot plus efficac
6394;aujourd huy avoir fais pris sang sur mem bras que implant medic avoir aim savoir si medic risqu quelconqu diminu efficac implant etre don que etre mem cot
6395;surgeston et medic peut trait malad en medic
6396;different entre medic et lexotanil
6397;medic diminu irrit
6398;quel etre le posolog moyen medic chez enfant
6399;vien fin ordinal plaquet medic gai m etre tus pas regl etre normal ou dois fair souc
6400;medic mis en plac
6401;comment dilu medic methylen
6402;prend actuel medic etre medic etre incompatibl avec pris medic
6403;quel effet nefast suit a pris emethotrexat
6404;bonjour medecin trait medic prescr depuis hi medic composit a fois par jour pour etat symptom const cris paniqu peur dan le magasin peur conduir pouv temoign effet secondair ressent au debut posit comm negat avoir oubli auss precis que etre sous medic retard soir et medic simpl deux fois par jour pour medecin peux continu le deux vais pas etre trop somnolent avec le deux merc
6405;en avoir marr jur avoir arret prendr medic plusieur mois vu que avoir malad avoir decid commenc medic alor le effet etre si horribl que sais plus quoi fair pert brun continuel irrit malad malad malad et en plus sais tres bien qu au bout mois ca etre toujour pareil avoir deja vecu connaiss pas autr method que pilul qui medic pas effet secondair qui par contr etre benef sur malad
6406;medic malad medic pour beb
6407;sterilet medic peut influenc sur taux sucr dan sang
6408;sous medic depuis peu temp au bout combien temp etre proteg
6409;medic don officiel
6410;rel a an etre recommand
6411;j avoir enorm malad allait amoxicilin etre contr indiqu
6412;etre sous medic depuis mai regl avoir pas trop chang puis mois ci bip moin que habitud etre normal
6413;comment perdr poid pris avec medic
6414;quel etre dosag maximum transgen en pris
6415;medic foliqu effet secondair
6416;medic et le nerf
