;question
4035;medic et risqu malad
4036;avoir oubli prendr pilul medic en etre apercu dan le douz heur prend pilul malad heur et la avoir pris malad heur matin etre inquiet
4037;le antidepresseur etre respons malad auto immun
4038;mon medecin avoir prescr medic composit et avoir oubli dir que avoir etre oper occlus intestinal medic age etre que peux quand mem prendr medic
4039;medic a quatorz an etre possibl
4040;medic posolog
4041;prend medic pour ordinal fois sen a nouveau extrem tendu crisp reveil a nouveau en plein nuit san pouvoir rendorm cet baiss regim et insomn etre elle normal apres semain accalm
4042;medic pour dorm
4043;vien commenc medic reveil tout le nuit qui ne arriv jam habitud sen nerveux et surtout avoir plus faim de experient similair
4044;medecin medic don trait dont medic cet fois ci a premi pris avoir avoir tres gross reaction allerg etre normal
4045;medic au medic vais avoir le effet indesir debut
4046;prend pilul lest et la avoir peu malad au ventr avoir egal regl alor que avoir du le avoir dimanch ou lund janvi que dois fair
4047;etre sous medic voila mois etre pass sous medic et depuis chang regl etre moin en moin import voir trais trais discret etre normal ou devr plutot incit selon
4048;puis prendr comprim medic sort blist depuis semain
4049;depend medic
4050;yasminel empech ovul ou pas
4051;sous quel form present medic composit
4052;que prendr en cas regl doulour
4053;medic risqu accoutum
4054;medic effet posit quand
4055;sous medic avoir decid diminu le quantit mani progress avoir etre victim symptom accompagn sensat intens chaleur pert equilibr et troubl vu pens que diminu quantit bet bloqu peut entrain genr symptom
4056;medic qui connait
4057;il medic risqu enchain plaquet medic
4058;etre qu anti depresseur entrain ruptur anevr
4059;qu etre que remicad
4060;etre qu peut fair pos sterilet au medic en dehor regl
4061;quel etre le moin medic
4062;bonjour etre sous pilul depuis age medic et mois ci avoir arret pour reprendr demain et avoir toujour rien avoir mis a part leger trac ros pal sur papi ne avoir pas oubli pos plein question etre que cel etre deja arriv merc avanc et bon reveillon
4063;homeopath medic prescr medic medic a prendr fois par jour faut le prendr preferent loin rep ou soir
4064;petit question sur strepsil
4065;efflexor matin ou soir
4066;sous antibiot medic
4067;medic elimin medic fait par voi renal ou hepat
4068;dois prendr toujour deux cachet gelul tetramysal le pris ne doivent plus fair pend rep voudr savoir quand pourr le prendr mani optimal sach que dois fair pris par jour gelul
4069;une medecin dermatologu a retrait souhait connaitr dat retour medic crem
4070;oubl comprim medic heur oubl fais quoi
4071;j avoir patient qui amen ordon enfant mois et an pour box quel etre indiqu et util
4072;ibuprofen etre danger
4073;medic j10 a quand le effet posit
4074;quel etre gener medic
4075;peut trouv medic tp ou ftp en ital
4076;medecin prescr medic coud composit pour troubl sommeil pourt lis partout que pour cet caus composit qu faut quel etre bon dosag
4077;urgent j+5 apres arret pilul medic et pas regl normal
4078;avoir deja pris medic medic an sur dur an et dem san aucun souc nouveau etre trait depuis tout prit peu plus mois au bout semain etre mis medic avoir plaqu qui demang ca gratt et ca gonfl ca fait comm piqur orti sur peau avoir vu medecin et medic don medic medic prendr anti allerg vien commenc matin et etre bien vrai cel medic calm malad sur notic medic medic not pour le effet indesir tres rar erupt cutan etre pourquoi demand si souc medic pas lien avec anti depresseur peut etre que q medic deja rencontr souc
4079;pouv dir si medic etre efficac pour lut contr le ide noir
4080;medic medic etre rembours
4081;avoir avoir effet secondair apres pris medic
4082;effet posit medic pas tout journ
4083;vien prendr composit medic risqu quoi
4084;la pilul medic etre pilul fort dos
4085;je voul savoir si pouv prendr pilul peu en avanc ln avoir lu que etre possibl aim savoir si lendemain dev prendr a mem heur et si effet contracept etre toujour conserv
4086;comment trait pied athlet chez enfant an
4087;si etre enceint etre pas danger prendr luteran
4088;medic babybalm retir march
4089;dois fair medic malad medic etre allerg aux oeuf voudr donc savoir si import qu trac oeuf etre presentent dan medic
4090;medic etre normal avoir douleur au ventr
4091;vous connaiss medic pour soign malad
4092;etre que ghb trait malad et depress
4093;etre que peut achet medic san ordon
4094;qu etre que medic
4095;etre que medic etre effect des premi pris qu etre que cel fait si commenc plaquet alor que avoir pas encor regl
4096;y medic effet secondair pend le premi semain medic symptom cris angoiss
4097;comment prepar hepar medic d8 et medic auto cultum d3
4098;avoir deja avoir effet secondair avec medic
4099;medic prescr medic quel etre le effet secondair que ca occasion
4100;qu etre que medic
4101;roacutan question
4102;medic pour enfant an
4103;souhait fair vaccin contr malad avoir peur si fais medic jour ci ne plus etre immunis en fevri
4104;et medic qu en sav
4105;bonjour prend pilul medic gai depuis mainten mois dois prendr comprim pend jour puis fair paus jour voul savoir si pend cet period jour pouv avoir rapport avec copain merc avanc pour repons
4106;plus aim savoir etre necessair prendr medic tous le jour a mem heur
4107;oubl melod que fair
4108;prend pilul cerazet et avoir saign depuis semain comment etre possibl avec organ femm
4109;j avoir pris pilul deux fois en journ qu etre que risqu
4110;peut prescrir medic pend malad
4111;quel etre le chang observ a arret ovul
4112;etre qu peut prendr medic pend malad
4113;malad avec medic
4114;etre que peux prendr medic pour symptom
4115;une patient etre vu prescrir medic eh par medecin derni avoir pas specifi posolog souhait donc savoir combien fois utilis produit
4116;comment savoir dosag griffon
4117;etre q peux prendr comprim medic coup au lieu
4118;bonjour prend medic depuis peu plus deux semain et depuis coq jour avoir malad a respir etre comm oppress arriv pas a inspir profond etre que avoir avoir cas qu en pens
4119;medic medic fait perdr poid
4120;malad insupport et medic
4121;anciennet trait medic
4122;combien cout boit medic
4123;medic besoin renseign sep
4124;bonjour pi don medic associ medic et medic merc repondr
4125;demand si pouv prendr medic et medic en mem temp
4126;perdu poid avec medic
4127;j arret progress medic avoir sensat decharg electr etre normal
4128;pilul medic etre quoi
4129;depend medic
4130;medic caus malad medecin medic prescr pulveris rhinofluimicil trois a quatr fois par jour notic etre pas clair pouv eclair
4131;veux don carentiel composit pour soir etre que avoir effet secondair
4132;medic etre medic pour quoi
4133;boit medic ou comprim
4134;prend medic gyneco dit arret et propos sterilet medic quelqu medic etre dan mem cas que comment sterilet medic support
4135;aim savoir si peux remplac dos medic en composit dos par granul medic en k ou dan autr resolu
4136;avoir lu sur notic que si comprim entre jour medic etre oubli doit prendr comprim oubli et fin plaquet cel veut donc dir que dois prendr comprim hi et celui hui en mem temp
4137;avoir pris medic pend jour consecut bip effet secondair med medic dit arret spontan medic semain et depuis avoir malad et peu enerv etre normal
4138;etre que peux prendr trait par medic matin
4139;medic gai qu etre
4140;prend sipralex depuis an avoir commenc a sent mieux apres semain depuis cet hiv etre nouveau tres fatigu parfois avoir pas forc pour fair certain chos faut dir que avoir augment dos anti depresseur depuis jour alor etre que etre le anti depresseur qui rendent auss naz ou etre symptom malad
4141;oubl pilul medic risqu
4142;commenc avec apprehens chimio jeud qui assoc medic plus medic etre que quelqu connait et peut en parl
4143;medic peut resoudr problem ejacul precoc
4144;goual savoir qu etai en le effet indesir medic
4145;peut prendr medic et fleur bach en mem temp
4146;etre sous luteal depuis deux mois et dois pass a plair quel etre march medic suivr paus ou pas paus
4147;rappel medic quant imper dan le mois
4148;medic et hta
4149;comment fonction medic col uterus
4150;comment proced a cur spirulin
4151;medic san ordon
4152;interact entre medic et cellul pour maigr
4153;question medic
4154;bonjour etre sous medic depuis mois avoir problem pert malad qui que dois fair merc avanc
4155;de quel form etre le comprim celecoxib composit zentiv
4156;medic fait gross
4157;apres install sterilet avoir avoir petit pert brunatr avec malad etc dois inquiet ou cel etre normal
4158;quelqu question sur medic
4159;quel etre le effet medic et medic medic
4160;prend millepertuis en gelul jour question etre quand dois le prendr
4161;puis prendr medic avec medic
4162;aim savoir si etre possibl ressent le effet diminu medic seul mois apres cel fait semain que ressen effet et etre pir en pir etre normal
4163;aim savoir si malad person avoir entendu parl ou utilis le dos vaccinotoxium pour evacu le toxin medic
4164;peut obten isoror san ordon
4165;medic fait gross
4166;peux inject medic medic person qui fait hemorrag
4167;medic sur ordon
4168;seropram+ medic en essais beb
4169;quel etre dos initial recommand pour medic
4170;pren jusqu alor composit medic par jour etre comprim et depuis jour etre pass a composit avoir impress aujourd huy sent malad que fair
4171;puis utilis crem medic perim deux semain
4172;medic peut etre delivr au planning familial
4173;medic besoin renseign sep
4174;aim savoir auss si etre normal si avoir encor pert brun avec trinordiol
4175;prend depuis peu oenobiol aquadrain qui expir en avril le gelul etre elle encor activ
4176;medic boit medic
4177;etre allerg au curar medic medic risqu si prend medic
4178;medic person qui avoir arret trait san retour pilos exec ou bouton avec medic
4179;prend actuel medic composit matin et soir et sent tout bizarr march bizarr sent plan parl comm si etre bourr avoir envi couch pas systemat dorm etre que effet etre deja arriv
4180;prend medic etre composit par jour qui fait total composit medic en jour quel etre le consequent
4181;medic symptom
4182;le go synvisc medic prescript reserv a certain special ou medecin general peut prescrir
4183;quel bilan biolog a instaur medic
4184;y medic beaucoup effet indesir avec medic
4185;medic qui adress medic
4186;medic hypoid et immurel etre il compatibl
4187;doit arret medic pour commenc medic ne sais pas quand car ne etre pas bien regl niveau symptom dois commenc quand
4188;medic plus medic
4189;fiu medic comm contracept
4190;microvial
4191;avoir commenc melod avoir etre sujet plusieur fois medic cris asthme et malad asthmat ia contr indiqu
4192;medic etre danger
4193;y medic risqu a ne pas fair medic malad bis avant malad
4194;melod sein gonflent et font malad etre normal
4195;medic mang moin et gross medic vu oeil pourquoi
4196;bonsoir oui oui oui habitud question concern medic vient fill aujourd huy etre jeun homm qui pos pour ami proch ami medic avoir premi relat sexuel medic plus an mer aujourd huy veut absolu qu fass medic ose pas dir non peur reaction que etre le risqu fair medic et avoir premi relat sexuel medic plus an horm non fonction medic quel etre le risqu merc pour repons
4197;peut prendr medic mid
4198;le medic medic pour enfant an kg souffr malad quel posolog met
4199;medic et medic dur malad
4200;medic medic et sepi pend malad
4201;voudr savoir etre possibl prendr le huil essentiel en gelul
4202;etre que medic continu provoqu effet indesir
4203;pourquoi oubl pilul plus heur peut don risqu malad alor que pend pos jour maximum rest proteg
4204;baldrian pour dorm etre compatibl avec medic
4205;prend pilul medic malad heur avoir pris pilul environ heur apres avoir avoir nouvel cris malad qui etre enchain tout nuit faut reprendr pilul sach que allais avoir nouvel cris en avoir pas pris avoir avoir rapport non proteg jour avant ia risqu malad
4206;etre que medic etre sous form capsul moll car dan malad special avoir pas aim cet form
4207;consomm medic fois dat perempt pass possibl
4208;quel etre le gener medic
4209;etre que medic entrain malad
4210;melod trac
4211;kelkun medic medic pour arret regl
4212;medic pend rep
4213;souhait savoir si medic aux plant medic aubepin et prepaus gattili alchemill achill etre compatibl ensembl
4214;voudr savoir si fait commenc pilul ordinal jour regl avoir risqu tomb enceint
4215;vien realis ide pour medic bug lit normal resultat au bout heur seul au bout heur voil avec indur plus mmm etre que dois comprendr que etre peut etre infect
4216;apres sevrag rivortil etre qu peut prendr medic
4217;adepal don malad
4218;etre vrai que adepal etre fort dos
4219;avoir pris antibiot rifampicin avoir lu que associ rifampicin et pilul mien medic gai etait pas bon etre cas
4220;bonjour prend gener pilul medic et le oubli ou fois dan mois mai avoir avoir regl juin comm habitud san retard depuis jour avoir pert marron roug et avoir malad au ventr et medic semain ca avoir vom etre pas vrai vom enfin etre bizarr pend oubl avoir avoir rapport non proteg aim savoir medic risqu malad ou pas comm des enfant avoir peur que etre malad nerveux merc repondr medic bientot
4221;medic et medic
4222;quelqu sait si medic anti malad etre danger enceint
4223;cel fait mois environ que etre sous medic et ne vois pas vrai amelior au bout combien temp cel fait effet
4224;lorsqu lit notic medic etre ecrit qu apres delivr symptom ne doit pas exced cel signif donc qu peut laiss en dehor frigo non dan cas etre mieux laiss au frigo aut que possibl ou faut sort
4225;quel etre le indiqu medic
4226;vendred derni avoir fait amour avec copain or samed etre part san pilul avoir donc pu prendr cel samed soir que dimanch apres mid puis avoir continu normal problem etre que plaquet termin mercred ne peux donc pas respect le jour necessair pour relanc tir que dois fair
4227;medic pour malad social
4228;une prepar souhait savoir faut prendr medic medic buvabl en sachet avant ou apres le rep
4229;etant don que avoir pris medic medic suit medic fall attendr le effet benthiqu au bout quelqu semain ou ca etre plus rapid
4230;medic don effet secondair
4231;effet secondair medic
4232;bonjour apres retr sterilet medic car ne conven pas etre repart pour pilul medic que avoir pris pend anne avant sterilet pilul peut provoqu gross malad douleur aux sein teton essouffl grand sensat faim apres avoir mang et parfois egout pour certain aliment avant support san souc et ca fait deux semain que reprend merc avanc
4233;medic quel effet
4234;risqu tomb enceint sous medic
4235;au secour dois prendr medic anti depresseur alor que etre diagnostiqu malad qui partag experient notic specif que medic etre incompatibl avec bipolar que fair que pens medecin tient apres avoir essai deroxat et medic que avoir abandon poursuis reguli trait depacok par jour qu ne suff pas merc pour repons rapid
4236;quel etre le effet secondair medic
4237;pharmacodynam medic
4238;avoir pris voix et medic fais symptom typ bouvet etre que cel pourr etre le effet secondair medic
4239;puis associ medic et medic
4240;quel etre le vaccin qu peut fair pend malad
4241;de quel special oxomemazin arroi etre gener
4242;trait au medic et au medic medic etre arret depuis vi enfer symptom et impress avoir trou dan estomac symptom insomn palpit doit consult medecin aller au urgenc
4243;prend si besoin medic apres cris symptom etre pass mainten au medic forc effet secondair
4244;bonjour medic tous avoir pet problem avoir pris deux plaquet pilul medic gai affil pour ne pas avoir regl ci problem que le avoir quand mem etre normal et surtout etre toujour proteg merc repons symptom peux etre pour rien symptom
4245;aim savoir si person deja fait cur spirulin et si cel medic vrai contribu a vaincr malad
4246;diminu douleur sein sous medic normal
4247;avoir lu que pouv don medic homeopath pour lev barrag energet suit au medic classiqu loulous age vont fair rappel plusieur vaccin medic et polio etc concret comment dois fair don le granul dos pour tous le vaccin en mem temp soir mem ou vaut mieux espac
4248;medic rend malheur en moment arriv plus medic diminu des que diminu avoir vertig malad tet au ventr etre pas bien tout que dois fair
4249;melod pas rembours
4250;medecin medic prescr medic medic pharmac medic don gener etre mem chos
4251;medic etre pris en charg dan protocol contracept pour mineur a age mani anonym et gratuit
4252;peut associ statin et antibiot
4253;vous conseil quoi en remplac medic en ruptur
4254;oubl medic et infos contradictoir que dois fair
4255;faut ordon pour achet medic et polio
4256;du medic prescr pour femm
4257;medic etre quoi
4258;depuis bon moment sen pas malad fatigu avec besoin rest au lit mem quand avoir dorm tout nuit aim savoir si cel etre effet antidepresseur medic que prend depuis presqu mois medic 2x10 composit soir que prend depuis plus mois ou medic que prend soir contr malad
4259;dan cas trait pour malad photosensibilis etre possibl combin trait et crem solair a fort indic pour pouvoir quand mem pavan sur plag san risqu le malad au 3e degr
4260;quel etre conseil pour saign intern post operatoir non hemorrag format malad 10cm sur 5cm sur 3cm pour instant
4261;quelqu pourr inform risqu vaccin enfant au medic alor qu etre allerg medic oeuf
4262;medic declench symptom
4263;plus libido sous medic medic
4264;ordinal comprim medic pris heur en retard aucun risqu
4265;spotting etre que etre a caus luteran
4266;peux obten medic foliqu san ordon
4267;peut prendr medic composit en etre enceint
4268;quel etre le effet secondair medic contr malad
4269;commenc seroquel composit avoir peur en prendr avec medic pourr renseign si ca fait gagnerdu poid
4270;pediatr medic prescr medic nourr a beb mois depuis que don fait sel par jour et tres liquid liquid etre effet medoc
4271;medecin medic prescr hi medic avoir pris premi comprim avoir avoir effet secondair avoir avoir ca
4272;pren medic composit soir souffr malad matin donc avoir pris medic hi soir voila que avoir impress etre complet ramoll dois persever quelqu jour pris matin avant etre mieux
4273;v fair test detect malad baby check ved bal franqu et etre vendu san notic et v savoir combien medic dois mettr etre qu medic q qui medic jas utilis ou bien qui sais q chos
4274;malad et medic
4275;medic onagr pour douleur aux sein
4276;medic quelqu qui connait trait medic
4277;dois prendr medic gyneco medic dit prendr 16ejour au ai jour cepend vu que avoir pas regl depuis longtemp suit a trait hormonal quand dois prendr
4278;medic etre rembours ou pas
4279;etre qu medic risqu blessur avec sterilet pend rapport sexuel
4280;quel dos conseil pour medic medic pour beb quelqu semain
4281;medic exist plus
4282;sevrag medic et effet
4283;sav si etre possibl fair inject medic ailleur que dan bras
4284;j avoir pris poid avec medic dois inquiet
4285;medic etre bien pour le enfant
4286;qui connait medic medic
4287;medic patient recoit prescript medic zentiv composit composit a raison comprim par jour pend jour il medic oubli dir a medecin qu souffr cirrhos hepat peut quand mem prendr trait
4288;prend medic depuis mainten age et avoir jam avoir souc depuis hi avoir leg saign et depuis matin peu malad au ventr medic quoi cel peut etre etre que ca peut etre li au malad
4289;medic milan risqu effect malad
4290;malad et medic
4291;etre sous medic depuis quelqu mois angoiss enorm spasm malad vertig psy medic donc augment a composit rien neuf depuis avoir envi chang car corp ne reag plus au medic conseil pour chang ad medic prescrir
4292;medic et pert malad
4293;medic quoi sert medic medic
4294;qui medic deja pris medic quel avoir etre le effet benef et secondair merc temoignag
4295;prend penicillin depuis quatr jour pour soign malad et depuis aujourd huy avoir beaucoup malad a support medic etre que continu medic jusqu a demain avoir encor pris a prendr ou etre que stopp net tout suit
4296;medic envi urin et
4297;gelsinuim et medic placebo
4298;adepal effet temporair
4299;vien stopp pilul medic et en fait voul chang pilul comment fair
4300;medic etre medic
4301;etre quoi clarytin
4302;j avoir medic composit et avoir souc rigid malad musculair hyp sensibil difficult supplementair avec chaleur etc que fair
4303;comment agit medic
4304;enerv avec medic faut continu
4305;combien temp faut pour sent medic ais et pour que medic adapt avec porc parc que actuel avoir malad tet et transpir main et pied
4306;ami souffr amib medecin medic prescr medic nomm fragil pouv en dir plus sur medic
4307;fill medic avoir reaction peau roug et chaud ou pediatr medic piqu avec medic contr et polio va part quand
4308;je vien prendr pilul lendemain mainten pens que ne courr aucun risqu malad
4309;prend medic et avoir avoir symptom tres incommod semblabl a coup chaleur malad malad tet malad medic malad person a qui malais li au soleil et au millepertuis etre arriv
4310;medic efficac sur anxiet
4311;medic q con
4312;medic quel risqu en cas surdosag
4313;une boul etre apparu au sit inject medic etre normal
4314;medic sipralex fait gross
4315;medic trait homeopath pour soign malad
4316;reaction medic ftp
4317;avoir augment dos medic a composit depuis jour et depuis dor trop et ide malad etre reapparu puissanc etre que ca medic deja fait ca etre possibl que soir ad
4318;medic contr malad
4319;voudr savoir si peux utilis vic vaporub en medic pour fill vien avoir six an
4320;pend medic prend egal xanac cel ne fais pas beaucoup effet voul donc savoir si medic pouv alter le effet xanac
4321;comment soulag le malad estomac provoqu par medic
4322;voul savoir si entre fin plaquet et debut regl etais encor sous effet contracept si avoir rapport non proteg
4323;avoir avoir person aujourd huy avec ordon pour medic f redig en franc proven cliniqu espagnol etre qu peut fair tier pai avec cart vital si ordon provient autr pay ue
4324;avoir pris medic et avoir actuel jour retard regl medic beaucoup risqu que etre enceint sach que preserv a craqu que rapport a risqu medic dur maximum minut san ejacul et que avoir pris pilul lendemain minut apres
4325;medic qu en sav
4326;avoir oubli prendr dimanch matin et avoir pris lund matin malad heur puis avoir pris cel lund a heur avoir vom a heur avoir etre malad tout nuit avoir pu prendr autr comprim medic plac avoir pris comprim mard medic heur mid derni rapport dat jeud ou vendred medic risqu que tomb enceint
4327;medic et effet secondair nombreux continu
4328;medic et medic different
4329;puis prendr cholecalciferol san risqu effet secondair
4330;baiss libido avec medic
4331;medic quel etre le effet secondair
4332;avoir pris medic hi regl etre cens tomb dan jour etre que peux commenc pilul premi jour lor regl ou faut que attend
4333;cris symptom solut
4334;dur allerg au medic medic
4335;le medic magnesium etre indiqu en cas malad
4336;avoir sub greff medic mois et prend actuel medic composit matin et soir hor pour premi fois vien invers le deux et avoir pris composit soir ne sais pas quoi fair
4337;fluoxetin quel effet therapeut
4338;avoir flacon gelul levur bier qui contient plein vitamin combien gelul pren par jour
4339;apres medic et polio etre proteg pend combien temp
4340;le medic homeopath etre elle utilis dur malad
4341;medic don ovul medic mettr ecanozol soir avoir regl peux mettr ou dois attendr ne plus le avoir
4342;medic quoi sert medic
4343;medic et medic period transitoir ou pas
4344;etre possibl prendr medic en mem temp qu medic
4345;princip actif medic
4346;prend pilul medic gai avoir decid ne pas fair arret semain pour ne pas avoir regl sauf problem le avoir quand mem avoir et cet semain avoir encor saign que fair
4347;medic depuis quand ca exist
4348;c etre quoi medic
4349;spam syndrom pre menstruel et medic
4350;avoir pris cach medic depuis que avoir pris celui ci avoir plaqu roug sur visag et avoir egal malad au pen etre que etre grav
4351;etre sous medic et prend medic medic tiaprofen pour malad dent etre qu ia interact avec pilul
4352;connaiss marqu medic medic utilis special pour bain bouch en medic gros medic san opercul en aluminium pratiqu a ouvr
4353;malad et medic
4354;avoir decid fair vaccin contr papillomavirus avec medic medic rappel au lieu dat preconis etre a dir pens qu peut avoir effet indesir ou quelqu chos autr
4355;medic etre quoi
4356;medic autoris pend malad
4357;medic autoris
4358;quel etre le contr indiqu medic
4359;prend actuel medic et prend medic qui appel medic pens qu medic risqu que pilul etre moin efficac
4360;medic contr le reveil nocturn
4361;connaiss le effet benef medic
4362;prend pilul medic et aur voulu savoir si autr person prennent et savoir le effet secondair que avoir avoir
4363;prend pilul medic depuis mois une fois avoir oubli prendr et apres avoir avoir rapport proteg mais apres avoir repr comprim a heur habituel puis soir derni comprim avoir avoir rapport non proteg cel fait jar que en prend plus et que avoir toujour pas regl etre normal etre que avoir risqu etre enceint
4364;bonjour avoir question medic propos efficac gener medic prend cet pilul en rel medic que ne support pas avoir fais paus jour normal medic fin plaquet medic et avoir commenc plaquet medic problem etre que notic expliqu pas medic part quand etre proteg merc avanc pour repons
4365;luteal gai agit au bout cb temp
4366;comment prescrir medic chez jeun enfant
4367;etre sous medic etant diabet gyneco medic prescr medic or etre trait pour peau medic plus medic et composit peur que medic agraf peau avoir avoir effet secondair
4368;medic plus laxat etre bon
4369;medic medic dur au moin h
4370;par quoi remplac medic pend malad
4371;medic enfant liquid dur conserv apres ouvertur
4372;prend holgyem moustach etre developp et poil bras deviennent noir etre que medic entrain rapid effet au niveau system pileux
4373;le medic etre indiqu pour le malad du a chimiotherap
4374;medic vegetal qu etre que etre
4375;etre qu exist form buvabl medic
4376;etre qu medic penicillin dan quetiapin
