;question
1933;être que médic baiss libido être que ca arriv plupart temp
1934;médic efficac des premi jour
1935;voudr savoir si femm enceint médic déjà pris médic médic
1936;médic fonction plusieur jour
1937;médic quel dosag être disponibl en pharmac
1938;effet secondair médic
1939;effet avec médic que dois fair
1940;lorsqu utilis compeed sur malad ferm faut désinfect ou suff que peau être propr
1941;vien apprendr qe être enceint avoir sûr rappel vaccin médic fair pr pouvoir fair stag en milieux hospitali être que port le fair en être enceint ou être danger pr b
1942;avoir lu le contr indiqu médic être que cel arriv que dan cas extrémisent rar ou être trais fréquent
1943;être en retard mois pour rappel et polio essai avoir beb si vais fair médic être oblig fair attent pend quelqu mois pour beb ou bien pourr continu essais tranquill san pos question
1944;coi sur plaquet médic qu médic le jour semain cri dessus si premi jour regl être mercred être que peu prendr import quel mercred sur plaquet
1945;habituel prend pilul médic à heur soir là pren malad heur matin voudr rav médic risqu au niveau retard
1946;médic quel volum
1947;le médic être danger
1948;médic foliqu effet secondair
1949;je être sous médic composit depuis bientôt an et vais sûr arrêt pour pass sous médic le sevrag être pénibl
1950;bonjour médecin médic chang trait anti dépresseur médic pour médic question être savoir quel effet indésir avoir avoir avec pris médic avec efexor avoir comm effet indésir bouch pâteux et malad avec médic médic pour certain e entre avoir pris poid remerc répons
1951;voudr savoir si lon peut prendr ibuprofen avec médic
1952;pilul fait effet prend depuis semain mainten être cyclan crois
1953;médic être bien pour le enfant
1954;avoir patient qui médic être success sous médic puis médic pour malad qui médic développ malad thymus et qui médic bouff chaleur que conseil
1955;conséquent sevrag médic
1956;avec médic au bout combien temp arrêt préserv
1957;comment avoir fait lorsqu avoir allerg à ose stérilet
1958;mélang médic plus médic
1959;huil essentiel pend malad
1960;médic être ellle indiqu en prévent malad
1961;prend pilul lutéal gai avoir trait pour malad à bas amoxicilin être que médic peut avoir influenc sur contracept
1962;être que le ipé avoir action sur le récepteur dan le intestin
1963;j avoir arrêt médic mainten avoir malad monstrueux quelqu peut aid
1964;médic effet secondair et malad question
1965;médic encor disponibl
1966;depuis que prend médic avoir malad et vertig au réveil quoi fair
1967;infirmi peut prescrir urge k
1968;comment utilis le huil essentiel
1969;médic et conduit véhicul
1970;qu être que médic et pélamid
1971;médic et malad
1972;médic à an
1973;si sur ordon sécuris médecin prescr spécial list et et médic dan carr doit mettr pour spécial stup ou quantit total produit prescrit
1974;médic peut provoqu fibrill auriculair
1975;être que utilis médic lor cris douleur médic caus malad malad être consider comm usag hor ami
1976;connaiss malad trait qui soulag symptôm pouss dentair
1977;fill médic avoir le le inject médic médic quant et ne souhait pas fair rappel quel être le risqu arrêt en cour vaccin
1978;être vrai que médic pourr diminu envi fum
1979;médic fait gross
1980;médic prescr médic sav si ça médic incident sur appet et ou pris poid
1981;prend cérazet depuis presqu an et temp en temp avoir pert marron ça dur plus jour c être normal
1982;comparaison médic et médic
1983;avoir lu que médic cré ennui et impatient en prend que composit par jour ne sais pas trop quoi fair
1984;médic médic trait malad trait auss irrit
1985;helicobacter pilor et malad
1986;médic pour gastro
1987;ber tout mond vient prescrir pélamid à raison soir dos à composit pst jour quelqu en médic déjà pris si oui être efficac et quel être le effet secondair merc nadin
1988;puis dilu comprim ibuprofen dan verr médic pour aval plus facil
1989;être allé chez médecin fair deuxiem médic contr malad médic et médic deuxiem médic don malad dan tout bras gauch et dan main gauch être normal
1990;médic hpv que fair
1991;chien qui être natur tres stress et anxieux plus fait cris épileps avoir commenc trait au phénobarbital et voudr coupl avec médic epileptyl concern malad et malad pens que peux don médic
1992;ou achet médic
1993;le médic être quoi
1994;que pens ordon pour femm enceint mois médic cac par jour médic foliqu composit jour
1995;exist médic homéopath contr malad
1996;copin prend médic et na plus tout envi être normal
1997;peut délivr médic ricin en quantit supérieur à composit
1998;le médic don cauchemar
1999;mon réfriger être tomb en pann nuit entier avec médic à intérieur et symptôm maximal atteint médic être c puis encor utilis
2000;médic et coluhextril
2001;ça fait semain que prend médic et hi avoir avoir symptôm comm regl être normal
2002;qu être que médic
2003;une femm pren levocétirizin composit arroi laboratoir à raison comprim par jour souhait savoir si peut prendr comprim dan le périod cris allerg
2004;médic médic composit contr diabet fait vrai maigr
2005;médic égal ad
2006;fil être fait vaccin hi être roug et gonfl mainten que dois fair
2007;médic égal malad être que ça estomp avec temp
2008;fill médic mois et avoir jam fait nuit énerv plus en plus et médic malad à rendorm essai depuis hi médic composit et peut être vais rajout médic composit ne sais pas trop si être bien adapt médic age
2009;quel être le avantag médic
2010;je vien sub acte dentair et avoir prescr médic sandow composit comprim dispers je voudr savoir médic contr indiqu à consomm cannab avec trait
2011;arrêt médic 35=acn
2012;combien lyon dan boît médic
2013;médic sevrag
2014;j avoir patient qui veut soign malad cuir chevelu avec huil essentiel que conseil
2015;enchaîn plaquet adépal et repris
2016;médic pour le malad
2017;ou achet arkogellul lami blanc
2018;copin pren pilul médic depuis an médecin médic chang pilul pour dal gai être normal ne puls voir libido
2019;médic ça périm
2020;quel être utilis premi médic
2021;je dois prendr médic matin mid ou soir
2022;médecin vient prescrir médic pour trait endométrios combien temp faut prendr
2023;comment mettr bétadin sur fissur à entré vagin
2024;être allé achet médic san prescript médecin et pharmacien médic don médic composit san rien demand être normal ou prescript avoir être demand
2025;médic peut fair avort
2026;avoir pris deux cachet panthoprazol composit par inadvert être grav
2027;lutenil inform sur médic
2028;médic trait nouveau
2029;être qu médic risqu malad avec stérilet médic
2030;quel être indiqu dos médic à composit
2031;depuis dizain jour prend médic être composit par jour qui fait total composit médic en jour être surdosag
2032;être qu être possibl tomb enceint sous médic
2033;quel être le différent stérilet
2034;démangeaison médic
2035;médic et malad
2036;comment agit molécul dan médic
2037;si prend plusieur barr médic risqu quoi
2038;être possibl comm pilul classiqu prendr lutéran en continu en cas oubl lutéran quel être del pour reprendr cp san avoir à proteg autr car risqu
2039;bonjour qui médic déjà pris pilul médian et géner avoir avoir problem au chang normal devr être mêm chos pour part avoir avoir quelqu pert marron clair spotting au chang attend répons merc
2040;ne support pas pilul médic et gynéco médic don médic à plac gym médic dit arrêt médic jeud soir dc prendr derni et prendr médic mard être à dir comm hab avec médic et ensuit pend semain et semain repos être que être ca compt être que être proteg en chang pilul et être que être proteg dur périod repos et le jour repos entre médic et médic qui médic déjà pris médic et ad avoir v avoir regl
2041;cel fais mois que pren plus pilul là être à pos jour avoir pas regl être normal
2042;une patient trait par médic composit souhait savoir si peut prendr médic avec trait
2043;médic
2044;seropam peut être pris avec autr antidépresseur
2045;le granul homéopath peuvent elle être dilu dan médic
2046;pilul médic qui connaît
2047;quel être le effet secondair médic
2048;avoir commenc pilul médic enver depuis jour que dois fair mainten
2049;médic et malad
2050;être que min être somnifer
2051;vien commenc holgyem médic jour le heur qui suivent pris comprim avoir malad au cœur malad et malad au crân être que symptôm prolongent dan temp
2052;le sec et le sart peuvent il provoqu insuffis rénal fonctionnel
2053;quel être le risqu médic et médic si être enceint
2054;quel risqu à prendr médic plusieur mois suit
2055;médic à prendr en continu ou pas
2056;xylol visqueux et médic chez enfant an pour syndrom pied main bouch qu en pens
2057;j avoir oubli plaquet médic et pharmacien médic don géner pour termin cycl exist risqu sach qu agit mêm molécul
2058;avoir fais arrêt jour entre médic et médic être grav avoir fait arrêt jour entre derni médic et premi médic
2059;avoir déjà avoir ordon pour médic chez femm âgé sous médic
2060;être que médic peut entraîn insomn
2061;être sous trait chimiothérap depuis novembr être util voir prudent ou bien carr danger fair inject médic anti malad
2062;comment prépar médic médic
2063;parl médic expidet qui fond dan bouch à composit combien temp apres pris médic commenc à fair effet
2064;médic hydn
2065;médecin médic prescr médic cel va permettr tomb rapid enceint
2066;être danger prendr médic comprim dont dat pérempt être pass médic mois
2067;prend médic continu médic être premi contracept et jusqu avoir jam avoir cycl réguli avoir donc quelqu peur médic approch fin premi plaquet dois commenc deuxiem plaquet comm être prévu avec typ médic mêm si avoir pas encor regl médic fin premi plaquet oui au contrair dois attendr arriv regl avant commenc suiv pens que ca coup effet ban
2068;être que comm pilul médic provoqu fort migrain
2069;médic et médic enceint
2070;dosag médic enfant
2071;la levur bier peut être utilis pour restaur flor intestinal quand être sujet à malad
2072;qu être que arpagophyton
2073;spotting pend anneau pas regl dur paus
2074;prend médic depuis jour et ne fais que pleur et déprim plus spotting pir en pir chaqu jour que dois fair
2075;pens commenc folliculin combien ca coût
2076;avoir regl or que fait semain que avoir enchaîn ordinal plaquet être entrain fair fauss couch
2077;inform officiel médic
2078;quand commenc ordinal pris pilul apres médic
2079;avoir arrêt séroplex depuis deux semain car veux chang que puis prendr
2080;maman âgé an vient apprendr qu médic malad generalis cel médic commenc par malad col ulterus qui être propag aux ovair aux rein vess et estomac le médecin avoir pratiqu hystérectom cel médic pas suff trait être possibl
2081;avoir commenc médic gai mois ci et depuis quelqu jour avoir commenc à avoir malad abdominal comm lor regl et pert brunâtr parfois roug être normal
2082;plus regl depuis retr médic
2083;paracétamol était pas anti inflammatoir antalg bloqu influx nerveux doulour dan cerveau être quelqu saur comment bloqu cet influx
2084;prend pilul médic que avoir reprendr samed avoir repris dimanch apres arrêt non pas jour demand si être grav ou pas
2085;altern san ordon pour médic composit
2086;trimgel et médic être compatibl n
2087;minoxydil à déconseil pour le femm
2088;avoir oubli pilul médic gai chez parent rest vieil pilul androc puis prendr en remplac médic gai pend quelqu jour
2089;bonjour vien enlev médic médic heur suit souc regl depuis mois médic avoir an et souc depuis que avoir stérilet gynéco médic prescr médic micro dos rembours dois attendr regl sais être que peux prendr pilul man quel être le risqu avoir pas envi attendr car fais bip natat et aim savoir ad vais être regl conseil merc
2090;j avoir oubli prendr holonom dois prendr pilul consécut
2091;le sipralex être efficac contr malad
2092;la pharmacien reçoit ordon inhabituel médic crem pour enfant moin an pour soign irrit elle demand si tel cas médic déjà être recens
2093;dosag médic chez enfant
2094;quel effet thérapeut médic
2095;médic dan frigo
2096;y médic périod adapt au médic
2097;phaev entraîn problem gynécolog
2098;être tout temp fatigu et pens que cel vient médic et
2099;avoir impress avoir perdu pet depuis que prend médic depuis petit semain pourt par que ça stimul pet et que ça fait prendr poud être normal perdr appet le premi jour
2100;médic et bois band
2101;client voudr soulag petit fill qui souffr terreur nocturn par voi homéopath le cris durent parfois jusqu à minut et enfant ensuit rendort normal que propos
2102;aujourd huy médecin médic prescr magnésium inject médic dit boir mélang avec peu médic alor que sur notic être écrit intravein qu en pens
2103;le troubl érect sous médic être il connus
2104;avoir pris médic ia deux jour aujourd huy avoir le mêm symptôm q malad urinair que avoir fait médic ça an être normal
2105;quel nom commercial pour médic
2106;vaccin où fair
2107;avoir fait médic malad jaun médic mainten jour suit apres piqûr avoir ressent espec leg picot sous pied gauch puis rien ne être pass pend jour hi soir le picot être revenus avec gross malad être normal
2108;hom médic prescr dos médic album à 200k être quoi cet dilut
2109;peut aval médic au lieu fair fondr sous langu
2110;prend médic depuis mois et dem depuis avoir pris kg être souvent énerv et moral à zéro avoir impress déprim être à pilul
2111;fum avec passiflor mauv
2112;la médic pour combattr le infect nosocomial
2113;voil avoir enchaîn deux plaquet pilul et avoir commenc troisiem avoir prit cachet sur troisiem plaquet avoir prit ordinal hi ne avoir pas pris aujourd huy car voudr avoir regl cet semain pour être tranquill geek en avec doudou être sous géner fianc puisqu avoir prit derni pilul dimanch matin doit recommenc pilul quand être premi fois que fais arrêt et être que peux recommenc avec troisiem plaquet entam comm enchaîn toujour le plaquet ca veux dir que arrêt dan plaquet et dem ou plaquet et dem pour arrêt avec fin plaquet ou être oblig recommenc nouvel plaquet
2114;pourquoi médic être indiqu seul à part an
2115;effet secondair médic
2116;fil être sous médic vien apercevoir qu fois ouvert faut conserv au frigo quel être risqu laiss à symptôm ambi
2117;avoir commenc nouvel pilul médic gai auparav pren médic avoir arrêt car cel ci don saign entre regl problem être que depuis deux jour saign recommencent voul savoir si cel peut être effet secondair mêm si être pilul fort où être que cel peut ven fait que fum encor
2118;être que médic que prend peut être caus malad sech
2119;être sous efexor depuis an et être souvent malad malad fievr faringit médecin dit que san dout médic qui médic réduit défens sen pens
2120;peut utilis médic chez femm enceint
2121;comment utilis le huil essentiel contr le état dépress
2122;rap merdaillon
2123;pourquoi médic
2124;être sous médic au point peut être arrêt trait avoir agress irrit énerv sort symptôm dan le bras et sensat que tout muscl crispent surtout ceux mâchoir et cou avec temp cel être apais
2125;sais que certain pilul peuvent favoris le épisod mycos et voul savoir si médic être dan cas
2126;médic et malad
2127;médecin médic prescr médic médic dit qu en jour avoir nouveau regl être au ordinal jour et toujour rien être normal
2128;médic être géner médic
2129;médic hpv que fair
2130;ou achet arkogellul lami blanc
2131;problem être en rapport avec maudit bouff chaleur qui être install depuis âge exist trait homéopath ou phytothérap efficac
2132;être que médic développ kyst ovarien
2133;être que peux prendr médic pour symptôm
2134;médic fait gross
2135;utilis médic depuis mois avoir constat progress diminu regl en quantit et en dur et del plus en plus long avant commenc devr fair test malad tous le mois
2136;être que mélatonin ne peut être délivr que sur ordon
2137;peut substitu médic prescr à par capteur freestyl libr si ordon être pas sécuris
2138;qu être qu produit contrast
2139;dang huil essentiel et malad
2140;être qu fill au dessous an peut prendr médic
2141;médic quoi sert médic
2142;le médic enfant fait encor
2143;je avoir pas avoir regl apres jour san pilul médic risqu que être enceint
2144;del entre médic et malad
2145;être qu peut avoir rapport sexuel non proteg pend semain arrêt médic
2146;être que peux prendr compl alimentair protéin avec médic
2147;médic plus médic
2148;faut prescrir médic sur ordon spécial
2149;être sous géner médic en discontinu plaquet comprim apres jour arrêt être allé à pharmac et médic avoir médic don gener médic en continu comprim médic risqu malad
2150;exist sep solut pour retrouv libido normal malgr pris antidépresseur et anxiolyt
2151;quelqu connaît remed pour diminu quint malad
2152;bonjour prend mélod depuis jour et voul savoir si possibl ovul et si soi quand mem prendr pilul lendemain
2153;que pens médic médic y médic risqu
2154;cherch q chos san ordon pour ne plus déprim et ne plus fair coler
2155;être actuel sous médic mois ci avoir avoir douleur aux sein voudr essai médic comment doit proced
2156;quand vaccin par médic
2157;pastill pur gorg laquel
2158;être possibl associ médic médic et médic médic
2159;qui médic déjà avoir cérazet que pouv en dir
2160;érupt bouton médic médic
2161;pourquoi prendr médic
2162;avec quoi trait diabet par médic
2163;prend médic depuis mois souffr malad const et surtout social handicap avoir plus rien à perdr avec manipul hasard à mois trait et être persuad que doubl composit 6cmp dos maximal composit 3cmp pourr amplement soulag malad cepend dir que dos max ne doit pas être dep chacun médic plus ou seuil dos maximal propr à mem
2164;médic composit pour symptôm vrai ou faux
2165;prend pilul médic correct et pend périod arrêt 7j composit regl et composit avoir rapport non proteg avec copain début regl jou voulu savoir si médic ris que tomb enceint
2166;hémoclar
2167;médic aux bouff chaleur
2168;fiu au médic combien temp le douleur
2169;décontractyl retir march
2170;avoir chang antidépresseur pren médic et avoir arrêt jour pour médic pas effet secondair le premi jour pourquoi avoir effet secondair au bout jour être parc que avoir encor médic dan sang être pour ca ou être parc que avoir arrêt médic coup
2171;médic sur le sein
2172;qui connaît médic
2173;faut prendr médic avant ou pend le rep
2174;transpir excess pas beaucoup solut quel trait exist
2175;désagr sous médic
2176;voul just demand si connaiss médic
2177;prend médic et en peux plus malad être devenu chroniqu avoir vertig malad crois que vais arrêt coup sen encor plus malad car plus capabl avoir activ être que ça pourr être effet secondair
2178;le médic être placebo
2179;bonjour avoir médic boostrixterr depuis mois dan frigo être encor utilis
2180;puis don médic pour malad séborrhé sur visag
2181;apres oubl obel gai plus heur être proteg
2182;quel être le effet indésir médic
2183;médic san ordon être toujour possibl
2184;médic don symptôm ains que chang percept
2185;peut prendr mélatonin en mêm temp que médic
2186;quel être posolog maximal pour ami par rapport au médic
2187;si le vaccin causent réaction indésir médic peut nettoi le effet secondair et le symptôm caus par le vaccin
2188;peut prescrir médic pend malad
2189;puis associ médic et griffon san dang
2190;être sous médic avoir oubli prendr médic deux semain avoir pris comprim oubli ne sais pas si être comprim veil donc préfer fair comm si avoir complet oubli comprim il ne disent pas march à suivr dan cas utilis préserv seul semain auss
2191;bonjour copin samed pass médic oubli prendr pilul et médic pris lendemain heur retard être dan deuxiem semain avoir avoir rapport lund soir avoir pris pilul et comm avoir conseil avoir utilis préserv malad pot médic craqu pend rapport san que en rendion compt aujourd huy être allé achet pilul lendemain demand mainten être util prendr ou si ne être pas entrain stress pour rien pilul être désorelle20 et pilul lendemain pas encor pris être marqu médic merc avanc pour répons p si prend doit proteg par suit jusqu au prochain regl
2192;médic pharmacien souhait savoir si médic être list comm médic except
2193;avoir avoir deux vaccin hi malad et malad être sent vit fatigu et être tomb endorm et aujourd huy être dan état fébril avoir déjà avoir effet similair
2194;être que médic e et b favorisent fertil
2195;médic tous le comprim être dos pareil
2196;avoir repr médic et aujourd huy aperçois que reperd sang être retour couch si oui être que fin cet plaquet pilul et ad reprendr ancien pilul qui était médic
2197;prend mélod depuis mois avoir pas avoir regl premi mois et le attend depuis avoir sein énorm avoir gross kg en mois être normal
2198;de quel taill être le gélul duloxétin krak
2199;fill médic fait médic et polio hi médic âge et là matin médic fort fievr et être roug être peu enflé là ou ia avoir piqûr être ordinal fois qu fait ca normal ou pas
2200;médic et malad
2201;apparit bleus san coup sou médic être normal
2202;gardasil
2203;peut cumul médic et médic avec médic
2204;prend médic depuis deux mois vais mieux dan têt par contr avoir démangeaison sur tout corp qu être qu peut prendr pour soulag
2205;peut consomm médic fois dat pérempt pass
2206;dat sur monev
2207;médic spéciafoldin list
2208;être sous lutéran dois prendr jour par mois et paus jour or en avoir pris si fais paus jour au lieu habitud vais pouvoir récuper comprim pris en plus
2209;médic depuis quand ça exist
2210;épous médic pris seul inject synerg rendus compt qu était en état malad quel effet peut avoir cet inject sur futur enfant
2211;médic malad médic
2212;quoi être que médic être géner
2213;médic quel être le risqu
2214;médic et dysfonct érectil
2215;sevrag effort composit jr être psychosomat
2216;y médic risqu fauss couch avec médic
2217;médic ça sert à quoi
2218;comment présent médic
2219;le médic être caus pris poid
2220;médic fievr jaun danger
2221;être que médic inhib action pilul
2222;être médic et antalg peuvent trait gross calcif au poignet
2223;malad malad médic
2224;une dam hi être venu à pharmac paniqu car avoir oubli prendr progestéron en ovul matin et que but être favoris nidat trait car déjà fauss couch je avoir rassur en dis que oubl sur 20j matin et soir être pas grav voul quand mêm savoir si avoir risqu
2225;suit à médic malad médic plus typhoïd avoir atroc malad au bras souffr symptôm coud jusqu en haut épaul être normal
2226;médic nourrisson peut recevoir granito médic
2227;récent médecin médic augment dosag quétain depuis avoir souvent chaud fais cauchemar et être étourd être à caus augment
2228;être danger prendr ibuprofen lor apéro bien arros
2229;avoir commenc cur compl médic et magnésium car être tres carenc et voul savoir au bout combien temp ça fais effet mois mois
2230;malad et égout nourritur sous médic être normal
2231;médic priv être danger
2232;pren géner médic le arrêt médic derni cycl car sent trop faibl depuis sen plus en form et plus vertig avoir douleur en bas ventr et dan dos vien ici pour avoir témoignag fill qui avoir arrêt pilul et savoir si ca arriv genr douleur
2233;médic peut provoqu bouff chaleur
2234;pris médic heur et à part heur avoir avoir gastro que avoir encor hui il faut que fass quoi comprim hi va fonction ou non
2235;médic fait encor effet
2236;médic perdu que fair
2237;être que quelqu être combien coût médic sep
2238;médic magnésium et magnésium
2239;être que le vitamin peuvent amélior fertil masculin
2240;quel être galen vérapamil sandow
2241;avoir pris cérazet depuis an avoir arrêt avoir avoir malad et médecin médic prescr aspic et avoir avoir nouveau regl du à médic qui ne arrêtent pas être normal
2242;bonjour médic tout voil ia mois ca ai pris médic car suit médic arrêt pilul avais plus regl octobr ai avoir regl comm prévu depuis hi ai pert sang croir que ai regl qui vont arriv jaimer savoir si normal merc répons
2243;médic part quand médic être efficac
2244;bonjour prend endrocur depuis presqu bientôt an pour problem regl en prend comprim pas jour en plus pilul médic avoir entendu parl que ça séduir pilos pour avoir impress que ça médic avoir effet invers être possibl
2245;faut prendr médic plutôt matin ou soir
2246;hi pens avoir pris 2d pilul san en avoir souven être grav si avoir rapport dur we
2247;médic et dépend
2248;comment appliqu médic onagr
2249;être sous traitent médic depuis mois et est 31em jour cycl et ai pas regl être que être normal
2250;médic connaiss
2251;médic médic mod action
2252;zythromax pst ordinal trimestr malad
2253;puis prendr médic et cefpodoxin en mem temp
2254;puis allait si prend médic
2255;je être sous médic combien temp faut attendr pour sent mieux
2256;avoir effectu rappel médic quant pour beb mois hi découvr qu pet bouton roug être réapparu sur cet cuiss là en pens quoi
2257;médic dos peut appliqu sur tet
2258;tamil doulour effet secondair
2259;connaiss médic médic
2260;médic être danger
2261;ca fait pas lonten que jpren pilul et parfois oubl jour dc en prend deux mm jour aim savoir si ca peut avoir effet nocif sur sant
2262;médic malad médic effet indésir
2263;médic combien temp dan sang
2264;homo vient prescrir médic médic eh avoir déjà pris avant et ça médic pas fonction médic just rajout médic 200k pens que cel va agir en rajout dos médic
