;question
0;bonjour être tromp forum pour question alor repos ici pris pour premi fois hi paroxétin et matin être catastroph picot dan tous corp annonci symptôm froid tres tres massiv et symptôm en être à deux cris depuis heur mat cel sembl pass main rest moit et chaud este normal pour premi fois merc médic tous
1;être que médic soulag contr le malad
2;médecin médic prescr médic au ordinal cachet malad têt terribl et au ordinal malad symptôm froid chaleur intens dan têt symptôm fourmill dan levr supérieur difficult à respir des arrêt médic tous le symptôm avoir disparu cel être déjà arriv à quelqu
3;être qu exist form adapt aux enfant âge médic
4;médecin soign pour médic pharyngit et médic prescr médic comm anti biotiqu être vrai pour cet indiqu
5;vien apprendr que être enceint sav si peux poursuivr médic
6;médic être pas danger au long term
7;être sous médic j avoir malad et saign
8;médic médic être quoi
9;prend médic et à fin premi plaquet avoir avoir premi fois av ln copain pilul être donc bien efficac des début avoir symptôm dan poitrin avoir impress qu il avoir peu gross auss plus avoir malad o bas vent e dois minkiet ou simpl périod adapt
10;médic à dos faibl pour malad
11;psy dit prendr composit médic matin et composit médic soir peut prendr composit être matin ou médic mid
12;être sous antibiot depuis bientôt semain et être chop ne sais quoi à nénet ca gratt être superficiel ca dément à point être li à antibiot
13;quel médic contr malad col utérus
14;épileps et médic
15;vaccin dup et hépatit médic être il possibl pend malad
16;vien être mis sous médic depuis semain souhait savoir au bout combien inject produit commenc à fair effet et au bout combien jour apres chaqu inject effet fais sent
17;comment trait dyshidros si médic et prépar médic médic composit composit médic en bain et dermalibour avoir pas march
18;peu renseign sur médic avoir pris ordinal cachet matin avoir avoir effet indésir
19;médic quel risqu
20;peut prendr médic et fleur bach en mem temp
21;quand termin plaquet peut avoir rapport sexuel
22;quel être dur conserv tégrétol
23;être que pilul médic fais gross
24;pend le jour san pris fois plaquet pilul termin être toujour proteg ou non pend cet semain
25;médic peut être utilis par le homm
26;patch médic commenc à j+4 donc être que ne être pas proteg pst mois
27;combien prendr médic
28;médic être médic ou antidépresseur
29;bonjour depuis presqu an être sous médic médic prescr médic en cas cris symptôm car en avoir fait ou voil depuis jour être angoiss matin au soir et cel san raison apparent ne peux presqu plus rien aval tel être nou alor que habitud mang comm vach moindr chos à fair sembl insurmont et provoqu malais ne sais plus quoi fair prend médic par jour alor que médecin avoir prescr pour le cris malgr médic être meg angoiss non tout entourag médic remarqu et collègu croient enceint avoir peur deven complet agoraphob plus médecin être en vacanc et ne sais mem pas si pass à médic être danger sav combien temp peut dur typ cris quel être le risqu vois psychologu depuis premi cris donc presqu an merc lumi
30;une maman reçoit prescript médic composit arroi granul pour beb mois demand si cet form être adapt alor que beb ne mang pas encor solid
31;la médic aid à maigr
32;être sens prendr composit hi avoir pris apres avoir pris à chaqu fois que être sur point endorm entend plein voix qui ven partout être possibl que symptôm être à irrégular pris trait
33;quel être le effet secondair médic
34;vien commenc trait médic b depuis jour et avoir gaz que puis fair
35;ou procur médic c4
36;la médic peut provoqu bouff chaleur
37;médic médic être rutil pour malad
38;médecin spécial gastro médic prescr médic médecin trait médic cit médic composit pour malad et depuis que le prend ensembl réaction form petit point roug tres demeng et embat être apparus sur suiss droit avoir arrêt médic le point ne être pas encor part apres jour que fair ou prendr
39;médic == malad aviair
40;compl alimentair médic naturel ça exist
41;prend pilul médic et avoir oubli pilul or avoir avoir rapport non proteg avoir pas pris cel que avoir oubli et avoir repr derni pilul normal être qu avoir risqu être enceint
42;médic neurolept
43;risqu grossess multipl bec médic risqu fill
44;avoir fort brûlur estomac prend médic et ça ne fait rien connaiss remed plus efficac
45;être sous médic et médic être en ruptur avoir info quant à disponibil
46;j aim connaîtr le zon exact appliqu médic médic
47;famill médic médic et médic
48;médic quoi sert médic
49;médic
50;sav combien temp agit le effet médic
51;être danger si dep dos médic pour malad
52;bonjour avoir problem peu particuli avoir pris premi pilul médic vendred derni avoir pris à heur et regl avoir commenc dan nuit jeud à vendred entre heur et minuit voudr savoir si pilul être déjà efficac ou si avoir pris ordinal pilul trop tard pour qu coïncid avec premi jour regl car vien avoir rapport sexuel au cour duquel préserv médic craqu que conseil avoir risqu malad être judici que pren pilul lendemain merc avanc lucil
53;médic pour le cris symptôm
54;méthotrexat origin compos
55;avoir commenc mélod voul savoir si être proteg des premi pris
56;prix géner médic composit être pass subit à être normal
57;médic être médic
58;vien reprendr médic à heur habitud prend malad heur sembl avoir compr qu fall reprendr à mêm heur apres le jour arrêt avoir risqu
59;peut coup le comprim médic
60;aim reprendr pilul médic avoir tel peur reprendr poid quel pilul être censi ne pas fair prendr poid
61;médic sur quoi agit sur quel récepteur
62;médic plus médic composit médic par jour qu en pens
63;mer qui médic oeudem au pied chevill et plant pied être vu prescrir médic et ténoretic combien temp avant que cel ne partent
64;médic ou médic san ordon
65;à quel moment prend médic
66;combien temp faut pour qu ressent augment dos médic
67;bonjour prend médic depuis semain et dem être auss tres enrhum et fatigu voir abrut surtout apres mid avoir malad à savoir si être au médic avoir impress être symptôm fréquent et et surtout être que ça pass par contr avoir impress avoir être beaucoup moin déprim des premi jour avoir mêm peur perdr émot cel être possibl quelqu pourr aid
68;stérol seul pour le adult
69;bonjour être en train prendr pilul qui pel médic gai médic problem être que sein être toujour gonfl et ca fait malad médecin médic prescr médic par qu être possibl avoir symptôm en pren médic quoi ca sert alor et être que sein vont redeven normal parc que ca fait vrai malad merc beaucoup
70;médic assomm être normal
71;enceint et médic malad médic
72;être sous médic et souffr sécheress oculair être cour
73;quelqu médic avoir mêm au tout début médic énorm pouss malad
74;je pren pilul lutéal gai depuis pres an avoir récent chang pour médic aujourd huy avoir symptôm malad malad graiss abdominal et malad que pens tout ca
75;souhait savoir quel être prix vermifug humain
76;je prend médic avoir regl bizarr être que habituel avec médic
77;y médic médic contr symptôm
78;oubl pilul médic plus relat soir oubl
79;hep dépend médic
80;par quoi puis remplac médic
81;copin souffr épin cananéen depuis octobr connaiss trait qui marchent
82;médic médic qui peu aid médic calm anxiet car médic ne calm pas vrai
83;arrêt médic quel effet
84;puis arrêt médic au cour plaquet
85;malad avec méthotrexat
86;quel médic pour malad génital puis avoir en pharmac san ordon
87;on peut port patch médic en continu
88;médic médic être compatibl avec malad
89;aim savoir le vertus médic favoris mémoir
90;bonjour être réveil dimanch matin avec malad sur le jamb et peu sur le bras être allé voir médecin hi en médic déduit que être allerg au médic avoir arrêt trait des dimanch matin et médic prescr prolamin en avoir pris hi soir en lev matin avoir vu que avoir à présent malad sur décollet et sur le bras et le main être bien moin import que sur le jamb quand mêm inquiet être normal que malad continu mont malgr prolamin dois craindr œdem quinck merc
91;voudr savoir si bétaserc médic et médic avoir mêm molécul
92;qu être que médic
93;quel médic conseil pour le naus
94;aspic nourrisson épaiss endometr
95;aim bien fair cur médic végétal par que charbon absorb tout le medic en annul donc efficac mem pour pilul aim savoir si cel être vrai
96;médic quart heur apres avoir prix granul médic médic et médic silic colloïdal avoir malad et sent malad qu être
97;j avoir saign avec pilul médic que prend depuis an je ne être qu au mil plaquet être normal
98;peut prescrir médic en tant que contracept
99;être qu peut prendr médic et médic en mêm temp
100;être possibl ovair le sein gonfl avec na
101;médic provoqu vertig
102;quel être dos optimal dexorat
103;médic entraîn cauchemar
104;pren combien composit seroquel
105;médic plus médic quel effet
106;peut prescrir dais stick boiron à femm enceint
107;souffr colopath fonctionnel et aver que seul chos qui fass réel bien être le anxiolyt malheur être auss atteint malad et avoir donc pas droit à typ médic médic médic
108;médic plus médic égal quel effet secondair
109;saign sous médian
110;surdosag tricelest quel dang
111;avoir utilis médic naxproxen médic petit dos pour problem dos avec médic être beaucoup spasm dan haut dos entre le côt problem dos à dégéner en problem malad et prend en moment médic au soir et au couch et desyrel auss au couch toujour malad bien sûr pass facil au lev crois que être le médic en avoir pas certitud que fair
112;médic et soleil
113;prend depuis an pilul médic gai à heur matin matin avoir oubli prendr pilul et vien prendr dc en catastroph à heur médic quelconqu risqu
114;prend médic ou moin géner qi appel médic ethinilestradiol médic pharmac médic redon géner comm dab mêm composit tout boit médic pas mêm design et fabric être pas mêm dois inquiet
115;connaiss équivalent au pans opsin post opératoir
116;être préfer prendr matin ou soir
117;médic droit laiss médic proctalg derri comptoir sur le étager bien visibl patient
118;prend médic depuis mois déprim pour rien y médic rapport
119;médic chez patient sous médic
120;médic exist en quel dosag
121;malad aux muscl et aux os apres avoir pris médic être normal
122;médic phosphorit regl tres doulour
123;dan quel cas médic être util
124;médic plus malad
125;prend médic depuis an et là avoir qui ressembl à regl qui arrivent en milieu cycl être toujour proteg contr éventuel malad
126;pilul médic march des premi plaquet et pas apres mois ou plus
127;quel altern à médic
128;médic
129;oubl médic conseil
130;prend pilul triafem quand oubl comprim avec triphas être que ça pass comm avec monophas veux dir mêm avec différent dosag peut enchaîn le plaquet en cas oubl derni semain et si enchaîn être seul le comprim derni couleur ou tout plaquet
131;médic curat malad toujour en dang
132;médic médic effet secondair
133;colt prendr médic ordinal fois
134;de quoi être compos médic
135;médic quoi sert médic
136;qui connaît médic
137;quel être le sign surdosag en médic
138;rotarix et effet secondair
139;être que médic contr médic malad peut déclench malad inflammatoir auto immun
140;bonjour prend médic depuis âge et être tres bien pour voudr arrêt et en prendr qui ne être qu contracept quel être le malad pilul qui ne être pas néfast pour peu toutefois qui être uniqu contracept merc rocou
141;haut et bas avec médic être normal
142;quel être dur valid médic contr malad jaun
143;médic médic ou placebo
144;médic ftp enfin disponibl
145;avoir plus regl être à caus pilul médic que avoir pris depuis mois
146;pas de question sur médic médic
147;médic quoi sert médic vulgaris
148;médic et malad
149;phosphor composit et médic composit ca sert médic quoi
150;être que médic être mem pilul que yasminel
151;patch médic comment utilis
152;une pharmacien appel car souhait savoir pourquoi exist deux ci ibuprofen disponibl ibuprofen lev composit et ibuprofen lev sant composit et pourquoi médic différent prix entre le deux
153;quel être class thérapeut médic
154;quel être dem vi adalimumab
155;bonjour bonjour voil utilis depuis peu pilul 21jours+arrêt jour sep aur aim savoir qu faut fair lorsqu médic apparit regl dur le sept jour arrêt début second plaquet ou attendr 9e jour pour fair là être complet perdu car pens que malad être venu apres le jour merc
156;avec lisanxi médic pas trop problem sevrag
157;aim demand si médic médic médic et médic don malad bras
158;peut don médic à chat sous corticoïd
159;mois médic et effet secondair
160;prend chaqu matin composit médic quel être le effet secondair
161;qu être que médic
162;médic être risqu en cas malad
163;quel être médic contr malad
164;être normal avoir symptôm en pren médic
165;qui connaît médic
166;qu être que gallium médic
167;être sous médic geek en avoir bu beaucoup ou verr whisky au bout 5e ou 6e avoir commenc à sent tres malad pens que être médic qui médic fait cet effet
168;info sur médic
169;je être enceint médic être déconseil
170;médic contr le réveil nocturn
171;lutéal heur ou heur marg
172;bonjour être actuel sous médic composit être atteint symptôm assez séver ains que troubl paniqu avec dépersonnalis être trait depuis plus mois et aucun amélior toujour auss paniqu éloign domicil et quand être médic domicil être pas mieux peur paniqu être seul peur nuit qui tomb etc vis enfer general médic dis augment médic à composit ca fais peur qu en pens
173;être que pris gélul médic peut caus augment import malad patient et si oui pourquoi
174;peut propos médic pend malad
175;pst combien temp le effet secondair à arrêt médic
176;cyclan et malad
177;combien temp dur effet méniscal
178;qu être que tricilest
179;comparaison médic médic
180;apres mois et dem médic médic gener san effet sur psy médic prescr hi médic q peut témoign à propos action
181;le antibiot provoquent il remont gastriqu
182;médic complex puis en prendr pend malad
183;y médic version géner cyclan
184;quel être médic contr malad col utérus
185;dois prendr médic cortison pour kyst dan poignet docteur médic bien dit pas sel et ni sucr moin possibl pourquoi cel
186;la sertralin jou sur libido
187;dois fair oper poitrin vaut mieux prendr opium composit veil ou au réveil anesthes
188;être que pilul médic géo don migrain
189;question sur médic
190;en qui concern délivr transgen si posolog être par jour que fait
191;lévonorgestrel pris avant ovul jusqu ou ça peut proteg
192;trimgel et médic
193;prend médic plus médic soir pour malad et ressent effet invers être normal
194;effet médic sur malad
195;être que risqu tomb enceint avec médic
196;médic connaiss
197;quel médic fair mainten que ftp être plus dispos
198;argil médic vers à utilis sur part intim
199;géner médic
200;médic marron inde où en trouv
201;médic en caus
202;médic égal médic
203;qu être différent dosag hormon entre médian et médic ou implant
204;être que dos médic être pas trop faibl
205;j avoir souvent prescript médic ne médic médic tout sous form inject et prescrit ensembl en nébulis tout être hor ami en voi aérosol et cel médic pas être test apres le laboratoir que fair
206;que fair si avoir oubli médic gai soir
207;médic contr malad à faibl dosag composit quel en être le effet secondair
208;médic prescr médic être que cet pilul être effect des premi pris qu être que cel fait si commenc plaquet alor que avoir pas encor regl
209;médic réveil nuit
210;rispéridon chez adult hyperact
211;être que pouvon substitu le prescript médic et médic par géner rembours
212;bonjour être sous séropram et médic depuis mois vais mieux concern attaqu paniqu et angoiss contr avoir malad à dorm et surtout avoir cris rir partout dan ru chez avoir impress deven débil ris pour rien mem tout seul dev écran pc le ad
213;médic convient parfait contr le phob qu en pens
214;où met patch médic pour être sur qu ne décoll pas
215;question sur médic ou sur pilul min dos être possibl que regl ne viennent pas san que être pour aut enceint
216;pren orgametil et mainten prend médic au chang pend premi mois avoir oubli prendr pilul et avoir pris heur apres ensuit avoir avoir saign pend jour tres léger et avoir trouv regl bizarr avoir fait test malad être négat être qu médic chanc que être enceint
217;médic ami en franqu
218;médic peut empêch nidat ovul dan endometr
219;médic avec autr antidépresseur
220;médic médic effet secondair
221;médic être anxiolyt
222;quel altern au méningit en cas ruptur
223;avoir tres malad médic tet avoir donc pris médic habitud ne prend que médic et apres avoir pris être rendu compt que dat pérempt être inquiet peu pens que être pas grav
224;quel tisan pour maigr
225;médic haut risqu parkinson
226;médic patient médic demand alkylglycerol contenu dan médic foi requin pour régul malad ne voul plus prendr statin être qu médic vrai cet propriet
227;enceint et médic
228;être bon prendr corticoïd quand fait vaccin
229;être que médic gener médic mem composit que médic original
230;médic cel qui utilisent médic effet secondair
231;trait malad simpl en premi intent
232;stérilet au médic et malad
233;visag bouff être que être à caus médic
234;faut prendr médic pend le rep pour limit le effet indésir
235;utilis patch médic et ça inquiet peu fois avoir sup malad et malad ventr et demand vrai si être enceint
236;comment le antidiabet diminuent il glycem
237;avoir pris médic pour ordinal fois au bout jour avoir toujour regl cel veut dir que cet pilul ne convient pas ou dois encor attendr mois ou avant savoir
238;médic et géner
239;médic et pas regl
240;une profond malad peut être caus médic
241;vais prendr pilul médic et aim savoir si médic stop le regl ou le avoir en avoir flux moin abond être tout mêm efficac ordinal jour regl
242;reprend médic et avoir avoir oubl pourr aid si avoir être dan tel situat
243;dois prendr médic x jour avoir commenc trait hi soir à heur heur cet nuit avoir oubli réveil et avoir donc pris à heur être grav
244;médic rembours
245;y médic risqu malad pend semain arrêt médic
246;qu être que médic
247;médic trait médic pour fill mois pouv dir médic long term si médic risqu pour sant
248;dois évit certain aliment avec kardefic j avoir peur que efficac var
249;quel être version non géner médic
250;le person qui avoir avoir médic prendr médic avoir avoir effet secondair à part photosensibilis
251;le l122 aid à brûl maigr
252;médic quoi sert médic médic
253;être qu doit arrêt médic si médic envi beb
254;médic dépend o bout combien jour
255;avoir avoir quelqu problem malad et voul savoir si en fais mettr implant risqu voir affreux bouton réapparaitrent
256;quel typ médic être médic
257;être sous cérazet depuis q mois ment depuis semain environ avoir pert blanch bip plus abond que habitud dois inquiet
258;quel médic contr malad col utérus
259;exist géner médic médic composit
260;prend médic mois derni avoir avoir saign lor ordinal semain plaquet mois ci ça recomment plus bel et le saign être vrai comm pet début regl et plus import être médic quoi médic avis
261;médic disponibl au québec
262;peut utilis phytothérap dan trait malad
263;quand fair médic médic chez nourrisson
264;quel être le effet secondair médic et médic
265;médic composit connaiss
266;médecin médic prescr médic et médic cepend avoir impress que médic gener commenc médic ne plus fair effet faudr que demand plutôt médic et quel être le effet secondair
267;médic plus médic
268;médic contr anxiet oui ou non
269;être qu en médic qui avoir déjà réuss à diminu le dos médic et à dorm normal
270;quel trait homéopath contr le malad
271;méthadon pour remplac médic
272;médic pour quel indiqu +c438
273;quel être être risqu rencontr si accouch avant inject médic
274;souffr malad solair médecin médic conseil médic composit problem être que ne sais pas si peux trouv ça en franqu être que quelqu peut dir exist médic mêm géner typ et si jam faut ordon
275;pilul lendemain et médic
276;gynéco médic fais piqûr médic et depuis hi avoir douleur dan ventr être que person peuvent éclairc peu
277;c quoi médic
278;avoir épanch synov apparu spontan être allé voir homéopath qui médic prescr comprim rob nigrum foli être trop cher avoir découvert que médic être indiqu dan le épanch ains qu pais mellific pens prendr médic en composit être correct
279;médic quelqu connaît
280;souhait avoir avis sur le effet implant
281;exist interact entre médic et médic
282;médic san ordon
283;quel être le vaccin possibl dur début malad
284;médic plus antibiot
285;j avoir eczem suit à pris naz que dois fair
286;qui être sous médic
287;gynéco médic demand fair médic boostrix malad malad coqueluch être enceint semain pos donc question si être danger pour futur beb
288;fiu en cuv disponibl au planning familial
289;être que médic crister médic hémifumarat peut bien substitu médic médic rat
290;effet ovul médic
291;médic médic être il réserv aux adult
292;médic entraîn malad normal
293;médic risqu pour beb médic naîtr prendr oméprazol
294;avoir boit médic qui expir en être raison le consomm ou être danger
295;le sag femm avoir droit prescrir pilul contracept dan quel condit
296;carenc en médic quel trait
297;si mauvais réaction ou si compliqu suivent médic contr malad médic combien temp apres inject cel arriv moin à part quand peut dir qu médic pas mauvais réaction ou compliqu
298;avoir fais erreur en utilis médic apres avoir mis ordinal anneau avoir retir semain trop tôt et san voir erreur en avoir mis autr tout suit entre temp avoir avoir rapport à risqu être qu médic donc risqu malad ou être que risqu être essart vu que autr anneau médic être inser just apres
299;sevrag médic tres difficil
300;quel être nombr limit bas compress délivr en an
301;médic provoqu pris poid
302;malad médic autoris
303;schem vaccinal habituel être et mois sav quel être fourchet toler entre chaqu dos
304;désol fair chi mond dit être que médic peu fair avoir érupt cutan sur corp apres mois pris avoir vu dermato dit allerg médic lessiv ou médic médic douch ou savon ou autr ca fais mois que ca dur médic ne fais rien ca gratt sur corp ventr bras sous le sein entre le cuiss comm roséol ca fais et ca gratt médic idé car en peu plus drôl tout ca merc et encor désol
305;prend pilul médic depuis mois et depuis quas premi jour pris moral être pas top pleur tres souvent et médic malad moment être tres heureux être que symptôm peuvent être dus médic pilul
306;hep dépend médic
307;une prépar en pharmac demand quel être quantit lactos contenu dan médic eh
308;carenc en médic que fair
309;médic et apné sommeil
310;qu être qu orgastoro
311;vien lir notic qui dit que dois prendr médic apres fin pilul holygiem alor que gynéco médic dit prendr ordinal jour regl alor quand dois prendr
312;médic dérembours
313;médecin prescr médic par que médic peut fair gross ceux qui en pren être que avoir gross
314;depuis que avoir pris pilul médic médic quelqu mois avoir petit tach sang ou marron san gravit aujourd huy avoir saign comm début regl assez leg ne sais pas qu faut que fass
315;qu médic dan médic médic
316;être que médic augment appet et don env mang
317;médic bug à fil mois
318;prend médic combien temp dur effet rebond decr dan notic
319;lutéal gai plus médic gai médic égal bon ménag
320;prend drill et avoir du oubli comprim et ne avoir pa repr voul savoir si aret mard comm habitud ou si prend tss le comprim
321;souffr difficult érect quelqu médic déjà utilis remed homéopath si oui lequel et avec quel résultat
322;médic et âge
323;enceint sous trait médic composit être problem
324;médic plus médic
325;dang médic à long term
326;comment fonction cholécalciférol
327;peut propos médic pend malad
328;médic fait gross
329;être pass sous fiu médic avoir mainten plaqu roug bouton sur le deux jou que fair
330;combien temp dur le effet indésir médic médic
331;peut prendr médic et médic en mem temp
332;quel être le princip actif médic
333;enchaîn plaquet adépal et repris
334;une patient trait par médic crem et ovul inquiet car urologu mar médic préconis évit le rapport sexuel pend qu être trait par médic pour évit affect le troubl prostat mar
335;médic plus médic plus avocardil jr
336;femm utilis médic depuis mois vient annonc qu médic douleur dan sein et qu sen présenc petit corp qui fait malad pouv dir si ca peux ven pilul médic
337;termin plaquet obel g dimanch soir vais avoir le regl quelqu jour apres être à dir jeud si avoir rapport sexuel avec ami être que pend cet périod quelqu jour être tout mêm proteg
338;exist coup fil vendus au détail
339;effet secondair possibl chibroproscar
340;médic médic médic fort liaison au protéin plasmat
341;médic et libido quel effet
342;rejet
343;médic retard regl sous médic être normal
344;une femm enceint peut prendr médic stodal
345;qui connaît remicad
346;mard et vendred avoir carr oubli prendr pilul médic et ai fin plaquet dimanch soir avoir pas encor regl depuis hi soir ai bien malad au bas ventr tir et impress que regl vont arriv rien pens qu avoir risqu que être enceint avec oubl
347;peut prendr anxiolyt en mêm temp que médic osa
348;être que le vitamin en cachet font gross
349;avoir achet aujourd pot spirulin en médic marqu flam vert ne sais pas comment utilis
350;médic quoi sert médic
351;médic être rembours
