;question
3883;bonjour sais question ne va pas être tres original avoir pas trouv répons sur forum prend pil monev depuis semain et dem être avant sous médic et bien évident vais avoir regl pil pend semain vacanc donc comment le décal médic simpl être enchaîn deux plaquet quelqu médic dit qu être préfer ne pas fair et commenc deuxiem plaquet premi jour regl pour le stopp quelqu peut renseign sep et ne pas fair arrêt entre deux plaquet ne va pas entraîn risqu malad merc avanc pour répons vaness
3884;prend médic depuis jour dem comprim journ quand avoir perçu le effet posit médic
3885;médic sur le troubl anxieux généralis
3886;risqu tomb enceint avec médic
3887;médic comment utilis
3888;prend médian être que peux avoir rapport san préserv entre jour arrêt pilul et ordinal jour regl ou ia risqu
3889;médic et pris poid
3890;prend médic depuis mi décembr comm avoir expliqu précédent comm avoir arrêt jour combien temp faut pour que tout stabilis sen au bord gouffr avoir tir idé noir vois psy cel va pas mieux trouv autr psy être pas évident si quelquun pourr aid sep
3891;avoir remed naturel pour aérophag
3892;exist autr vertigin médic part médic et médic
3893;médic quel marqu
3894;médic médic quel dilut
3895;être que codéin être compatibl avec malad
3896;avoir être oper doubl malad discal avoir toujour malad au lombair et au nerf malad chirurgien médic dit baiss le médic médic étais médic aujourd huy en être médic médic prescr anti dépresseur médic vu malad ex avoir arrêt seul fait arrêt médic redeclench malad déprim médecin trait médic prescr médic composit problem être que réveil médic heur matin avec gros vertig symptôm bouff chaleur être normal
3897;prend médic depuis certain temp seul avoir pas avoir temp aller cherch ordon et être tomb médic cour pilul vu que avoir déjà pris médic être que prend auss médic ad pr combl retard hi ou être qu vaut mieux attendr prochain regl pr recommenc
3898;puis ouvr gélul médic op composit
3899;par quoi remplac vasorbal
3900;avoir avoir rapport avec copain non proteg prend patch médic et depuis hi avoir enlev comm avoir plus patch depuis hi être qu avoir risqu que tomb enceint
3901;quelqu peut renseign sur médic
3902;médic médic semain quel être le effet truc car avoir pas dorm nuit ventr dur
3903;le cérat alien contr indiqu chez le enfant moin an quel altern
3904;médic si patient sep
3905;avoir avoir inject médic demand si test an médic pas peu fragilis organ car être malad être possibl que être dû au test
3906;problem avec médic
3907;quel être le risqu apres avoir inger composit paracétamol
3908;médic désinhibiteur au dessus composit
3909;médic à quel dos et quel fréquenc chez beb
3910;médic et psychotrop allopatr
3911;gastro denturologu médic prescr médic médic caus malad cherch médic tomb enceint bb3 avoir dit et médic ad mem prescr que dois fair fair
3912;aim inform précis sur vaccin infarix et prevnar être il obligatoir peut trouv le mem vaccin en dos uniqu peut fair le inject sépar car ou molécul coup être énorm en plus prevnar
3913;médic être réserv à usag hospitali indiqu
3914;médic pilul ou anti acnéiqu
3915;voudr savoir si q médic déjà souffert sécheress vaginal pend utilis épong spermicid médic
3916;voudr savoir prix médic
3917;avoir trait médic et médic pend puis être pass à médic mois avoir décid tout seul interrompr trait et depuis avoir vertig et malad li
3918;médic pourquoi
3919;petit question sur médic
3920;médic bêtabloqu contr malad
3921;puis substitu membron par médic
3922;être que sav si médic être somnifer
3923;y médic risqu malad ou malad ou autr avec médic
3924;médic et pilul
3925;trac et médic
3926;enceint et médic malad médic
3927;qui connaît remicad
3928;avoir oubli trois jour suit prendr pilul et avoir pris hi et aujourd huy ne sais pas quoi fair demain matin reprend pilul ou attend fin et reprend normal
3929;médic et médic ge idem
3930;voul savoir si pouv fair médic tetr en primo vaccin
3931;médic quel périod faut prendr acid amin
3932;être sous pilul médic et avoir fait oubl avoir repr pilul oubli et avoir avoir que deux rapport pas malad depuis donc là avoir fin deuxiem plaquet et pas regl comm habitud reprend pilul lund soir san pos question croi
3933;médic matin ou soir
3934;la pris poid être commun sous seropam
3935;être normal avoir pert sang en utilis médic
3936;le médic peut entraîn troubl sphinctérien urinair
3937;géner médic
3938;avoir fait vaccin malad et depuis avoir sperm musculair dan gorg être que être arriv médic autr person
3939;à quel heur être préfer prendr médic
3940;exist médic uniqu pour tétanos san aluminium ou autr addit nocif
3941;quel être le différent dosag infarix disponibl
3942;médic temp absorpt
3943;bonjour voilà avoir pris médic pend âge et là chang pour médic sais que le regl arrivent pend le cachet blanc par exempl si elle arrivent pend avant derni ou derni cachet blanc alor avoir le regl que pend jour vu qu apres derni cachet blanc enchaîn avec autr plaquet être perdu vu qu avec médic médic paus semain et que le regl arrivent pend cel ci hep merc pour répons
3944;quel être nouvel ad qui peut remplac médic
3945;quel être le indiqu médic
3946;prend médic et soir avoir pris avec décalag minut médic risqu tomb enceint
3947;médic prescr médic être que le effet secondair durent longtemp
3948;souhait avoir enfant par contr prend pyrex composit par jour médic til risqu avec médic
3949;prend médic op composit matin depuis plusieur anné cellul jour depuis plusieur mois me gamm g être réguli aux alentour hi médic en être caus
3950;pt amoxicillin composit comprim
3951;médic
3952;médic combien temp pour fair effet
3953;être sous médic et médic être compatibl avec malad
3954;question médic
3955;médic composit composit flacon composit
3956;dois fair deux vaccin test et hépatit médic voudr savoir si vaccin peuvent être fait en mêm temp ou médic intervall à respect
3957;sevrag médic égal jour sur
3958;médic pilul dos ou pas
3959;souhait fair pos stérilet en médic lor prochain regl voul savoir avant si peux sent gên lor rapport et si ça pouv boug
3960;avoir infos sur médic et le fleur bach
3961;patch médic mêm dosag
3962;comment pass médic à carolin
3963;opium composit peut être utilis pour diminu le douleur post opératoir
3964;peut fair médic contr malad enceint
3965;prend médic médic bloqu et à chaqu fois avoir gros coup barr heur apres avoir pris pend ou deux heur être que cel être normal pour ceux qui connaissent ou être que doit arrêt trait
3966;combien coût plair
3967;médic part quand pilul médic fait effet
3968;bonjour avoir être sous médic jour semain derni puis sous joséphin heur à hôpital et être désorm sous médic avoir trais malad médic épaul droit depuis mid ami médic sugger regard sur notic et vois chez enfant en cas symptôm articulair arrêt tt mettr articul au repos et préven médecin trait qui prendr le mesur nécessair ne être pas enfant quelqu peu en dir plus
3969;chang mélod pour anneau être que fais arrêt jour puis met anneau ou être qu fois fin le comprim couleur met anneau lendemain
3970;médic
3971;qui connaît médic
3972;médic gélul quel autr form
3973;bonsoir sep prend médic comprim et sain pos et médic derni semain plaquet en pens avoir oubli prendr pilul vendred soir en avoir pris samed soir avoir bien pris vendred soir et vu que pens vrai avoir avoir retard plus heur sav kil dall enchaîn avec autr plaquet san vair pos semain être rendu compt mard soir suiv ordinal jour semain pos normal que bav avoir aucun retard et que coup samed ai pris pilul et lund et mard étant censi être debu semain dépos ai pris plillul bref fait prendr pilul soir et fais doubli na pas prendr pilul dur pos soir suit en occurrent quel peuvent être le conséquent dol si avoir bip malad médic comprendr merc aid bip
3974;oubl comprim médic avant hi que fair
3975;quel être le effet secondair médic
3976;norlévo et retard regl enceint
3977;peut prendr médic coup
3978;que peut prescrir à beb moin mois pour malad en huil essentiel
3979;psy médic prescr médic soir et pren médic matin alor qu en don deux général médic effet à côt
3980;médic levur et malad dang
3981;depuis âge être sous diane35 et là mois gym médic chang pour leelo gai avoir dû arrêt pilul et depuis être pas bien moral être que ça peut être médic arrêt pilul ou être tout simpl
3982;être que min être somnifer
3983;peut utilis médic protect en prévent primair
3984;avoir pris médic avoir arrêt complet et depuis sent pas bien étourd malad sensat tomb dan le pomm encor combien temp vais devoir support cet état
3985;je être sous pandour composit et médic composit et avoir avoir rapport non proteg aim savoir pourquoi sur notic médic être précis que doit prendr contracept avec médic
3986;médic peut til médic tout seul enlev abces
3987;efflexor matin ou soir
3988;avoir pris médic comprim par jour pour circul veineux pas terribl être qu faut arrêt ou non endotélon pend malad
3989;question médic
3990;quel conseil pour utilis pilul médic gai
3991;peut prendr médic enceint
3992;réaction médic mois apres
3993;avoir oubli pilul être dan derni semain plaquet e avoir pas avoir rapport sexuel hi soir mard soir que dois fair prend médic
3994;médic et liquid qui sort sein
3995;avoir irrit apres le rapport exist médic pour réhydrat
3996;le produit homéopath être en vent libr ou uniqu sur ordon
3997;être que médic peut chang odeur urin beb
3998;pharmac médic délivr par erreur boit composit médic au lieu 1oomg avoir don trait médic enfant 6kg sach que étai suppositoir matin mid soir être grav y médic dang pour enfant
3999;être que médic être médic except
4000;médic qui adress médic composit
4001;quel trait pour douleur au cuir chevelu
4002;médic gai être ident à médic gai
4003;avoir effet au niveau sommeil en pren médic
4004;médic arrêt fum
4005;géner médic question
4006;mépronizin quel form
4007;lutéal gai être géner médic
4008;voudr savoir si médic avoir tendanc à aggrav adné
4009;la médic médic ami pour symptôm essentiel
4010;médic info officiel
4011;peut tomb enceint en avoir stérilet médic
4012;médic ostenil être rembours par sécur social
4013;ne être plus vierg alor être que médic contr malad col utérus être efficac
4014;quel être le statist risqu phlébit sous médic
4015;médic quoi ser médic
4016;elle perdent tous poid avec prob composit ne comprend pas pas
4017;sous médic suit médic malad pulmonair dois prendr trait médic jeun combien temp avant pris trait puis prendr rep grignotag
4018;prend médian hi être sens recommenc plaquet apres semain interrupt et avoir oubli soir avoir pris comprim hi plus aujourd huy pas en mêm temp médic heur intervall environ or fall prendr le comprim simultan être grav
4019;quel médic pour irrit au niveau yeux
4020;médic médic composit
4021;médic et perturb hormonal
4022;connaiss remed pour bien diger
4023;être méthadon travers barri placentair
4024;quel être le effet secondair médic et médic
4025;le médic être quoi
4026;avoir pris beaucoup poid en pren médic depuis presqu an que fair
4027;arrêt médic sensat à tet
4028;depuis semain que prend paroxétin ne dor médic quelqu à qui ça médic arriv
4029;médic mer valérian ressort par le por
4030;être possibl prendr médic en mem temp que médic
4031;médic quel être le dang
4032;médic
4033;séropram en attend enfant
4034;ai pris médic presqu tout malad et pour dorm doc don composit médic composit desyrel trazodon médic prendr au couch avec composit vatican quel être le risqu pour beb
4035;médic et risqu malad
4036;avoir oubli prendr pilul médic en être aperçu dan le douz heur prend pilul malad heur et là avoir pris malad heur matin être inquiet
4037;le antidépresseur être respons malad auto immun
4038;mon médecin avoir prescr médic composit et avoir oubli dir que avoir être oper occlus intestinal médic âge être que peux quand mêm prendr médic
4039;médic à quatorz an être possibl
4040;médic posolog
4041;prend médic pour ordinal fois sen à nouveau extrêm tendu crisp réveil à nouveau en plein nuit san pouvoir rendorm cet baiss régim et insomn être elle normal apres semain accalm
4042;médic pour dorm
4043;vien commenc médic réveil tout le nuit qui ne arriv jam habitud sen nerveux et surtout avoir plus faim de expérient similair
4044;médecin médic don trait dont médic cet fois ci à premi pris avoir avoir tres gross réaction allerg être normal
4045;médic au médic vais avoir le effet indésir début
4046;prend pilul lest et là avoir peu malad au ventr avoir égal regl alor que avoir dû le avoir dimanch ou lund janvi que dois fair
4047;être sous médic voilà mois être pass sous médic et depuis chang regl être moin en moin import voir trais trais discret être normal ou devr plutôt incit selon
4048;puis prendr comprim médic sort blist depuis semain
4049;dépend médic
4050;yasminel empêch ovul ou pas
4051;sous quel form présent médic composit
4052;que prendr en cas regl doulour
4053;médic risqu accoutum
4054;médic effet posit quand
4055;sous médic avoir décid diminu le quantit mani progress avoir être victim symptôm accompagn sensat intens chaleur pert équilibr et troubl vu pens que diminu quantit bêt bloqu peut entraîn genr symptôm
4056;médic qui connaît
4057;il médic risqu enchaîn plaquet médic
4058;être qu anti dépresseur entraîn ruptur anevr
4059;qu être que remicad
4060;être qu peut fair pos stérilet au médic en dehor regl
4061;quel être le moin médic
4062;bonjour être sous pilul depuis âge médic et mois ci avoir arrêt pour reprendr demain et avoir toujour rien avoir mis à part léger trac ros pâl sur papi ne avoir pas oubli pos plein question être que cel être déjà arriv merc avanc et bon réveillon
4063;homéopath médic prescr médic médic à prendr fois par jour faut le prendr préférent loin rep ou soir
4064;petit question sur strepsil
4065;efflexor matin ou soir
4066;sous antibiot médic
4067;médic élimin médic fait par voi rénal ou hépat
4068;dois prendr toujour deux cachet gélul tetramysal le pris ne doivent plus fair pend rep voudr savoir quand pourr le prendr mani optimal sach que dois fair pris par jour gélul
4069;une médecin dermatologu à retrait souhait connaîtr dat retour médic crem
4070;oubl comprim médic heur oubl fais quoi
4071;j avoir patient qui amen ordon enfant mois et an pour box quel être indiqu et util
4072;ibuprofen être danger
4073;médic j10 à quand le effet posit
4074;quel être géner médic
4075;peut trouv médic tp ou ftp en ital
4076;médecin prescr médic coud composit pour troubl sommeil pourt lis partout que pour cet caus composit qu faut quel être bon dosag
4077;urgent j+5 apres arrêt pilul médic et pas regl normal
4078;avoir déjà pris médic médic an sur dur an et dem san aucun souc nouveau être trait depuis tout prit peu plus mois au bout semain être mis médic avoir plaqu qui démang ca gratt et ca gonfl ca fait comm piqûr orti sur peau avoir vu médecin et médic don médic médic prendr anti allerg vien commenc matin et être bien vrai cel médic calm malad sur notic médic médic not pour le effet indésir tres rar érupt cutan être pourquoi demand si souc médic pas lien avec anti dépresseur peut être que q médic déjà rencontr souc
4079;pouv dir si médic être efficac pour lut contr le idé noir
4080;médic médic être rembours
4081;avoir avoir effet secondair apres pris médic
4082;effet posit médic pas tout journ
4083;vien prendr composit médic risqu quoi
4084;la pilul médic être pilul fort dos
4085;je voul savoir si pouv prendr pilul peu en avanc ln avoir lu que être possibl aim savoir si lendemain dev prendr à mêm heur et si effet contracept être toujour conserv
4086;comment trait pied athlet chez enfant an
4087;si être enceint être pas danger prendr lutéran
4088;médic babybalm retir march
4089;dois fair médic malad médic être allerg aux œuf voudr donc savoir si import qu trac œuf être présentent dan médic
4090;médic être normal avoir douleur au ventr
4091;vous connaiss médic pour soign malad
4092;être que ghb trait malad et dépress
4093;être que peut achet médic san ordon
4094;qu être que médic
4095;être que médic être effect des premi pris qu être que cel fait si commenc plaquet alor que avoir pas encor regl
4096;y médic effet secondair pend le premi semain médic symptôm cris angoiss
4097;comment prépar hepar médic d8 et médic auto cultum d3
4098;avoir déjà avoir effet secondair avec médic
4099;médic prescr médic quel être le effet secondair que ca occasion
4100;qu être que médic
4101;roacutan question
4102;médic pour enfant an
4103;souhait fair vaccin contr malad avoir peur si fais médic jour ci ne plus être immunis en févri
4104;et médic qu en sav
4105;bonjour prend pilul médic gai depuis mainten mois dois prendr comprim pend jour puis fair paus jour voul savoir si pend cet périod jour pouv avoir rapport avec copain merc avanc pour répons
4106;plus aim savoir être nécessair prendr médic tous le jour à mêm heur
4107;oubl mélod que fair
4108;prend pilul cérazet et avoir saign depuis semain comment être possibl avec organ femm
4109;j avoir pris pilul deux fois en journ qu être que risqu
4110;peut prescrir médic pend malad
4111;quel être le chang observ à arrêt ovul
4112;être qu peut prendr médic pend malad
4113;malad avec médic
4114;être que peux prendr médic pour symptôm
4115;une patient être vu prescrir médic eh par médecin derni avoir pas spécifi posolog souhait donc savoir combien fois utilis produit
4116;comment savoir dosag griffon
4117;être q peux prendr comprim médic coup au lieu
4118;bonjour prend médic depuis peu plus deux semain et depuis coq jour avoir malad à respir être comm oppress arriv pas à inspir profond être que avoir avoir cas qu en pens
4119;médic médic fait perdr poid
4120;malad insupport et médic
4121;anciennet trait médic
4122;combien coût boit médic
4123;médic besoin renseign sep
4124;bonjour pi don médic associ médic et médic merc répondr
4125;demand si pouv prendr médic et médic en mem temp
4126;perdu poid avec médic
4127;j arrêt progress médic avoir sensat décharg électr être normal
4128;pilul médic être quoi
4129;dépend médic
4130;médic caus malad médecin médic prescr pulvéris rhinofluimicil trois à quatr fois par jour notic être pas clair pouv éclair
4131;veux don carentiel composit pour soir être que avoir effet secondair
4132;médic être médic pour quoi
4133;boit médic ou comprim
4134;prend médic gynéco dit arrêt et propos stérilet médic quelqu médic être dan mêm cas que comment stérilet médic support
4135;aim savoir si peux remplac dos médic en composit dos par granul médic en k ou dan autr résolu
4136;avoir lu sur notic que si comprim entre jour médic être oubli doit prendr comprim oubli et fin plaquet cel veut donc dir que dois prendr comprim hi et celui hui en mem temp
4137;avoir pris médic pend jour consécut bip effet secondair med médic dit arrêt spontan médic semain et depuis avoir malad et peu énerv être normal
4138;être que peux prendr trait par médic matin
4139;médic gai qu être
4140;prend sipralex depuis an avoir commenc à sent mieux apres semain depuis cet hiv être nouveau tres fatigu parfois avoir pas forc pour fair certain chos faut dir que avoir augment dos anti dépresseur depuis jour alor être que être le anti dépresseur qui rendent auss naz ou être symptôm malad
4141;oubl pilul médic risqu
4142;commenc avec appréhens chimio jeud qui assoc médic plus médic être que quelqu connaît et peut en parl
4143;médic peut résoudr problem éjacul précoc
4144;goual savoir qu étai en le effet indésir médic
4145;peut prendr médic et fleur bach en mem temp
4146;être sous lutéal depuis deux mois et dois pass à plair quel être march médic suivr paus ou pas paus
4147;rappel médic quant imper dan le mois
4148;médic et hta
4149;comment fonction médic col utérus
4150;comment proced à cur spirulin
4151;médic san ordon
4152;interact entre médic et cellul pour maigr
4153;question médic
4154;bonjour être sous médic depuis mois avoir problem pert malad qui que dois fair merc avanc
4155;de quel form être le comprim célécoxib composit zentiv
4156;médic fait gross
4157;apres install stérilet avoir avoir petit pert brunâtr avec malad etc dois inquiet ou cel être normal
4158;quelqu question sur médic
4159;quel être le effet médic et médic médic
4160;prend millepertuis en gélul jour question être quand dois le prendr
4161;puis prendr médic avec médic
4162;aim savoir si être possibl ressent le effet diminu médic seul mois apres cel fait semain que ressen effet et être pir en pir être normal
4163;aim savoir si malad person avoir entendu parl ou utilis le dos vaccinotoxium pour évacu le toxin médic
4164;peut obten isoror san ordon
4165;médic fait gross
4166;peux inject médic médic person qui fait hémorrag
4167;médic sur ordon
4168;seropram+ médic en essais beb
4169;quel être dos initial recommand pour médic
4170;pren jusqu alor composit médic par jour être comprim et depuis jour être pass à composit avoir impress aujourd huy sent malad que fair
4171;puis utilis crem médic périm deux semain
4172;médic peut être délivr au planning familial
4173;médic besoin renseign sep
4174;aim savoir auss si être normal si avoir encor pert brun avec trinordiol
4175;prend depuis peu oenobiol aquadrain qui expir en avril le gélul être elle encor activ
4176;médic boît médic
4177;être allerg au curar médic médic risqu si prend médic
4178;médic person qui avoir arrêt trait san retour pilos exec ou bouton avec médic
4179;prend actuel médic composit matin et soir et sent tout bizarr march bizarr sent plan parl comm si être bourr avoir envi couch pas systémat dorm être que effet être déjà arriv
4180;prend médic être composit par jour qui fait total composit médic en jour quel être le conséquent
4181;médic symptôm
4182;le go synvisc médic prescript réserv à certain spécial ou médecin général peut prescrir
4183;quel bilan biolog à instaur médic
4184;y médic beaucoup effet indésir avec médic
4185;médic qui adress médic
4186;médic hypoïd et immurel être il compatibl
4187;doit arrêt médic pour commenc médic ne sais pas quand car ne être pas bien regl niveau symptôm dois commenc quand
4188;médic plus médic
4189;fiu médic comm contracept
4190;microvial
4191;avoir commenc mélod avoir être sujet plusieur fois médic cris asthme et malad asthmat ia contr indiqu
4192;médic être danger
4193;y médic risqu à ne pas fair médic malad bis avant malad
4194;mélod sein gonflent et font malad être normal
4195;médic mang moin et gross médic vu œil pourquoi
4196;bonsoir oui oui oui habitud question concern médic vient fill aujourd huy être jeun homm qui pos pour ami proch ami médic avoir premi relat sexuel médic plus an mer aujourd huy veut absolu qu fass médic ose pas dir non peur réaction que être le risqu fair médic et avoir premi relat sexuel médic plus an horm non fonction médic quel être le risqu merc pour répons
4197;peut prendr médic mid
4198;le médic médic pour enfant an kg souffr malad quel posolog met
4199;médic et médic dur malad
4200;médic médic et sépi pend malad
4201;voudr savoir être possibl prendr le huil essentiel en gélul
4202;être que médic continu provoqu effet indésir
4203;pourquoi oubl pilul plus heur peut don risqu malad alor que pend pos jour maximum rest proteg
4204;baldrian pour dorm être compatibl avec médic
4205;prend pilul médic malad heur avoir pris pilul environ heur apres avoir avoir nouvel cris malad qui être enchaîn tout nuit faut reprendr pilul sach que allais avoir nouvel cris en avoir pas pris avoir avoir rapport non proteg jour avant ia risqu malad
4206;être que médic être sous form capsul moll car dan malad spécial avoir pas aim cet form
4207;consomm médic fois dat pérempt pass possibl
4208;quel être le géner médic
4209;être que médic entraîn malad
4210;mélod trac
4211;kelkun médic médic pour arrêt regl
4212;médic pend rep
4213;souhait savoir si médic aux plant médic aubépin et prepaus gattili alchémill achill être compatibl ensembl
4214;voudr savoir si fait commenc pilul ordinal jour regl avoir risqu tomb enceint
4215;vien réalis ide pour médic bug lit normal résultat au bout heur seul au bout heur voil avec indur plus mmm être que dois comprendr que être peut être infect
4216;apres sevrag rivortil être qu peut prendr médic
4217;adépal don malad
4218;être vrai que adépal être fort dos
4219;avoir pris antibiot rifampicin avoir lu que associ rifampicin et pilul mien médic gai était pas bon être cas
4220;bonjour prend géner pilul médic et le oubli ou fois dan mois mai avoir avoir regl juin comm habitud san retard depuis jour avoir pert marron roug et avoir malad au ventr et médic semain ça avoir vom être pas vrai vom enfin être bizarr pend oubl avoir avoir rapport non proteg aim savoir médic risqu malad ou pas comm des enfant avoir peur que être malad nerveux merc répondr médic bientôt
4221;médic et médic
4222;quelqu sait si médic anti malad être danger enceint
4223;cel fait mois environ que être sous médic et ne vois pas vrai amélior au bout combien temp cel fait effet
4224;lorsqu lit notic médic être écrit qu apres délivr symptôm ne doit pas exced cel signif donc qu peut laiss en dehor frigo non dan cas être mieux laiss au frigo aut que possibl ou faut sort
4225;quel être le indiqu médic
