;question
5848;une prépar à hôpital souhait savoir faut conserv à abri lumi le spécial suiv médic lev médic inject médic lev médic inject médic lev médic médic dilu pour perfus
5849;comment march médic
5850;quel topiqu pour dermatit atop enfant
5851;médic tranéxam quotidien qui avoir remarqu modif voix
5852;médic ça agit sur quel récepteur
5853;patch médic être qu peut mettr sparadrap
5854;voudr savoir si fill être tomb enceint sous médic mem en pren réguli
5855;médecin vient administr médic médic fill qui avoir déjà reçu semain derni médic risqu
5856;médic
5857;associ médic et médic possibl
5858;être que médic ralent croissanc
5859;médic et malad
5860;être que peux prendr pilul médic des soir plutôt que attendr que regl arrivent
5861;être sous triafem et vais avoir regl semain médic ven et avoir voulu continu médic prendr pilul avou que fait qu agiss pilul triphas ne sais trop comment prendr pourr aid
5862;patch médic convient aux ados comm aux femm plus âgé
5863;être sous médic pour cris symptôm et symptôm et à deuxiem rend psychiatr médic prescr médic avoir lu chos terrifi en mati symptôm pouv rassur
5864;aim savoir si qqun ici si anti dépresseur médic peut provoqu idé suicidair
5865;bonjour copin être fait vaccin médic semain contr rubéol en parcour différent forum avoir vu que médic rubéol était en fait virus affaibl et qui comm effet secondair peut déclench rubéol chez certain patient problem être que allon part en vacanc avec amis prochain dan semain et voul savoir si person vaccin contr rubéol pouv être porteur et donc contamin autr person avoir aucun souc pour et copin ami avec qui parton être actuel enceint plusieur semain et ne souhait pas que transmet rubéol tres grav pour beb lorsqu person être enceint voil donc pour résum question person vaccin contr rubéol être porteur virus le quelqu semain apres avoir reçu médic conseil au femm just ne pas tomb enceint le mois suiv vaccin person vaccin contr rubéol peut transmettr virus proven médic médic entourag médic risqu que partion semain en vacanc ensembl remerc
5866;être possibl prendr médic ou médic au cour malad
5867;je vais arrêt prendr merdaillon comment cycl vont être
5868;médic fich an
5869;pris h avant médic pour paus sterlet et heur apres segment qui ressembl médic début regl donc paus sterlet symptôm et segment dan journ et lendemain plus rien ni symptôm ni segment être normal
5870;depuis que prend lutéal gai malad médic pas malad augment être normal
5871;bonjour médic suit consult avec gérontologu celui ci médic décid administr médic à per h an symptôm psycholog pert mémoir p concentr malad cardiaqu sujet sous symptôm manqu nourritur malad malad mar vertig bip malad à march p équilibr pert mémoir symptôm sommeil assist respiratoir nuit mêm si consomm être régul rhinit chroniqu etc question être assez simpl étant don le effet secondair médic sur fluidit sanguin le intoler digest possibil vertig troubl humeur remerc avanc pour conseil et souhait bon journ abigail p cet malad évolut fait que cet ancien sportif trouv confin chez fin le petit balad dan campagn pop médic avoir interrupt consomm pend quelqu jour suiv rechut nb avoir téléphon pour plaindr dorm h par jour avoir sugger supprim médic plutôt que prendr encor cec cel messag édit par abigail22 à
5872;qu être que locoïd
5873;quel spécial peuvent effectu prescript initial médic
5874;être sous médic donc régul humeur entihepilipt et être sous médic voudr savoir dosag maximal ami contr anxiet par jour
5875;médic malad entraîn effet secondair
5876;dépend médic
5877;médic r pour quoi
5878;conseil pour remed naturel contr malad médic pend malad
5879;médic composit fait gross
5880;quel être dos usuel médic pour enfant
5881;prendr médic pend malad
5882;médic gai connaiss
5883;souhait savoir être possibl remplac comprim composit médic par comprim composit
5884;qu être que sédat pc
5885;question sur médic
5886;médecin fait prendr médic n être bon que pour le malad
5887;fiu médic regl ou saign j12
5888;quel être le dosag exist médic
5889;médic en médic et effet sevrag
5890;j avoir cystit apres rapport sexuel depuis que prend pilul être normal
5891;médic égal libido à zéro
5892;malad va avec médic et médic
5893;bonjour bonsoir voilà selon séjour en psychiatr que avoir survécus don tout sort molécul expliqu médic au patient donc môi avoir médic composit qui pour temp avoir aucun effet ou pratiqu plus aucun efficac donc don autr molécul médic autr patient et donc médic au patient genr le fous ou danger ou tres agit agress prescriv médic goutt bleus pour quoi trait et pas autr trait et mis en plac en quand malad et médic agress et symptôm dit que dépend être séver extrêm psychiqu et physiqu bien plus inimagin que le autr molécul actuel sur march avoir malad à comprendr que çe pass dan têt médic être consider comm trait urgenc dan le secteur don goutt bleus sensat pos direct tres calm zen attitud absolu bien être calm décontract musculair total que avoir jam éprouv avec le autr molécul don hi et ressen encor espec effet décontract et surtout sédat non somnolent en q que sort ç être vid dan têt être calm aim avoir avis pour quoi cet molécul ait pas autr molécul médic e prescrit en urgenc donc voilà merc
5894;peut prendr médic à mid
5895;médic géner
5896;médic et effet thérapeut
5897;peut remplac lévothyrox composit par médic composit
5898;effet secondair avec médic
5899;être que médic être danger aux person avec malad et symptôm pré éclamps
5900;ce matin avoir fait test ovul qui être posit alor qu hi soir être négat être que être chlomadinon qui modif résultat test
5901;qu être que cyclan
5902;quel être le effet indésir médic
5903;vien découvr que être enceint et fais réguli cris malad avoir habitud prendr médic caféin et proctalg accord avec beb
5904;voudr savoir si connaiss médic qui être pareil ou presqu au médic cel ci san ordon
5905;c être quoi médic racemos
5906;prend médic depuis jour et avoir gross kg être effet secondair médic
5907;quel médic pour baiss libido sous cyprotéron
5908;connaiss moyen pour pouvoir retard ou avanc regl
5909;je avoir pas regl apres jour médic gai être normal
5910;infos sur lutéal gai inconvénient
5911;être tort avoir attendu le regl pour commenc médic
5912;médic paracétamol
5913;médic anti grippal pour le cardiaqu
5914;prend patch médic depuis deux semain et avoir tas effet secondair que fair
5915;médic anti inflammatoir
5916;dépend médic ou non
5917;effet médic
5918;avoir problem avec médic dois chang pilul
5919;quel être le symptôm sevrag médic
5920;prend pilul holgyem malad fin plaquet mois derni avoir avoir pert marron avoir enchaîn avec plaquet suiv et le pert avoir pas arrêt et être devenus saign fais paus jour cepend avoir toujour léger pert marron voudr être sûr que être toujour proteg
5921;dan tous le médic médic toujour codéin
5922;voul just savoir si exist médic ou médic qui fait disparaîtr nouvel ou ancien cicatric si exist comment appel
5923;gynéco médic prescr médic pour bouton dan dos et sur notic médic écrit que être pour douleur aux sein être que quelqu médic expliqu
5924;avoir trait hom comport plusieur médic homéopath médic vom sépi médic médic et médic être que peux prendr tout le granul ensembl diver médic ou dois le prendr le un médic suit malad en met temp entre chaqu
5925;j avoir perdus appet apres arrêt médic être normal
5926;dois commenc trait sous médic être tres inquiet par rapport aux problem pert malad et insomn pourr rassur et éclair quand à problem
5927;médic mer prend avec médic chaud ou froid
5928;être que médic agit plus longtemp que médic
5929;le médic être contr indiqu chez person cardiaqu
5930;mon frer prend médic médic médic et à médic par jour je trouv qu être trais ralent et dort plus en plus dois fair quelqu chos
5931;principal médic provoqu cauchemar
5932;bonjour tout mond apres avoir essai plusieur ris médic médic médic séroplex pour caus malad malad et symptôm avoir fin par désesper en dis qu aucun ad ne parviendr à rendr vi plus souri plus qui décourag être pris poid kg dont soupçon être effet secondair être dis pilul bonheur aujourd huy psy médic chang séroplex contr médic or ne être pas priv fair fair part craint concern paroxétin et pris poid alor voilà veux avoir bon panel qui répond à cet question avoir pris poid sous médic si oui avoir chang mod alimentair parc que fais à suivr régim tout à et à fair à deux heur fitness par jour et balanc ne daign pas boug moral avoir encor plus moral qui déclin
5933;dois appliqu crem rectal médic ne sais pas si dois appliqu cet médic sur hémorroïd ou alor appliqu médic direct dan rectum car médic sort petit pipet qui don avec tub
5934;doc médic prescr composit seroquel plus fais délir épouvant effet médic
5935;être qu exist géner médic
5936;médic et transgen peuvent être suiv consomm ponctuel médic
5937;être que médic peut arrêt le regl
5938;médic médic raison inquiet
5939;peut aid pour médic
5940;être que pilul médic être efficac des premi comprim
5941;puis utilis huil essentiel pend malad
5942;trait tæni
5943;pert sang sous stérilet en médic stérilet trop grand
5944;quel formul médic écrir sur ordon pour délivr produit en avanc
5945;sevrag médic et malad
5946;être sous cérazet depuis mois avoir normal dû avoir regl médic jour rien normal
5947;la pharmacien souhait savoir comment vérifi rest dos dan médic hal
5948;médic pert cheveux
5949;comment don à enfant autist médic
5950;que fair si avoir malad apres avoir pris médic
5951;médic plus médic incompatibil
5952;être sous médic depuis mois et voudr savoir médic part combien temp voit le effet sur malad merc répondr le fill
5953;bonjour depuis arrêt pilul avoir bouton sur mâchoir dermato prescr lotion médic médic mettr matin et soir ca fait semain que utilis ne trouv pas bip chang aim avoir avis être enceint et accouch novembr et aim que ca être part ici car vrai moch attend témoignag merc
5954;temp efficac médic gai
5955;adépal plus cigaret
5956;défonc au médic possibl ou pas
5957;être enceint 5sa et atteint malad malad médecin médic prescr médic composit compatibl
5958;avoir suppl weled dedan médic médic met médic médic rad médic gelsenium sep qui connaît
5959;médic que prend depuis deux semain don malad à estomac sav si si être effet secondair passag
5960;prend médic et aim savoir si peux avoir rapport sexuel san capot pend le petit pilul blanch placebo fin plaquet
5961;quel être différent mod action médic lyon et médic sublingual
5962;effet secondair avec luthenyl
5963;médic polio être nouveau dispos en franqu
5964;comment prend médic sublingual
5965;être ancien allerg aux pollen gramin malheur enceint avoir nouvel cris comment peut ger cris
5966;médic remed efficac contr malad et symptôm hor homo pour femm enceint
5967;médic effet indésir si combin médic et médic
5968;avoir avoir rapport non proteg mard derni et avoir oubli pilul médic gai lund suiv avoir pris comprim oubli à heur alor que prend habituel pilul à heur être qu médic risqu gross
5969;médic être hépatotox
5970;médic connaiss
5971;qu être que pilul médic
5972;effet indésir médic
5973;aim savoir si fait aval comprim progéri avec peu médic tied chang effet médic ou plutôt rend moin perform ou provoqu ne sais quoi qui va rendr organ moin récept au produit le pris suiv
5974;bonjour voilà ça fait mois que prend pilul lutényl émeu au 24em jour avoir arrêt plaquet jeud derni et dois reprendr soir m avoir toujour pas regl être normal ne avoir pas oubli et mar retir toujour avant éjacul sais que cet pilul peut provoqu absenc regl m mêm au ordinal cycl merc répondr symptôm avoir an et ne veux plus enfant
5975;médic depuis semain et effet bizarr que fair
5976;prend médic depuis quinz jour et avoir effet secondair irrit aux lentill contact être possibl quand gard mêm pilul effet estomp
5977;médic pour guer malad
5978;contracept arrêt médic pour commenc médic comment fair
5979;prend lutéal gai géner médic et hi avoir avoir malad moin heur apres avoir pris pilul avoir pas plaquet secour avoir pris pilul jour suiv dois proteg autr façon jusqu à fin plaquet
5980;être qu peut prendr evotirox pend malad
5981;dermatologu médic prescr cellul médic par jour prend auss médic médic par jour et avoir vu que le être pas compatibl dois arrêt médic
5982;qui connaît médic médic
5983;prend médic depuis octobr derni depuis quelqu jour avoir malad au niveau ovair cot droit ventr gonfl malad latent malad être nopal
5984;problem sous médic hep
5985;différent compo vaccin médic et meninvact
5986;médic fort pend malad
5987;médic rembours
5988;quel être dosag optimal en médic
5989;médic et pilul possibl dur malad
5990;depuis que mar prend médic composit fait plus en plus cris avec vertig symptôm et bouch seich être normal
5991;transpir excess médic quel coût
5992;solut contr baiss libido anorgasm
5993;médic quel effet secondair
5994;médic et malad
5995;être que quelqu médic déjà avoir effet indésir avec médic composit
5996;voul savoir si médic amarr être antibiot
5997;effet indésir médic contr gastro
5998;être que médic provoqu cris malad
5999;médic tetr et malad
6000;peut prendr médic quand être enceint
6001;aim avoir avis pour qui pren médic selon vécu avec trait médic avoir égal compliqu tout sort q être le risqu ia risqu effet secondair incur
6002;être que homéopath peut être utilis pour le regl doulour
6003;médic diminu traitement=pert poud
6004;prend médic depuis mois et avoir lu que médic pouv être danger si pris médic long term être que quelqu en sait pus
6005;le médic peut être prescr chez person âgé
6006;médic comprim sécabl
6007;si avoir déjà avoir pert brun fonc voir roug sous médic pouv dir combien temp ça médic dur
6008;médic à qui adress trait
6009;médic être pareil que médic
6010;stabilis par médic théralit ne dor plus que fair
6011;stérilet médic malad
6012;souffr cris hémorroïdair qqun peut aid
6013;médic et médic
6014;ne être pas bien avec médic devr reven à médic
6015;exist comprim médic op composit
6016;prend pilul médic depuis jeud avril rdv chez gynéco et depuis matin avoir point roug sur poitrin être que être li médic pilul ou coup stress attend répons avec impatient merc avanc jennif
6017;prend pilul isorel et avoir fait jour arrêt et toujour pa fauss regl asque normal ne pas avoir saign pend le jour arrêt
6018;puis prendr médic en mêm temp que médic foliqu et médic
6019;qui connaît médic
6020;pilul médic gai risqu
6021;on médic prescript bott march haut pour fractur tibi péron redirig patient chez médecin pour pos
6022;oubl médic ordinal jour que fair
6023;médic pris en charg
6024;être fait oper malad mâchoir être sous l72 avoir arrêt car dort tres malad avoir malad à endorm lev encor plus fatigu que dois fair
6025;en cas malad quel médic délivr arec ou d
6026;être vrai qu exist médic en allemagn contr le malad
6027;dermato prescr médic aim savoir si le effet secondair être fréquent
6028;être énorm stress médic caus p coupl quel médic pourr prendr pour détendr et ne pas fondr en larm médic chaqu trac
6029;avoir enfin trouv médic qui soulag yeux sec pais mellific eh médic officinal eh médic officinal eh a qsp flacon professeur qui suit pour syndrom et état général dit que médic être muguet
6030;médic être list
6031;bonjour et merc médic ceux qui auron prism temp lir et répondr voil expliqu problem prend pilul médic et pas quesqu être pass avec malad examen et le souc avec cher avoir oubli certain pilul alor ne plus exact avoir pris pilul en gros jour sur médic part 11e ou 2e pilul arriv médic médic 6e ne sav plus tout ou en être et avoir avoir regl donc médic jour et plus en ca arrêt bizarr masqu regl durent sup longtemp normal env jour mm avec pilul bref voil plus en plus avoir malad o ventr ca tir en bas voil plus ou en être cycl en fait quelqu peu aid dir si ca être déjà arriv et quand dois reprendr pilul bon pens pas qu être risqu malad car pend périod oubl médic fair amour fois médic tt pet donc pens pas qu être risqu demand avis car avoir hont aller voir docteur sach que être fait avort médic mois merc
6032;avoir appris matin que être enceint sach que avoir pris médic samed et dimanch ex qu médic risqu
6033;être sous médic être à jour et avoir nouveau regl faibl regl tout mêm être normal
6034;médic plus médic
6035;bonsoir pren seroquel depuis composit en avoir décid en accord avec médecin arrêt progress depuis mois dos au couch être composit cet molécul médic fait prendr kilos pens que kilos que arriv pas à perdr part peu apres fin trait ou pas
6036;médic trait équivalent à médic
6037;combien temp faut pour que le vertig partent sous médic
6038;enceint mois avoir pris pend semain médic et médic quel être le risqu pour beb
6039;le médic pour malad sur ordon biozon dan part lad être pris en charg par caiss pour patient
6040;oubl médian pris norlévo risqu
6041;prend médic depuis jour mgr fois être que être danger en prendr auss longtemp
6042;pilul médic peu dos
6043;médic sur le troubl anxieux généralis
6044;médic dur trait
6045;apres combien temp peut reprendr médic
6046;faut ordon pour achet médic et polio
6047;depuis semain prend patch médic il être décoll plusieur fois et avoir recoll que fair
6048;quel typ ad être médic
6049;médic médic
6050;connaiss médic massag argel7 merc
6051;aim savoir si le médic mêm molécul que médic être rembours être sous médic composit pour an à raison euros par mois minimum san aucun rembours mutuel va prendr en charg différent
6052;j avoir prescript pour bain bouch avec médic inject et bicarr et avoir dout sur réglement on peut recondition médic inject
6053;peut prendr cortison en mem temp que médic
6054;bonjour médic tout e aim savoir si prendr comprim médic composit être grav avoir an merc
6055;médic qu en dir
6056;combien temp puis utilis médic apres avoir ouvert
6057;quel médic pour remplac ftp
6058;j avoir avoir arrêt jour pris pilul dev reprendr ordinal comprim plaquet vendred et ne avoir pris que samed dois proteg
6059;quelqu médic déjà pris médic pour arrêt fum
6060;sav si médic fait gross
6061;conserv médic composit médic
6062;tomb enceint sous médic quel risqu
6063;cyclan par quel pilul commenc
6064;géner médic
6065;combien temp attent apres arrêt médic
6066;utilis presqu quotidien médic contr le malad voudr savoir si être danger pour sant
6067;apres oubl mélod que fair
6068;peut prendr médic pend malad
6069;pharmacodynam bétaserc
6070;le médecin médic oblig mention pharmacien qui délivr médic
6071;médic quel class trait appartient médic
6072;médic médic peut entraîn augment médic
6073;quel être posolog médic olivi médic europ
6074;médic inject médic depuis jour avoir malad à têt quand fais certain mouv pens que être li à médic
6075;avoir commenc médic pour premi fois et regl viennent just fin voul savoir si peux mainten avoir rapport san cour risqu tomb enceint parcour forum et être question jour parfois et malad fois être activ premi pris ne sais plus quoi pens
6076;le médic peut entraîn malad
6077;comment sépar médic
6078;avec médic médic beaucoup différent entre prendr composit par jour et composit
6079;quel être posolog lauri nobl en inhal humid
6080;médic peut conduir véhicul
6081;pourquoi prendr dexorat
6082;quel être bilan pré thérapeut à réalis avant instaur trait par médic
6083;ne support pas le antidépresseur médic
6084;veux prendr tus au bout combien temp cel fait effet
6085;aim savoir si médic nouveau être disponibl en pharmac actuel
6086;être possibl décal le regl avec médic être don qu médic pas arrêt entre le plaquet
6087;pos question aux sujet médic médic sécur social rembours entier le inject
6088;médic quoi sert médic
6089;être sous médic avoir trais malad médic épaul droit quelqu peu en dir plus
6090;médic gai dur malad
6091;faut réalis bilan ophtalmolog avant début trait par médic
6092;avoir pris médic pst âge et aim avoir beb combien temp faut en général pour tomb enceint
6093;patch médic appliqu combien temp avant médic
6094;prescript renouvel pour médic
6095;quand prend ibuprofen puis prendr médic auss
6096;avoir fait surdosag leg 8gr3 au paracétamol peu propfan auss jour apres ordinal surdos raval gr paracétamol deux jour plus tard aval gr médic antalg puis lund gr paracétamol mard gr paracétamol diantalvic mercred mgr jeud gr vendred gr samed et dimanch gr chaqu jour deux jour plus tard reprend gr jour apres aval gr être derni comprim et cel fait mois que ne prend plus aucun médic tss confondus et encor moin en surdosag malad médicament ne peut surg mois apres alor que médic médic être incrimin médic être supprim concret risqu qlq chos ou pir être derri
6097;j avoir malad avec médic que dois fair
6098;prend pilul mélod car ne support pas médic cet pilul être pris en continu avec comprim inact voudr ne pas avoir regl comment doit mis prendr avec cet pilul pour ne pas le avoir
6099;j avoir souc avec médecin qui prescr médic à patient tous le jour délivr pour jour comment délivr
6100;comment dilu médic mer
6101;en combien temp effet médic dissip
6102;médic contr symptôm
6103;combien dos normal médic
6104;qui connaît médic
6105;avoir pass médic décontractyl qui être myorelax pend jour et apres avoir arrêt avoir avoir violent malad gross plaqu roug et épaiss accompagn violent démangeaison et brûlur prend min plus locoïd depuis jour être que être compos décontractyl qui peut être à origin cet malad être possibl que fass allerg
6106;sous médic être déjà arriv enchaîn plaquet en enchaîn direct avec le comprim derni couleur vien seul réalis que avoir pris ordinal plaquet entier fait que avoir avoir pert sang tout mois peut être sign quelqu chos
6107;médecin médic prescr médic comm antipaludéen le effet secondair être si terribl effet déprim
6108;le médic peut être utilis chez patient myasthen
6109;malad affect réunion collègu médic parl médic palustr composit être que posolog comprim par jour être valabl auss pour le enfant
6110;être sous mélod avant sous tricilest et cel fait quelqu jour que avoir saign alor que être au milieu plaquet quelqu avoir idé être sign quelqu chos
6111;être sous médic composit être vrai danger pour sant
6112;une patient actuel trait par médic crister souhait diminu le dos pour progress arrêt trait coup donc le comprim en deux peut continu
6113;être sous sac et à caus produit avoir bip chang personnal avoir plus motiv pour le étud en foutist insensibl et honnêt avoir plus intérêt dan rien et commenc à sent trist cet état quelqu connaît cet état
6114;être part en geek en et malheur avoir oubli plaquet médic résultat voilà jour que avoir pas pris pilul que dois fair prendr le cachet et prendr celui soir à heur habituel sach que avoir pas rapport avant semain car copain être en voyag affair
6115;médic en mang
6116;dois fair rappel médic et polio médic voul savoir si pouv fair mêm à quel endroit dois piqu
6117;médic si pas pris heur apres heur habituel
6118;avoir récent quitt médic pour médic peu habitu médic nouvel présent plaquet avoir oubl le pilul derni semain apres avoir lu notic médic avoir repr normal pilul jour plus tard apprêt médic reprendr nouvel plaquet ordinal depuis oubl souhait savoir qu vaut mieux fair pour que tout redevien normal arrêt pilul pend plusieur mois continu prendr normal
6119;effet secondair mélod combien temp
6120;dépend au médic
6121;pourquoi prendr médic
6122;quel compl pour médic
6123;qu être que médic
6124;une patient souhait savoir si peut fum avec pris médic composit
6125;médic effet secondair médic long term
6126;médic à long term dang
6127;grossess et médic
6128;médic être délivr sur ordon seul
6129;être asthmat et être sous médic et médic tous le jour être que médic peuvent avoir influenc sur taux médic
6130;médic et cytochrom p450
6131;être sous médic depuis plus mois et avoir impress que avoir effet physiqu fourmill vu perturb malad têt lorsqu malad sommeil peut renseign sur problem
6132;lequel agit plus rapid médic en médic ou en médic
6133;médic médic médic lisopain peux
6134;médic propos celesten question sep
6135;le contracept luthényl médic effet gên
6136;être normal prescrir médic k pour beb qui être pas sous lait maternel
6137;être que médic être danger
6138;médic quel dosag existent
6139;médic et pris poid envi mang plus
6140;pris médic et silic compatibl
6141;apres mois trait avec médic dermato prescr tetramysal dois prendr toujour deux cachet gélul seul là le pris ne doivent plus fair pend rep en dehor sach que fais muscul et que mang réguli heur heur heur heur heur voudr savoir quand pourr prendr mani optimal le gélul sach que dois fair pris par jour gélul
6142;être fais pos fiu médic mi mar médic jour avoir toujour pas cycl réguli au bout combien temp cycl être il devenus réguli
6143;c être géner quel médic médic
6144;médic efficac médic part quand
6145;médic et méthadon mêm indiqu
6146;effet secondair médic
6147;médic médic chez nourrisson
6148;être fait install médic en septembr quand dois chang
6149;médic être rembours
6150;médic et malad
6151;médic risqu accoutum
6152;bonjour connaiss médic ou médic contr le ronfl
6153;puis procur médic spermicid san ordon
6154;lor instaur médic médic foliqu être indispens
