;question
3974;oubli comprimé NOM_DE_MEDICAMENT avant hier faire
3975;quels les effets secondaires NOM_DE_MEDICAMENT
3976;norlévo retard regles enceintes
3977;peut prendre 2 NOM_DE_MEDICAMENT coup
3978;que peut prescrire bébé moins 30 mois aphtes huiles essentielles
3979;psy NOM_DE_MEDICAMENT prescrit 2 NOM_DE_MEDICAMENT soir prenais 1 NOM_DE_MEDICAMENT matin alors donnait deux généraliste NOM_DE_MEDICAMENT effets côté
3980;NOM_DE_MEDICAMENT levure grossesse danger
3981;depuis 9ans sous diane35 là 3mois gygy NOM_DE_MEDICAMENT changé leelo gé dû arréter pillule depuis bien moralement ça peut étre NOM_DE_MEDICAMENT arrét pillule tout simplement
3982;spasmine somnifere
3983;peut utiliser NOM_DE_MEDICAMENT protect prévention primaire
3984;pris NOM_DE_MEDICAMENT arreté complétement depuis sent bien étourdissement nausées sensation tomber les pommes encore combien temps vais devoir supporter cet état
3985;je sous andocur POSOLOGIE NOM_DE_MEDICAMENT POSOLOGIE rapports non protegés aimerais savoir pourquoi notice NOM_DE_MEDICAMENT precisé doit prendre 1 contraceptif medicament
3986;NOM_DE_MEDICAMENT peut til NOM_DE_MEDICAMENT tout seule enlever abcés
3987;efflexor matin soir
3988;pris NOM_DE_MEDICAMENT 3 comprimés jour circulation veineuse terrible faut arrêter non endotélon pendant grossesse
3989;question guronsan
3990;quels conseils utilisation pilule NOM_DE_MEDICAMENT gé
3991;peut prendre cocculine enceinte
3992;réaction NOM_DE_MEDICAMENT 2 mois après
3993;oublié pillule derniere semaine plaquette e rapport sexuel hier soir mardi soir dois faire prend NOM_DE_MEDICAMENT
3994;NOM_DE_MEDICAMENT liquide sort seins
3995;irritations apres les rapports existe NOM_DE_MEDICAMENT rehydrater
3996;les produits homéopathiqus vente libre uniquement ordonnace
3997;est NOM_DE_MEDICAMENT peut changer odeur urine bébé
3998;pharmacie NOM_DE_MEDICAMENT délivré erreur boite POSOLOGIE NOM_DE_MEDICAMENT lieu POSOLOGIE donné traitement NOM_DE_MEDICAMENT enfant 6kg sachant etai supossitoire matin midi soir grave y NOM_DE_MEDICAMENT danger enfant
3999;est NOM_DE_MEDICAMENT médicament exception
4000;NOM_DE_MEDICAMENT adresse NOM_DE_MEDICAMENT 5 POSOLOGIE
4001;quel traitement douleurs cuir chevelu
4002;NOM_DE_MEDICAMENT gé identique NOM_DE_MEDICAMENT gé
4003;effets niveau sommeil prennant NOM_DE_MEDICAMENT
4004;NOM_DE_MEDICAMENT arrêter fumer
4005;generique NOM_DE_MEDICAMENT question
4006;mépronizine quelle forme
4007;ludéal gé générique NOM_DE_MEDICAMENT
4008;voudrais savoir si NOM_DE_MEDICAMENT tendance aggraver acnée
4009;la NOM_DE_MEDICAMENT NOM_DE_MEDICAMENT amm tremblement essentiel
4010;NOM_DE_MEDICAMENT info officielles
4011;peut tomber enceinte sterilet NOM_DE_MEDICAMENT
4012;NOM_DE_MEDICAMENT ostenil remboursable sécurité sociale
4013;plus vierge alors NOM_DE_MEDICAMENT contre cancer col utérus efficace
4014;quels les statistiques risque phlébites sous NOM_DE_MEDICAMENT
4015;NOM_DE_MEDICAMENT quoi sers NOM_DE_MEDICAMENT
4016;elles perdent tous poids prozas POSOLOGIE comprends
4017;sous NOM_DE_MEDICAMENT suit NOM_DE_MEDICAMENT tuberculose pulmonaire dois prendre traitement NOM_DE_MEDICAMENT jeun combien temps avant prise traitement puis prendre repas grignotage
4018;prends méliane hier sensée recommencer plaquette après semaine interruption oublié soir pris comprimé hier plus aujourd hui temps NOM_DE_MEDICAMENT 1h intervalle environ or fallait prendre les 2 comprimés simultanément grave
4019;quel médicament irritation niveau yeux
4020;NOM_DE_MEDICAMENT NOM_DE_MEDICAMENT 9ch
4021;NOM_DE_MEDICAMENT perturbation hormonale
4022;connaissez remède bien digérer
4023;est méthadone traverse barrière placentaire
4024;quels les effets secondaires NOM_DE_MEDICAMENT NOM_DE_MEDICAMENT
4025;le NOM_DE_MEDICAMENT quoi
4026;pris beaucoup poids prenant NOM_DE_MEDICAMENT depuis presque an que faire
4027;arret NOM_DE_MEDICAMENT sensations tete
4028;depuis semaine prends paroxétine dors NOM_DE_MEDICAMENT quelqu ça NOM_DE_MEDICAMENT arriver
4029;NOM_DE_MEDICAMENT mère valériane ressort les pores
4030;possible prendre NOM_DE_MEDICAMENT meme temps NOM_DE_MEDICAMENT
4031;NOM_DE_MEDICAMENT quelles les danger
4032;contalax
4033;séropram attendant enfant
4034;jai pris NOM_DE_MEDICAMENT presque toute grossesse dormir doc donner 100 POSOLOGIE NOM_DE_MEDICAMENT 150 POSOLOGIE desyrel trazodone NOM_DE_MEDICAMENT prendre coucher POSOLOGIE ativan quelles les risques bébé
4035;NOM_DE_MEDICAMENT risque surdité
4036;oublié prendre pilule NOM_DE_MEDICAMENT aperçue les douze heures prends pilule vers 22h là prise vers 9h matin inquiète
4037;les antidépresseurs responsables maladies auto immunes
4038;mon médecin prescrit NOM_DE_MEDICAMENT 4g oublié dire opéré occlusion intestinale NOM_DE_MEDICAMENT 1an peux quand prendre médicament
4039;NOM_DE_MEDICAMENT quatorze ans possible
4040;NOM_DE_MEDICAMENT posologie
4041;prends NOM_DE_MEDICAMENT 2ème fois sens nouveau extrêmement tendue crispée réveille nouveau pleine nuit sans pouvoir rendormir cette baisse régime insomnies elles normales après semaine accalmie
4042;NOM_DE_MEDICAMENT dormir
4043;viens commencer NOM_DE_MEDICAMENT réveille toutes les nuits arrive jamais habitude sens nerveuse surtout plus faim des expériences similaires
4044;médecin NOM_DE_MEDICAMENT donner traitement dont NOM_DE_MEDICAMENT cette fois ci première prise très grosse réaction allergique normal
4045;NOM_DE_MEDICAMENT NOM_DE_MEDICAMENT vais avoir les effets indésirable début
4046;prend pilule cilest là peu mal ventre également régles alors dû les avoir dimanche 29 lundi 30 janvier dois faire
4047;sous NOM_DE_MEDICAMENT voilà 5 mois passée sous NOM_DE_MEDICAMENT depuis changement régles moins moins importantes voir trés trés discrètes normal devrais plutot inquiter selon
4048;puis prendre comprimé NOM_DE_MEDICAMENT sorti blister depuis 1 semaine
4049;dépendance NOM_DE_MEDICAMENT
4050;yasminelle empêche ovulation
4051;sous quelle forme présente NOM_DE_MEDICAMENT POSOLOGIE
4052;que prendre cas règles ultradouloureuses
4053;NOM_DE_MEDICAMENT risque accoutumance
4054;NOM_DE_MEDICAMENT effet positif quand
4055;sous NOM_DE_MEDICAMENT décidé diminuer les quantités manière progressive victime malaise accompagné sensation intense chaleur perte équilibre trouble vue pensez diminution quantités béta bloquants peut entraîner genre malaise
4056;NOM_DE_MEDICAMENT connait
4057;il NOM_DE_MEDICAMENT risques enchainer plaquettes NOM_DE_MEDICAMENT
4058;anti depresseur entraine rupture anevrisme
4059;qu remicad
4060;peut faire poser stérilet NOM_DE_MEDICAMENT dehors règles
4061;quels les moins NOM_DE_MEDICAMENT
4062;bonjour sous pilule depuis 4ans NOM_DE_MEDICAMENT mois ci arrêté 24 reprendre demain toujours rien mis part légère trace rose pâle papier oublié pose pleins questions cela déjà arrivée merci avance bon réveillon
4063;homéopathe NOM_DE_MEDICAMENT prescrit NOM_DE_MEDICAMENT NOM_DE_MEDICAMENT prendre 2 fois jour faut les prendre préférence loin repas soir
4064;petite question strepsil
4065;efflexor matin soir
4066;sous antibiotique NOM_DE_MEDICAMENT
4067;NOM_DE_MEDICAMENT élimination NOM_DE_MEDICAMENT fait voie rénale hépatique
4068;dois prendre toujours deux cachets gélules tetramysal les prises doivent plus faire pendant repas voudrais savoir quand pourrais les prendre manière optimale sachant dois faire 2 prises jour gélule
4069;une médecin dermatologue retraite souhaite connaître date retour NOM_DE_MEDICAMENT crème
4070;oubli comprimé NOM_DE_MEDICAMENT 24 heures oubli fais quoi
4071;j patient amène 2 ordonnances enfants 2 mois 2 5 ans bexero quelle indication utilité
4072;ibuprofène dangereux
4073;NOM_DE_MEDICAMENT j10 quand les effets positifs
4074;quel générique NOM_DE_MEDICAMENT
4075;peut trouver NOM_DE_MEDICAMENT tp dtp italie
4076;medecin prescrit NOM_DE_MEDICAMENT cruda 15ch trouble sommeil pourtant lis partout cette cause 9 ch faut quel bon dosage
4077;urgent 5 apres arret pillule NOM_DE_MEDICAMENT regle normal
4078;deja pris NOM_DE_MEDICAMENT NOM_DE_MEDICAMENT 3 an durée 1 an demi sans aucun soucis nouveau traitement depuis tout ptit peu plus 1 mois lau bout 3 semaines mise NOM_DE_MEDICAMENT avoir plaques demange ca gratte ca gonfle ca fait comme piqures orties peau vu medecin NOM_DE_MEDICAMENT donné NOM_DE_MEDICAMENT NOM_DE_MEDICAMENT prendre anti allergique viens commencer matin bien vrai cela NOM_DE_MEDICAMENT calmer urticaire notice NOM_DE_MEDICAMENT NOM_DE_MEDICAMENT noté les effets indesirables tres rares eruption cutanée pourkoi demande si soucis NOM_DE_MEDICAMENT lien anti depresseur peut etre qqn NOM_DE_MEDICAMENT deja rencontré soucis
4079;pouvez dire si NOM_DE_MEDICAMENT efficasse luter contre les idées noire
4080;NOM_DE_MEDICAMENT NOM_DE_MEDICAMENT remboursé
4081;effets secondaires après prise NOM_DE_MEDICAMENT
4082;effet posotif NOM_DE_MEDICAMENT toute journée
4083;viens prendre 19g NOM_DE_MEDICAMENT risque quoi
4084;la pilule NOM_DE_MEDICAMENT pilule fortement dosée
4085;je voulais savoir si pouvais prendre pilule peu avance 30 mn lu possible aimerai savoir si lendemain devais prendre heure si effet contraceptif toujours conservé
4086;comment traiter pied athlète chez enfant 2 ans
4087;si enceinte dangereux prendre lutéran
4088;NOM_DE_MEDICAMENT babybalm retiré marché
4089;dois faire NOM_DE_MEDICAMENT hépatite NOM_DE_MEDICAMENT allergique oeufs voudrai donc savoir si importe trace œuf preséntent NOM_DE_MEDICAMENT
4090;NOM_DE_MEDICAMENT normal avoir douleurs ventre
4091;vous connaissez NOM_DE_MEDICAMENT soigner hoquet
4092;ghb traite anxiété depression
4093;peut acheter NOM_DE_MEDICAMENT sans ordonnance
4094;qu NOM_DE_MEDICAMENT
4095;NOM_DE_MEDICAMENT effective dès première prise cela fait si commence plaquette alors encore regles
4096;y NOM_DE_MEDICAMENT effets secondaire pendant les premières semaines NOM_DE_MEDICAMENT sueurs crises angoisses
4097;comment préparer hepar NOM_DE_MEDICAMENT d8 NOM_DE_MEDICAMENT auco cultum d3
4098;déja effets secondaires NOM_DE_MEDICAMENT
4099;NOM_DE_MEDICAMENT prescrit NOM_DE_MEDICAMENT quels les effets secondaires ca occasionne
4100;qu zenalia
4101;roacutane question
4102;NOM_DE_MEDICAMENT enfant 13 ans
4103;souhaiterais faire vacciner contre grippe peur si fais NOM_DE_MEDICAMENT jours ci plus être immunisée février
4104;NOM_DE_MEDICAMENT savez
4105;bonjour prend pilule NOM_DE_MEDICAMENT gé depuis maintenant 6 mois dois prendre comprimé pendant 20 jours puis faire pause 7 jours voulais savoir si pendant cette période 7 jours pouvais avoir rapport copain merci avance réponse
4106;plus aimerai savoir necessaire prendre NOM_DE_MEDICAMENT tous les jours heure
4107;oubli mélodia faire
4108;prend pillule cérazette saignements depuis 1 semaine comment possible organisme femme
4109;j pris pilule deux fois journée qu risque
4110;peut prescrire NOM_DE_MEDICAMENT pendant grossesse
4111;quels les changements observables arrêt anovulant
4112;est peut prendre NOM_DE_MEDICAMENT pendant grossesse
4113;nausées NOM_DE_MEDICAMENT
4114;peux prendre NOM_DE_MEDICAMENT douleur
4115;une patiente vu prescrire NOM_DE_MEDICAMENT eg 5 médecin dernier spécifié posologie souhaite donc savoir combien fois utiliser produit
4116;comment savoir dosage griffonia
4117;q peux prendre 28 comprimés mercilon coup lieu 21
4118;bonjour prends NOM_DE_MEDICAMENT depuis peu plus deux semaines depuis qqs jours mal respirer comme oppréssée arrive inspirer profondémment cas pensez
4119;NOM_DE_MEDICAMENT NOM_DE_MEDICAMENT fait perdre poids
4120;urticaire insupportable NOM_DE_MEDICAMENT
4121;ancienneté traitement NOM_DE_MEDICAMENT
4122;combien coût boite NOM_DE_MEDICAMENT
4123;NOM_DE_MEDICAMENT besoin renseignements svp
4124;bonjour pk donne medicaments associé NOM_DE_MEDICAMENT 400 NOM_DE_MEDICAMENT merci repondre
4125;demandé si pouvais prendre NOM_DE_MEDICAMENT NOM_DE_MEDICAMENT meme temps
4126;perdu poids NOM_DE_MEDICAMENT
4127;j arrete progressivement NOM_DE_MEDICAMENT sensations décharges électriques normal
4128;pilule NOM_DE_MEDICAMENT quoi
4129;dépendance NOM_DE_MEDICAMENT
4130;NOM_DE_MEDICAMENT cause pharyngite médecin NOM_DE_MEDICAMENT prescrit 2 pulvérisations rhinofluimicil trois quatre fois jour notice claire pouvez éclairer
4131;veux donner 6 cardenciel POSOLOGIE soir effet secondaire
4132;NOM_DE_MEDICAMENT médicament quoi
4133;boite NOM_DE_MEDICAMENT 28 30 comprimés
4134;prends NOM_DE_MEDICAMENT gyneco dit arrêter propose stérilet NOM_DE_MEDICAMENT quelqu NOM_DE_MEDICAMENT cas comment stérilet NOM_DE_MEDICAMENT supporté
4135;aimerai savoir si peux remplacer 1 dose NOM_DE_MEDICAMENT 9 ch dose 5 granules NOM_DE_MEDICAMENT 200 k autre résolution
4136;lu notice si comprimé entre jour 8 14 NOM_DE_MEDICAMENT oublié doit prendre comprimé oublié finir plaquette cela veut donc dire dois prendre comprimé dhier celui daujourdhui meme temps
4137;pris NOM_DE_MEDICAMENT pendant 15 jours consécutifs bcp effets secondaires med NOM_DE_MEDICAMENT dit arreter spntanément NOM_DE_MEDICAMENT 1 semaine depuis nausées 1 peu enervé normal
4138;est peux prendre traitement NOM_DE_MEDICAMENT matin
4139;NOM_DE_MEDICAMENT gé
4140;prends sipralexa depuis 1 an commencé sentir mieux après 6 semaines depuis cet hiver nouveau très fatiguée parfois force faire certaines choses faut dire augmenté dose anti depresseurs depuis 7 jours alors les anti depresseurs rendent aussi naze symptômes dépression
4141;oublie pilule NOM_DE_MEDICAMENT risque
4142;commence appréhension chimio jeudi associe NOM_DE_MEDICAMENT NOM_DE_MEDICAMENT quelqu connaît peut parler
4143;NOM_DE_MEDICAMENT peut resoudre probleme ejaculation precoce
4144;voualais savoir étai les effets indesirable guronsan
4145;peut prendre NOM_DE_MEDICAMENT fleurs bach meme temps
4146;sous ludéal depuis deux mois dois passer qlaira quelle marche NOM_DE_MEDICAMENT suivre pause pause
4147;rappel NOM_DE_MEDICAMENT quinta impérativement les 3 mois
4148;NOM_DE_MEDICAMENT hta
4149;comment fonctionne NOM_DE_MEDICAMENT col utérus
4150;comment procéder cure spiruline
4151;NOM_DE_MEDICAMENT sans ordonnance
4152;interaction entre NOM_DE_MEDICAMENT gellules maigrir
4153;question NOM_DE_MEDICAMENT
4154;bonjours sous mercilon depuis 4mois problème perte cheveux dois faire merci avance
4155;de quelle forme les comprimés célécoxib POSOLOGIE zentiva
4156;NOM_DE_MEDICAMENT fait grossir
4157;apres installation stérilet petites pertes brunatres crampes etc dois inquieté cela normal
4158;quelques questions NOM_DE_MEDICAMENT 35
4159;quels les effets NOM_DE_MEDICAMENT NOM_DE_MEDICAMENT NOM_DE_MEDICAMENT
4160;prend milleperthuis gélules 4 jour question quand dois les prendre
4161;puis prendre NOM_DE_MEDICAMENT NOM_DE_MEDICAMENT
4162;aimerais savoir si possible ressentir les effets diminution NOM_DE_MEDICAMENT seulement 1 mois 1 2 après cela fait 2 semaines ressens effets pire pire normal
4163;aimerais savoir si autres personnes entendu parler utilisé les doses vaccinotoxium évacuer les toxines NOM_DE_MEDICAMENT
4164;peut obtenir isoror sans ordonnance
4165;NOM_DE_MEDICAMENT fait grossir
4166;peux injecter NOM_DE_MEDICAMENT NOM_DE_MEDICAMENT personne fait hemoragie
4167;NOM_DE_MEDICAMENT ordonnance
4168;NOM_DE_MEDICAMENT NOM_DE_MEDICAMENT essais bébé
4169;quelle dose initiale recommandée NOM_DE_MEDICAMENT
4170;prenais jusqu alors 100 POSOLOGIE NOM_DE_MEDICAMENT jour 2 comprimés depuis 15 jours passée 75 POSOLOGIE impression aujourd hui sentir mal faire
4171;puis utiliser crème NOM_DE_MEDICAMENT périmée deux semaines
4172;NOM_DE_MEDICAMENT 35 peut etre délivrée planning familial
4173;NOM_DE_MEDICAMENT besoin renseignements svp
4174;aimerai savoir aussi si normal si encore pertes brunes trinordiole
4175;prend depuis peu oenobiol aquadrainant expirait avril 2005 les géllules elles encore active
4176;oscillococcinum boîte 20 NOM_DE_MEDICAMENT
4177;allergique curare NOM_DE_MEDICAMENT NOM_DE_MEDICAMENT risque si prends NOM_DE_MEDICAMENT
4178;NOM_DE_MEDICAMENT personnes arrété traitement sans retour pilosité execive boutons NOM_DE_MEDICAMENT
4179;prend actuellement NOM_DE_MEDICAMENT POSOLOGIE matin soir sent tout bizarre marche bizarrement sent planer parle comme si bourré envie coucher systématiquement dormir effets deja arriver
4180;prend NOM_DE_MEDICAMENT 100 POSOLOGIE jours fait total 15 00 POSOLOGIE NOM_DE_MEDICAMENT 15 jours quel les conséquences
4181;NOM_DE_MEDICAMENT 50 tremblements
4182;le go synvisc NOM_DE_MEDICAMENT prescription réservée certains spécialistes médecin généraliste peut prescrire
4183;quel bilan biologique instauration NOM_DE_MEDICAMENT
4184;y NOM_DE_MEDICAMENT beaucoup effet indésirables NOM_DE_MEDICAMENT
4185;NOM_DE_MEDICAMENT adresse NOM_DE_MEDICAMENT
4186;NOM_DE_MEDICAMENT thypoïde immurel ils compatibles
4187;doit arreter NOM_DE_MEDICAMENT commencer NOM_DE_MEDICAMENT sais quand car bien reglé niveau saignement dois commencer quand
4188;NOM_DE_MEDICAMENT NOM_DE_MEDICAMENT
4189;diu NOM_DE_MEDICAMENT comme contraception
4190;microvial
4191;commencé mélodia sujette plusieurs fois NOM_DE_MEDICAMENT crises ashme bronchite asthmatique ya contre indication
4192;NOM_DE_MEDICAMENT dangereux
4193;y NOM_DE_MEDICAMENT risque faire NOM_DE_MEDICAMENT rubéole bis avant grossesse
4194;mélodia seins gonflent font mal normal
4195;NOM_DE_MEDICAMENT mange moins grossit NOM_DE_MEDICAMENT vue oeil pourquoi
4196;bonsoir oui oui oui habitude question concernant NOM_DE_MEDICAMENT vient fille aujourd hui jeune homme pose amie proche amie NOM_DE_MEDICAMENT premiere relations sexuelles NOM_DE_MEDICAMENT plus an mere aujourd hui veut absolument fasse NOM_DE_MEDICAMENT ose dire non peur reaction les risques faire NOM_DE_MEDICAMENT avoir premiere relation sexuelle NOM_DE_MEDICAMENT plus an hormis non fonctionnement NOM_DE_MEDICAMENT quels les risques merci reponses
4197;peut prendre NOM_DE_MEDICAMENT midi
4198;le NOM_DE_MEDICAMENT NOM_DE_MEDICAMENT enfant 13 ans 40 kg souffrant cystite quelle posologie mettez
4199;NOM_DE_MEDICAMENT NOM_DE_MEDICAMENT durant grossesse
4200;NOM_DE_MEDICAMENT NOM_DE_MEDICAMENT sepia pendant grossesse
4201;voudrais savoir possible prendre les huiles essentielles gelule
4202;est NOM_DE_MEDICAMENT continu provoque effets indésirables
4203;pourquoi oublie pillule plus 12h peut donner risque grossesse alors pendant pose 7 jours maximum reste protégée
4204;baldrian dormir compatible NOM_DE_MEDICAMENT
4205;prend pilule NOM_DE_MEDICAMENT vers 22h pris pilule environ 2h après nouvelle crise diarrhée enchaînée toute nuit faut reprendre pilule sachant allais avoir nouvelle crise prise rapport non protégé 3 jours avant ya risques grossesse
4206;est NOM_DE_MEDICAMENT sous forme capsules molles car autres spécialités aimé cette forme
4207;consommation NOM_DE_MEDICAMENT fois date péremption passée possible
4208;quels les génériques NOM_DE_MEDICAMENT 35
4209;est NOM_DE_MEDICAMENT entraine fatigue
4210;mélodia crat
4211;kelkun NOM_DE_MEDICAMENT NOM_DE_MEDICAMENT arrêter règle
4212;NOM_DE_MEDICAMENT pendant repas
4213;souhaiterais savoir si 2 médicaments plantes cardiocalm aubépine prepause gattilier alchémille achilée compatibles ensemble
4214;voudrais savoir si fait commencer pilule 2eme jour règles risque tomber enceinte
4215;viens réaliser idr NOM_DE_MEDICAMENT bcg lit normalement rsultat bout 72 heures seulement bout 8h voila induration plus 10mm dois comprendre peut etre infecté
4216;après sevrage rivortil peut prendre NOM_DE_MEDICAMENT
4217;adépal donne vomissements
4218;vrai adépal fortement dosée
4219;pris antibiotique rifampicine lu association rifampicine pilule mienne NOM_DE_MEDICAMENT gé etait bonne cas
4220;bonjour prend générique pilule NOM_DE_MEDICAMENT 35 les oubliés 2 3 fois mois mai règles 4 juin comme habitude sans retard depuis 2 jours pertes marron rouge mal ventre NOM_DE_MEDICAMENT semaine ça vomi vraiment vomi enfin bizarre pendant oublies rapports non protégé aimerai savoir NOM_DE_MEDICAMENT risque grossesse comme désir enfant peur grossesse nerveuse merci répondre NOM_DE_MEDICAMENT bientôt
4221;NOM_DE_MEDICAMENT NOM_DE_MEDICAMENT
4222;quelqu sait si NOM_DE_MEDICAMENT anti grippe dangereux enceinte
4223;cela fait 2 mois environ sous NOM_DE_MEDICAMENT vois vraiment amélioration bout combien temps cela fait effet
4224;lorsqu lit notice NOM_DE_MEDICAMENT écrit après délivrance température doit excéder 30 cela signifie donc peut laisser dehors frigo non cas mieux laisser frigo autant possible faut sortir
4225;quelles les indications NOM_DE_MEDICAMENT
4226;vendredi dernier fait amour copain or samedi partie sans pilules donc pu prendre celle samedi soir dimanche après midi puis continuer normalement problème plaquette termine mercredi peux donc respecter les 7 jours nécessaires relancer tir dois faire
4227;NOM_DE_MEDICAMENT phobie sociale
4228;une préparatrice souhaite savoir faut prendre NOM_DE_MEDICAMENT NOM_DE_MEDICAMENT buvable sachet avant après les repas
4229;etant donner pris NOM_DE_MEDICAMENT NOM_DE_MEDICAMENT suite NOM_DE_MEDICAMENT fallait attendre les effets benefique bout quelques semaine ca plus rapide
4230;NOM_DE_MEDICAMENT donne effets secondaires
4231;effets secondaires NOM_DE_MEDICAMENT
4232;bonjour apres retrait stérilet NOM_DE_MEDICAMENT car convenait reparti pilule NOM_DE_MEDICAMENT prise pendant années avant stérilet pilule peut provoquer grosse fatigue douleurs seins tétons essoufflements grande sensation faim après avoir manger parfois dégouts certains aliments avant supportais sans souci ça fait deux semaines reprends merci avance
4233;NOM_DE_MEDICAMENT quel effet
4234;risque tomber enceinte sous NOM_DE_MEDICAMENT
4235;secours dois prendre NOM_DE_MEDICAMENT anti dépresseur alors diagnostiquée bipolaire partage expérience notice spécifie médicament incompatible bipolarité faire penser médecin tient après avoir essayé déroxat NOM_DE_MEDICAMENT abandonné poursuis régulièrement traitement 2 dépacok jour suffit merci réponses rapides
4236;quels les effets secondaires NOM_DE_MEDICAMENT
4237;pharmacodynamie NOM_DE_MEDICAMENT
4238;pris viox NOM_DE_MEDICAMENT fais tachycardie type bouveret cela pourrait être les effets secondaires médicaments
4239;puis associer NOM_DE_MEDICAMENT NOM_DE_MEDICAMENT
4240;quels les vaccins peut faire pendant grossesse
4241;de quelle spécialité oxomémazine arrow générique
4242;traitement NOM_DE_MEDICAMENT NOM_DE_MEDICAMENT NOM_DE_MEDICAMENT arrêter depuis vie enfer vomissement impression avoir troue estomac tremblement insomnies palpitation doit consulté médecin aller urgence
4243;prends si besoin NOM_DE_MEDICAMENT apres crises angoisse passe maintenant NOM_DE_MEDICAMENT forcement effets secondaires
4244;bonjour NOM_DE_MEDICAMENT tous petit probleme pris deux plaquettes pilule NOM_DE_MEDICAMENT gé affilé avoir regles ci probleme ke les quand meme normal surtout toujours protegée merci reponse angoisse peux etre rien angoisse
4245;aimerais savoir si personnes déjà fait cures spiruline si cela NOM_DE_MEDICAMENT vraiment contribuer vaincre anémie
4246;diminution douleurs seins sous NOM_DE_MEDICAMENT normal
4247;lu pouvait donner NOM_DE_MEDICAMENT homeopathique lever barrage energetique suite NOM_DE_MEDICAMENT classique loulous 2ans vont faire rappel plusieurs vaccins NOM_DE_MEDICAMENT dt polio etc concretement comment dois faire donner les granules doses tous les vaccins temps soir vaut mieux espacer
4248;NOM_DE_MEDICAMENT rend malheureuse moment arrive plus NOM_DE_MEDICAMENT diminuer dès diminue vertiges mal tete ventre bien tout dois faire
4249;mélodia remboursée
4250;medecin NOM_DE_MEDICAMENT prescrit NOM_DE_MEDICAMENT NOM_DE_MEDICAMENT pharmacie NOM_DE_MEDICAMENT donné generique meme chose
4251;NOM_DE_MEDICAMENT pris charge protocole contraception mineure 15 18ans manière anonyme gratuite
4252;peut associer statine antibiotique
4253;vous conseillez quoi remplacement NOM_DE_MEDICAMENT rupture
4254;oubli NOM_DE_MEDICAMENT infos contradictoires dois faire
4255;faut ordonnance acheter NOM_DE_MEDICAMENT dt polio
4256;du NOM_DE_MEDICAMENT prescrit femme
4257;NOM_DE_MEDICAMENT quoi
4258;depuis bon moment sens mal fatigué besoin rester lit quand dormi toute nuit aimerais savoir si cela effet antidépresseur NOM_DE_MEDICAMENT prend depuis presque 1 mois NOM_DE_MEDICAMENT 2x10 POSOLOGIE soir prend depuis plus mois NOM_DE_MEDICAMENT prend soir contre insomnie
4259;dans cas traitement acné photosensibilisant possible combiner traitement crème solaire fort indice pouvoir quand pavaner plage sans risquer les brûlures 3e degré
4260;quel conseil saignements internes post opératoires non hémorragiques formation hématome 10cm 5cm 3cm instant
4261;quelqu pourrait informer risques vacciner enfant NOM_DE_MEDICAMENT alors allergique NOM_DE_MEDICAMENT oeuf
4262;NOM_DE_MEDICAMENT déclenche angoisse
4263;plus libido sous NOM_DE_MEDICAMENT 35 NOM_DE_MEDICAMENT
4264;9eme comprimé NOM_DE_MEDICAMENT pris 8 9 heures retard aucun risque
4265;spotting cause lutéran
4266;peux obtenir NOM_DE_MEDICAMENT folique sans ordonnance
4267;peut prendre NOM_DE_MEDICAMENT 1g enceinte
4268;quels les effets seconadaires NOM_DE_MEDICAMENT contre grippe
4269;commence seroquel 100 POSOLOGIE peur prendre médicament pourriez renseigner si ça fait gagnerdu poids
4270;pediatre NOM_DE_MEDICAMENT prescrit NOM_DE_MEDICAMENT nourissons bebe mois depuis donne fait selle jour tres liquide liquide effet medoc
4271;médecin NOM_DE_MEDICAMENT prescrit hier NOM_DE_MEDICAMENT pris premier comprimé effets secondaire ça
4272;prenais NOM_DE_MEDICAMENT POSOLOGIE soir souffre insomnie matin donc pris NOM_DE_MEDICAMENT hier soir voilà impression être complètement ramollie dois persévérer quelques jours prise matin avant être mieux
