;question
1989;allé chez médecin faire deuxième NOM_DE_MEDICAMENT contre hépatite NOM_DE_MEDICAMENT NOM_DE_MEDICAMENT deuxième NOM_DE_MEDICAMENT donne mal tout bras gauche main gauche normal
1990;NOM_DE_MEDICAMENT hpv faire
1991;chienne nature très stressée anxieuse plus fait crises épilepsie commencé traitement phénobarbital voudrais coupler homéopathie epileptyl concernant anxiété stress pensez peux donner NOM_DE_MEDICAMENT
1992;acheter NOM_DE_MEDICAMENT
1993;le NOM_DE_MEDICAMENT quoi
1994;que pensez ordonnance femme enceinte 7 mois NOM_DE_MEDICAMENT 2cac 3 jour NOM_DE_MEDICAMENT folique 0 4 POSOLOGIE 2 jour
1995;existe NOM_DE_MEDICAMENT homéopathique contre tétanos
1996;copine prend NOM_DE_MEDICAMENT na plus tout envie normal
1997;peut délivrer NOM_DE_MEDICAMENT ricin quantité supérieure 30 POSOLOGIE
1998;le NOM_DE_MEDICAMENT donne cauchemars
1999;mon réfrigérateur tombé panne nuit entière NOM_DE_MEDICAMENT intérieur température maximale atteinte NOM_DE_MEDICAMENT 15 c puis encore utiliser
2000;lysopaine coluhextril
2001;ça fait semaine prend NOM_DE_MEDICAMENT hier saignement comme regles normal
2002;qu NOM_DE_MEDICAMENT
2003;une femme prenant levocétirizine POSOLOGIE arrow laboratoires raison comprimé jour souhaite savoir si peut prendre 2 comprimés les périodes crises allergiques
2004;medicament NOM_DE_MEDICAMENT 100 POSOLOGIE contre diabete fait vraiment maigrir
2005;NOM_DE_MEDICAMENT atd
2006;fils fait vacciné hier rouge gonflé maintenant dois faire
2007;NOM_DE_MEDICAMENT acné ça estompe temps
2008;fille NOM_DE_MEDICAMENT 10 mois jamais fait nuits enerve plus plus NOM_DE_MEDICAMENT mal rendormir essai depuis hier NOM_DE_MEDICAMENT 15ch peut etre vais rajouter NOM_DE_MEDICAMENT 15 ch sais trop si bien adapté NOM_DE_MEDICAMENT age
2009;quels les avantages NOM_DE_MEDICAMENT
2010;je viens subir acte dentaire prescrit NOM_DE_MEDICAMENT sandoz 1g comprimé dispersible je voudrais savoir NOM_DE_MEDICAMENT contre indication consommer cannabis traitement
2011;arrêt NOM_DE_MEDICAMENT 35 acné
2012;combien lyoc boîte NOM_DE_MEDICAMENT
2013;NOM_DE_MEDICAMENT sevrage
2014;j patiente veut soigner psoriasis cuir chevelu huiles essentielles conseillez
2015;enchaînement plaquettes adépal reprise
2016;NOM_DE_MEDICAMENT les ulcères
2017;acheter arkogellules lamier blanc
2018;copine prenais pillule NOM_DE_MEDICAMENT depuis 1 ans medecin NOM_DE_MEDICAMENT changé pillule daly gé est normal plusa voir libido
2019;NOM_DE_MEDICAMENT ça périme
2020;quelle utilisation première NOM_DE_MEDICAMENT
2021;je dois prendre NOM_DE_MEDICAMENT matin midi soir
2022;médecin vient prescrire NOM_DE_MEDICAMENT traiter endometriose combien temps faut prendre
2023;comment mettre bétadine fissure entré vagin
2024;allé acheter NOM_DE_MEDICAMENT sans prescription médecin pharmacien NOM_DE_MEDICAMENT donné NOM_DE_MEDICAMENT POSOLOGIE sans rien demander normal prescription être demandé
2025;NOM_DE_MEDICAMENT peut faire avorter
2026;pris deux cachets panthoprazole POSOLOGIE inadvertance grave
2027;lutenil informer medicament
2028;NOM_DE_MEDICAMENT traitement nouveau
2029;NOM_DE_MEDICAMENT risque grossesse stérilet NOM_DE_MEDICAMENT
2030;quelle indication monodose NOM_DE_MEDICAMENT 3g
2031;depuis dizaine jours prend NOM_DE_MEDICAMENT 100 POSOLOGIE jours fait total 15 00 POSOLOGIE NOM_DE_MEDICAMENT 15 jours surdosage
2032;est possible tomber enceinte sous NOM_DE_MEDICAMENT
2033;quels les différents sterilets
2034;demangeaisons NOM_DE_MEDICAMENT
2035;NOM_DE_MEDICAMENT migraine
2036;comment agit molecule NOM_DE_MEDICAMENT
2037;si prends plusieurs barre NOM_DE_MEDICAMENT risque quoi
2038;possible comme pilule classique prendre lutéran 10 continu cas oubli lutéran quel délai reprendre cp sans avoir protéger autrement car risque
2039;bonjour NOM_DE_MEDICAMENT déjà pris pilule méliane générique problèmes changement normalement devrait être chose part quelques pertes marrons claires spotting changement attends réponses merci
2040;supporte pilule NOM_DE_MEDICAMENT gyneco NOM_DE_MEDICAMENT donne meliane place gygy NOM_DE_MEDICAMENT dit arreter NOM_DE_MEDICAMENT jeudi soir dc prendre derniere prendre meliane mardi dire comme hab NOM_DE_MEDICAMENT ensuite pendt 3 semaines 1 semaine repose ca compte protégée changeant pilule protegee durant periode repos les 4 jours repos entre NOM_DE_MEDICAMENT meliane NOM_DE_MEDICAMENT deja pris meliane qd vs regles
2041;cela faisais 12 mois prenais plus pilule là pose 7 jours règles normal
2042;une patiente traitée NOM_DE_MEDICAMENT POSOLOGIE souhaite savoir si peut prendre NOM_DE_MEDICAMENT traitement
2043;NOM_DE_MEDICAMENT
2044;seropam peut être pris autre antidépresseur
2045;les granules homépathiques peuvent elles être diluées NOM_DE_MEDICAMENT
2046;pilule NOM_DE_MEDICAMENT connait
2047;quels les effets secondaires NOM_DE_MEDICAMENT
2048;commencé pilule NOM_DE_MEDICAMENT envers depuis 2 jours dois faire maintenant
2049;NOM_DE_MEDICAMENT palpitations
2050;spasmine somnifere
2051;viens commencer holgyème NOM_DE_MEDICAMENT 3 jours les heures suivent prise comprimé mal coeur nausées mal crâne est symptomes prolongent temps
2052;les iec les sartans peuvent ils provoquer insuffisance rnale fonctionnelle
2053;quels les risques NOM_DE_MEDICAMENT NOM_DE_MEDICAMENT si enceinte
2054;quel risque prendre NOM_DE_MEDICAMENT plusieurs mois suite
2055;NOM_DE_MEDICAMENT prendre continu
2056;xylo visqueuse NOM_DE_MEDICAMENT chez enfants 3 ans syndrome pieds mains bouche pensez
2057;j oublié plaquette meliane pharmacien NOM_DE_MEDICAMENT donné générique terminer cycle existe risque sachant agit molécule
2058;fais arrêt 7jours entre NOM_DE_MEDICAMENT NOM_DE_MEDICAMENT grave avoir fait arrêt 7jours entre dernière NOM_DE_MEDICAMENT première NOM_DE_MEDICAMENT
2059;avez déjà ordonnance NOM_DE_MEDICAMENT chez femme âgée sous NOM_DE_MEDICAMENT
2060;NOM_DE_MEDICAMENT peut entraîner insomnies
2061;sous traitement chimiothérapique depuis novembre 2007 utile voire prudent bien carrément dangereux faire injecter NOM_DE_MEDICAMENT anti grippe
2062;comment préparer NOM_DE_MEDICAMENT NOM_DE_MEDICAMENT
2063;parle NOM_DE_MEDICAMENT expidet fond bouche POSOLOGIE combien temps après prise médicament commence faire effet
2064;NOM_DE_MEDICAMENT hydan
2065;médecin NOM_DE_MEDICAMENT prescrit NOM_DE_MEDICAMENT cela va permettre tombé rapidement enceinte
2066;est dangereux prendre NOM_DE_MEDICAMENT comprimé dont date péremption passée NOM_DE_MEDICAMENT 6mois
2067;prends NOM_DE_MEDICAMENT continue NOM_DE_MEDICAMENT première contraception juske jamais cycles réguliers donc quelques peurs NOM_DE_MEDICAMENT approche fin première plaquette dois commencer deuxieme plaquette comme prévu type NOM_DE_MEDICAMENT si encore règles NOM_DE_MEDICAMENT fin première plaquette oui contraire dois attendre arrivée règles avant commencer suivante pense ca couperait effet nan
2068;comme pilule NOM_DE_MEDICAMENT provoque forte migraines
2069;NOM_DE_MEDICAMENT NOM_DE_MEDICAMENT enceinte
2070;dosage NOM_DE_MEDICAMENT enfant
2071;la levure bière peut être utilisée restaurer flore intestinale quand sujet constipation
2072;qu arpagophyton
2073;spotting pendant anneau règles durant pause
2074;prends NOM_DE_MEDICAMENT depuis 8 jours fais pleurer déprimer spotting pire pire chaque jour que dois faire
2075;pense commencer folliculinum combien ca coûte
2076;regles or fait 2 semaine enchainé 2eme plaquette entrain faire fausse couche
2077;informations officielles NOM_DE_MEDICAMENT
2078;quand commencer 1ere prise pilule après NOM_DE_MEDICAMENT
2079;arrété séroplex depuis deux semaines car veux changer que puis prendre
2080;maman agée 39 ans vient apprendre NOM_DE_MEDICAMENT cancer generalisé cela NOM_DE_MEDICAMENT commencé cancer col ulterus propagé ovaires reins vessie estomac les médecins pratiqué hystérectomie cela NOM_DE_MEDICAMENT suffit traitement possible
2081;commencé NOM_DE_MEDICAMENT gé mois ci depuis quelques jours commencé avoir crampes abdominales comme lors règles pertes brunâtres parfois rouge normal
2082;plus règles depuis retrait NOM_DE_MEDICAMENT
2083;paracétamol éatit anti inflammatoire antalgique bloquerait influx nerveux douloureux cerveau quelqu saurait comment bloque cet influx
2084;prends pilule NOM_DE_MEDICAMENT reprendre samedi reprise dimanche aprés arret non 7 jours 8 demandais si grave
2085;alternative sans ordonnance NOM_DE_MEDICAMENT 40g
2086;trimgel NOM_DE_MEDICAMENT compatibles n
2087;minoxydil 5 déconseillé les femmes
2088;oublié pilule NOM_DE_MEDICAMENT gé ches parents reste vieille pilule androcure puis prendre remplacement NOM_DE_MEDICAMENT gé pendant quelques jours
2089;bonjour viens enlever NOM_DE_MEDICAMENT NOM_DE_MEDICAMENT 1h suite soucis règles depuis 3 mois NOM_DE_MEDICAMENT 4 ans soucis depuis stérilet gyneco NOM_DE_MEDICAMENT prescrit NOM_DE_MEDICAMENT micro dosée remboursée dois attendre règles sais peux prendre pilule mtn quel les risques envie attendre car fais bcp natation aime savoir qd vais être réglée conseils merci
2090;j oublié prendre holgyome dois prendre 2 pillules consécutives
2091;le sipralexa efficace contre anxiété
2092;la pharmacienne reçoit ordonnance inhabituelle NOM_DE_MEDICAMENT crème enfant moins 2 ans soigner irritations elle demande si tel cas NOM_DE_MEDICAMENT déjà recensé
2093;dosage NOM_DE_MEDICAMENT chez enfant
2094;quels effets thérapeutiques NOM_DE_MEDICAMENT
2095;NOM_DE_MEDICAMENT frigo
2096;y NOM_DE_MEDICAMENT periode adaptation NOM_DE_MEDICAMENT
2097;phaéva entraine problèmes gynécologiques
2098;tout temps fatiguée pense cela vient NOM_DE_MEDICAMENT
2099;impression avoir perdue apetit depuis prend NOM_DE_MEDICAMENT depuis petite semaine pourtant parait ça stimule apetit ça fait prendre poid normal perdre appetit les premiers jours
2100;NOM_DE_MEDICAMENT bois bande
2101;cliente voudrait soulager petite fille souffre terreurs nocturnes voie homéopathique les crises durent parfois jusqu 5 minutes enfant ensuite rendort normalement proposer
2102;aujourd hui médecin NOM_DE_MEDICAMENT prescrit magnésium injectable NOM_DE_MEDICAMENT dit boire mélangé peu NOM_DE_MEDICAMENT alors notice écrit intraveineuse pensez
2103;les troubles érection sous NOM_DE_MEDICAMENT ils connus
2104;pris NOM_DE_MEDICAMENT ya deux jours aujourd hui les mêmes symptome q infection urinaire fait NOM_DE_MEDICAMENT ça 2 ans normal
2105;quel nom commercial NOM_DE_MEDICAMENT
2106;vaccins où faire
2107;fait NOM_DE_MEDICAMENT fièvre jaune NOM_DE_MEDICAMENT maintenant 7 jours suite après piqure ressenti espèces léger picotements sous pied gauche puis rien passé pendant 2 3 jours hier soir les picotements revenus grosse fatigue normal
2108;homeo NOM_DE_MEDICAMENT prescrit dose NOM_DE_MEDICAMENT album 200k quoi cette dilution
2109;peut avaler NOM_DE_MEDICAMENT lieu faire fondre sous langue
2110;prend NOM_DE_MEDICAMENT depuis 1 mois demi depuis pris 4 kg souvet énervé moral zéro impression déprimé est pilule
2111;fumer passiflore mauvais
2112;la NOM_DE_MEDICAMENT combattre les infections nosocomiales
2113;voila enchainer deux plaquette pilule commencé troisième prit 10 cachet troisième plaquette prit 10ème hier pris aujourd hui car voudrai avoir regles cette semaine etre tranquil week end doudou sous générique diance 35 puisque prit dernière pilule dimanche matin doit recommencer pilule quand première fois fais arret peux recommencer troisème palquette entamer comme enchaine toujours les plaquettes ca veux dire arreterai 1 plaquette demi 2 plaquette demi arreter fin plaquette obligé recommencé nouvelle plaquette
2114;pourquoi NOM_DE_MEDICAMENT indiqué seulement partir 6 ans
2115;effet secondaire NOM_DE_MEDICAMENT
2116;fils sous NOM_DE_MEDICAMENT viens aperçevoir fois ouvert faut conserver frigo quel risque laisser température ambiante
2117;commencé nouvelle pilule NOM_DE_MEDICAMENT gé auparavant prenait NOM_DE_MEDICAMENT arrêter car celle ci donnait saignements entre règles problème depuis deux jours saignements recommencent voulais savoir si cela peut être effet secondaire si pilule forte où cela peut venir fait fume encore
2118;est NOM_DE_MEDICAMENT prends peut être cause toux sèche
2119;sous efexor 37 5 depuis 2 ans souvent malade fatigue fievre faringite medecin dit sans doute NOM_DE_MEDICAMENT NOM_DE_MEDICAMENT reduit defenses qen pensez
2120;peut utiliser NOM_DE_MEDICAMENT chez femme enceinte
2121;comment utiliser les huiles essentielles contre les états dépressifs
2122;rcp mercillon
2123;pourquoi NOM_DE_MEDICAMENT
2124;sous NOM_DE_MEDICAMENT point peut être arrêter traitement agressivité irritabilité énervement sorte tremblements les bras sensation tout muscles crispent surtout ceux machoire cou temps cela apaisé
2125;sais certaine pillule peuvent favoriser les episodes mycosiques voulais savoir si NOM_DE_MEDICAMENT cas
2126;NOM_DE_MEDICAMENT grossesse
2127;medecin NOM_DE_MEDICAMENT prescrit NOM_DE_MEDICAMENT NOM_DE_MEDICAMENT dit 10 jours nouveau regles 8eme jour toujours rien normal
2128;NOM_DE_MEDICAMENT générique NOM_DE_MEDICAMENT
2129;NOM_DE_MEDICAMENT hpv faire
2130;acheter arkogellules lamier blanc
2131;problème rapport maudites bouffées chaleur installées depuis 1an existe traitement homéopathique phytothérapie efficace
2132;NOM_DE_MEDICAMENT développe kystes ovariens
2133;peux prendre NOM_DE_MEDICAMENT douleur
2134;NOM_DE_MEDICAMENT fait grossir
2135;utilise NOM_DE_MEDICAMENT depuis 6 mois constaté progressivement diminution règles quantité durée délai plus plus long avant commencement devrais faire test grossesse tous les mois
2136;est mélatonine peut être délivrée ordonnance
2137;peut substituer NOM_DE_MEDICAMENT prescrit 2 capteurs freestyle libre si ordonnance sécurisée
2138;qu produit contraste
2139;danger huiles essentielles grossesse
2140;est fille dessous 3 ans peut prendre NOM_DE_MEDICAMENT
2141;NOM_DE_MEDICAMENT quoi sert NOM_DE_MEDICAMENT
2142;le NOM_DE_MEDICAMENT enfant fait encore
2143;je règles après 20 jours sans pilule NOM_DE_MEDICAMENT risque enceinte
2144;délai entre NOM_DE_MEDICAMENT grossesse
2145;est peut avoir rapports sexuels non protégés pendant semaine arrêt NOM_DE_MEDICAMENT
2146;est peux prendre compléments alimentaires hyperprotéinés NOM_DE_MEDICAMENT
2147;NOM_DE_MEDICAMENT NOM_DE_MEDICAMENT
2148;faut prescrire NOM_DE_MEDICAMENT ordonnance spéciale
2149;sous générique NOM_DE_MEDICAMENT discontinu plaquettes 21 comprimés aprés 7 jours arrêt allée pharmacie NOM_DE_MEDICAMENT NOM_DE_MEDICAMENT donne generique NOM_DE_MEDICAMENT continu 28 comprimés NOM_DE_MEDICAMENT risque grossesse
2150;existe svp solutions retrouver libido normale malgré prise antidépresseurs anxiolytiquess
2151;quelqu connait remède diminuer quintes toux
2152;bonjour prends mélodia depui 9 jours voulais savoir si possible ovuler si doi quand meme prendre pilule lendemain
2153;pensez NOM_DE_MEDICAMENT NOM_DE_MEDICAMENT y NOM_DE_MEDICAMENT risques
2154;chercher qq chose sans ordonnance plus deprimer plus faire colere
2155;actuellement sous NOM_DE_MEDICAMENT mois ci douleurs seins voudrais essayer NOM_DE_MEDICAMENT comment doit procéder
2156;quand vacciner NOM_DE_MEDICAMENT
2157;pastille pur gorge lequelle
2158;possible associer NOM_DE_MEDICAMENT NOM_DE_MEDICAMENT NOM_DE_MEDICAMENT NOM_DE_MEDICAMENT
2159;NOM_DE_MEDICAMENT déja cérazette pouvez dire
2160;eruption boutons NOM_DE_MEDICAMENT NOM_DE_MEDICAMENT
2161;pourquoi prendre NOM_DE_MEDICAMENT
2162;avec quoi traiter diabete homéopathie
2163;prends NOM_DE_MEDICAMENT depuis 2 mois souffrant anxiété constante surtout sociale handicapante plus rien perdre manipulations hazardeuses 2 mois traitement persuadé doubler POSOLOGIE 6cmp dose maximale POSOLOGIE 3cmp pourrait amplemant soulager anxiété cependant direz dose maxi doit etre depassé chacun NOM_DE_MEDICAMENT seuil dose maximale propre meme
2164;NOM_DE_MEDICAMENT POSOLOGIE angoisse vrai faux
2165;prend pilule NOM_DE_MEDICAMENT corectement pendan periode arrêt 7j POSOLOGIE regles POSOLOGIE rapport non protégé copain debut regles jorai voulu savoir si NOM_DE_MEDICAMENT risk ke tombe enceinte
2166;hémoclar
2167;NOM_DE_MEDICAMENT bouffees chaleur
2168;diu NOM_DE_MEDICAMENT combien temps les douleurs
2169;décontractyl retiré marché
2170;change antidépresseur prenais NOM_DE_MEDICAMENT arrêté 15 jours NOM_DE_MEDICAMENT effet secondaire les 15 premiers jours pourquoi effets secondaires bout 15 jours parce encore NOM_DE_MEDICAMENT sang ca parce arreter NOM_DE_MEDICAMENT coup
2171;NOM_DE_MEDICAMENT les seins
2172;connàit NOM_DE_MEDICAMENT
2173;faut prendre NOM_DE_MEDICAMENT avant pendant les repas
2174;transpiration excessive beaucoup solutions quel traitement existe
2175;désagréments sous NOM_DE_MEDICAMENT
2176;voulais juste demander si connaissez NOM_DE_MEDICAMENT
2177;prends NOM_DE_MEDICAMENT peux plus fatigue devenue chronique vertiges hypotension crois vais arrêter coup sens encore plus mal car plus capable avoir activité ça pourrait être effet secondaire
2178;le NOM_DE_MEDICAMENT placebo
2179;bonjour NOM_DE_MEDICAMENT boostrixterra depuis 6 mois frigo encore utilisable
2180;puis donner NOM_DE_MEDICAMENT eczéma séborrhéique visage
2181;après oubli désobel gé 20 12h protégée
2182;quels les effets indesirables NOM_DE_MEDICAMENT
2183;NOM_DE_MEDICAMENT sans ordonnance toujours possible
2184;NOM_DE_MEDICAMENT donne hallucinations ainsi changements perception
2185;peut prendre mélatonine temps NOM_DE_MEDICAMENT
2186;quelle posologie maximale amm rapport NOM_DE_MEDICAMENT
2187;si les vaccins causent réactions indésirables homéopathie peut nettoyer les effets secondaires les symptômes causés les vaccins
2188;peut prescrire NOM_DE_MEDICAMENT pendant grossesse
2189;puis associer NOM_DE_MEDICAMENT grifonia sans danger
2190;sous NOM_DE_MEDICAMENT oublié prendre NOM_DE_MEDICAMENT deux semaines pris comprimé oublié sais si comprimé veille donc préfère faire comme si complètement oublier comprimé ils disent marche suivre cas utilise préservatifs seulement semaine aussi
2191;bonjour copine samedi passé NOM_DE_MEDICAMENT oublié prendre pillule NOM_DE_MEDICAMENT prise lendemain 14h retard deuxième semaine rapport lundi soir pris pillule comme conseillé utilisé préservatif manque pot NOM_DE_MEDICAMENT craqué pendant rapport sans rendions compte aujourd hui allé acheter pillule lendemain demande maintenant utile prendre si entrain stresser rien pillule désorelle20 pillule lendemain encore prise marque NOM_DE_MEDICAMENT merci avance réponses ps si prend doit proteger suite jusqu prochaine règles
2192;NOM_DE_MEDICAMENT pharmacien souhaite savoir si NOM_DE_MEDICAMENT listé comme médicament exception
2193;deux vaccins hier grippe tétanos senti vite fatigué tombé endormi aujourd hui état fébrile déjà effet similaire
2194;NOM_DE_MEDICAMENT e b6 favorisent fertilité
2195;NOM_DE_MEDICAMENT tous les comprimé dosé pareil
2196;repri NOM_DE_MEDICAMENT aujourd hui apercois reperd sang retour couche si oui fini cette plaquette pillule qd reprendrais ancienne pillule etait NOM_DE_MEDICAMENT
2197;prends mélodia depuis 2 mois règles premier mois les attends depuis seins énormes grossi 5 kg mois est normal
2198;de quelle taille les gélules duloxétine krka
2199;fille NOM_DE_MEDICAMENT fait NOM_DE_MEDICAMENT dt polio hier NOM_DE_MEDICAMENT 11ans là matin NOM_DE_MEDICAMENT forte fievre 39 rouge peu enflé là ya piqure 1er fois fait ca normal
2200;NOM_DE_MEDICAMENT grossesse
2201;apparition bleus sans coup sou NOM_DE_MEDICAMENT normal
2202;gardasile
2203;peut cumulé NOM_DE_MEDICAMENT NOM_DE_MEDICAMENT NOM_DE_MEDICAMENT
2204;prends NOM_DE_MEDICAMENT depuis deux mois vais mieux tête contre démangeaisons tout corps peut prendre soulager
2205;peut consommer NOM_DE_MEDICAMENT fois date péremption passée
2206;data monéva
2207;medicament spéciafoldine listé
2208;sous lutéran dois prendre 20 jours mois pause 7 jours or pris 21 si fais pause 8 jours lieu 7 habitude vais pouvoir récupérer comprimé pris plus
2209;NOM_DE_MEDICAMENT depuis quand ça existe
2210;epouse NOM_DE_MEDICAMENT pris seule injection synergon rendus compte etait etat grossesse quels effets peut avoir cette injections futur enfant
2211;NOM_DE_MEDICAMENT toux NOM_DE_MEDICAMENT
2212;quoi NOM_DE_MEDICAMENT générique
2213;NOM_DE_MEDICAMENT quelles les risques
2214;NOM_DE_MEDICAMENT dysfonction érectile
2215;sevrage effeor POSOLOGIE jr psychosomatique
2216;y NOM_DE_MEDICAMENT risque fausse couche NOM_DE_MEDICAMENT
2217;NOM_DE_MEDICAMENT ça sert koi
2218;comment présente NOM_DE_MEDICAMENT
2219;le NOM_DE_MEDICAMENT cause prise poids
2220;NOM_DE_MEDICAMENT fievre jaune dangeureux
2221;est NOM_DE_MEDICAMENT inhibe action pilule
2222;NOM_DE_MEDICAMENT dantalgique peuvent traiter grosse calcification poignet
2223;maladie crohn NOM_DE_MEDICAMENT
2224;une dame hier venue pharmacie paniqué car oublié prendre progestérone ovule matin but favoriser nidation traitement car déjà fausse couche je rassuré disant oubli 20j matin soir grave voulais quand savoir si risques
2225;suite NOM_DE_MEDICAMENT hépatite NOM_DE_MEDICAMENT typhoide atrocement mal bras souffre douleur coude jusqu haut épaule normal
2226;NOM_DE_MEDICAMENT nourisson peut recevoir granion NOM_DE_MEDICAMENT
2227;récemment médecin NOM_DE_MEDICAMENT augmenté dosage quétiapine depuis souvent chaud fais cauchemars étourdit cause augmentation
2228;dangereux prendre ibuprofène lors apéro bien arrosé
2229;commencé cure compléments NOM_DE_MEDICAMENT magnésium car très carencée voulais savoir bout combien temps ça faisait effet 1 mois 3 mois
2230;nausées dégout nourriture sous NOM_DE_MEDICAMENT normal
2231;NOM_DE_MEDICAMENT provera dangereux
2232;prenait générique NOM_DE_MEDICAMENT les arreter NOM_DE_MEDICAMENT dernier cycle car sentais trop faible depuis sens plus forme plus vertrige douleurs bas ventre dos viens icic avoir temoignages filles arreter pillule savoir si ca arrive genre douleurs
2233;NOM_DE_MEDICAMENT peut provoquer bouffées chaleur
2234;prise NOM_DE_MEDICAMENT 21h partir 22h gastro encore aujourdhui il faut fasse quoi comprime hier va fonctionner non
2235;NOM_DE_MEDICAMENT fait encore effet
2236;NOM_DE_MEDICAMENT perdu faire
2237;quelqu combien coute NOM_DE_MEDICAMENT svp
2238;NOM_DE_MEDICAMENT magnésium magnésium
2239;est les vitamines peuvent améliorer fertilité masculine
2240;quelle galénique vérapamil sandoz
2241;pris cérazette depuis 10 ans arrèté grippe médecin NOM_DE_MEDICAMENT prescrit aspégic 100 nouveau règles dues médicament arrètent normal
2242;bonjour NOM_DE_MEDICAMENT toutes voila ya mois ca jai pris NOM_DE_MEDICAMENT car suite NOM_DE_MEDICAMENT arret pilule navais plus regles 21 octobre jai regles commes prevu depuis hier jai pertes sang croire jai regles vont arriver jaimerer savoir si normal merci reponses
2243;NOM_DE_MEDICAMENT partir quand NOM_DE_MEDICAMENT efficace
2244;bonjour prens endrocure depuis presque bientôt 1 ans problemes regles prens 1 2 comprimé jour plus pillule NOM_DE_MEDICAMENT entendu parler ça réduisai pilositée impression ça NOM_DE_MEDICAMENT effet inverse possible
2245;faut prendre NOM_DE_MEDICAMENT plutôt matin soir
2246;hier pense avoir pris 21è pilule sans avoir souvenir grave si rapport durant we
2247;NOM_DE_MEDICAMENT dependance
2248;comment appliquer NOM_DE_MEDICAMENT onagre
2249;sous traitemnt NOM_DE_MEDICAMENT depuis mois cest 31éme jour cycle jai régles normal
2250;NOM_DE_MEDICAMENT connaissez
2251;NOM_DE_MEDICAMENT NOM_DE_MEDICAMENT mode action
2252;zythromax pdt 1er trimestre grossesse
2253;puis prendre NOM_DE_MEDICAMENT cefpodoxine meme temps
2254;puis allaiter si prend NOM_DE_MEDICAMENT
2255;je sous NOM_DE_MEDICAMENT combien temps faut attendre sentir mieux
2256;effectué rappel NOM_DE_MEDICAMENT quinta bébé 18 mois hier découvre petit bouton rouge réapparu cette cuisse là pensez quoi
2257;NOM_DE_MEDICAMENT monodose peut appliquer tete
2258;tamik douloureux effets secondaires
2259;connaissez NOM_DE_MEDICAMENT NOM_DE_MEDICAMENT 5
2260;NOM_DE_MEDICAMENT dangereux
2261;ca fait lonten ke jpren pilule parfois joubli jour dc jen prend deux mm jour jaimerai savoir si ca peut avoir effets nocifs santé
2262;NOM_DE_MEDICAMENT hépatite NOM_DE_MEDICAMENT effets indésirables
2263;NOM_DE_MEDICAMENT combien temps sang
2264;homéo vient prescrire NOM_DE_MEDICAMENT NOM_DE_MEDICAMENT 6 dh déjà pris avant ça NOM_DE_MEDICAMENT fonctionné NOM_DE_MEDICAMENT juste rajouté NOM_DE_MEDICAMENT 200k pensez cela va agir rajoutant dose NOM_DE_MEDICAMENT
2265;prends antibiotique NOM_DE_MEDICAMENT forte traitement infection urinaire depuis vendredi matin matin sens ca tiraille peu plus haut ventre partie droite normal
2266;quel cas NOM_DE_MEDICAMENT contre indiqué
2267;rappel NOM_DE_MEDICAMENT antitétanique pendant prise antibiotiques
2268;démangeaisons sous NOM_DE_MEDICAMENT normal
2269;peau front grasse luit donne points noirs certaines fois infectent deviennent rouges NOM_DE_MEDICAMENT médicament homéo traiter ca
2270;amie NOM_DE_MEDICAMENT pris environ 22 cachet NOM_DE_MEDICAMENT comprenant deux trois cachets ibuprophene quelqu peut dire risque svp
2271;pourquoi prendre NOM_DE_MEDICAMENT
2272;prenais NOM_DE_MEDICAMENT 35 NOM_DE_MEDICAMENT arrêté NOM_DE_MEDICAMENT depuis mois maintenant spotting désagréable donc palier spotting arrête définitivement NOM_DE_MEDICAMENT 35 fin plaquette recommence après 7 jours pause
2273;voudrais savoir si peu mélanger spagyrie NOM_DE_MEDICAMENT NOM_DE_MEDICAMENT rescue fleur bach car angoisses
2274;arvara peut être prescrit place NOM_DE_MEDICAMENT
2275;plus règle NOM_DE_MEDICAMENT normal
2276;protégé rapports non protégés durant arret pillule NOM_DE_MEDICAMENT chaque fin plaquette
2277;absence NOM_DE_MEDICAMENT pharmacie pourquoi
