;question
5973;aimerais savoir si fait avaler comprimé propécia peu NOM_DE_MEDICAMENT tiède change effet médicament plutot rend moins performant provoque sais quoi va rendre organisme moins receptif produit les prises suivantes
5974;bonjour voilà ça fait mois prends pilule lutényl 5éme 24éme jour arrêté plaquette jeudi dernier dois reprendre soir ms toujours règles normal oubliée mari retire toujours avant ejaculer sais cette pilule peut provoquer absence règles ms 1er cycle merci répondre angoisse 39 ans veux plus enfants
5975;NOM_DE_MEDICAMENT depuis 3 4 semaines effets bizarre faire
5976;prends triafemi depuis quinze jours effet secondaire irritabilité lentilles contacts possible quand gardant pillule effet estompe
5977;NOM_DE_MEDICAMENT guérir stress
5978;contraception arret NOM_DE_MEDICAMENT commencer NOM_DE_MEDICAMENT comment faire
5979;prends ludéal gé générique NOM_DE_MEDICAMENT hier vomissements moins 4 heures après avoir pris pilule plaquette secours pris pilule jour suivant dois protéger autre façon jusqu fin plaquette
5980;peut prendre evotirox pendant grossesse
5981;dermatologue NOM_DE_MEDICAMENT prescris 2 gellules NOM_DE_MEDICAMENT jour prend aussi 2 NOM_DE_MEDICAMENT NOM_DE_MEDICAMENT jour vu les 2 compatibles dois arreter NOM_DE_MEDICAMENT
5982;connait médicament NOM_DE_MEDICAMENT
5983;prends NOM_DE_MEDICAMENT depuis octobre dernier depuis quelques jours mal niveau ovaires cotés droit ventre gonflé fatigue latente constipation nomal
5984;problèmes sous NOM_DE_MEDICAMENT help
5985;differrence compo vaccins NOM_DE_MEDICAMENT meninvact
5986;NOM_DE_MEDICAMENT fort pendant grossesse
5987;NOM_DE_MEDICAMENT remboursée
5988;quel dosage optimal NOM_DE_MEDICAMENT
5989;NOM_DE_MEDICAMENT pilule possibles durant grossesse
5990;depuis mari prend NOM_DE_MEDICAMENT 37 POSOLOGIE fait plus plus crise vertiges nausée bouche sêche est normal
5991;transpiration excessive NOM_DE_MEDICAMENT quel coût
5992;solutions contre baisse libido anorgasmie
5993;NOM_DE_MEDICAMENT quels effets secondaires
5994;NOM_DE_MEDICAMENT acné
5995;quelqu NOM_DE_MEDICAMENT deja effets indesirable NOM_DE_MEDICAMENT 50 POSOLOGIE
5996;voulais savoir si NOM_DE_MEDICAMENT amara antibiotique
5997;effets indesirables NOM_DE_MEDICAMENT contre gastro
5998;NOM_DE_MEDICAMENT provoque crises asthme
5999;NOM_DE_MEDICAMENT tetra grossesse
6000;peut prendre NOM_DE_MEDICAMENT quand enceinte
6001;aimerais avoir avis prenne NOM_DE_MEDICAMENT selon vécu traitement NOM_DE_MEDICAMENT également complication toute sorte q les risque ya risque effet secondaire incurable
6002;homéophatie peut etre utilisé les règles douloureuses
6003;NOM_DE_MEDICAMENT diminution traitement perte poid
6004;prend NOM_DE_MEDICAMENT depuis 4 mois lu medicament pouvait etre dangereux si pris NOM_DE_MEDICAMENT long terme quelqu sait pus
6005;le NOM_DE_MEDICAMENT peut être prescrit chez personne agée
6006;NOM_DE_MEDICAMENT comprimé secable
6007;si déjà pertes brunes foncées voir rouge sous NOM_DE_MEDICAMENT pouvez dire combien temps ça NOM_DE_MEDICAMENT duré
6008;NOM_DE_MEDICAMENT adresse traitement
6009;NOM_DE_MEDICAMENT pareil NOM_DE_MEDICAMENT 23
6010;stabilisé NOM_DE_MEDICAMENT téralithe dors plus que faire
6011;stérilet NOM_DE_MEDICAMENT hypertension
6012;souffre crise hémorroïdaire qqun peut aider
6013;NOM_DE_MEDICAMENT NOM_DE_MEDICAMENT
6014;bien médicament devrais revenir NOM_DE_MEDICAMENT
6015;existe comprimés NOM_DE_MEDICAMENT lp 0 7 POSOLOGIE
6016;prends pilule NOM_DE_MEDICAMENT depuis jeudi 24 avril rdv chez gynéco depuis matin points rouges poitrine lié NOM_DE_MEDICAMENT pilule coup stresse attends réponses impatience merci avance jennifer
6017;prend pilule desorel 20 fait 7 jours arret toujour pa fausse regles esque normale avoir saignemen pendant les 7 jours arret
6018;puis prendre NOM_DE_MEDICAMENT temps NOM_DE_MEDICAMENT follique NOM_DE_MEDICAMENT
6019;connait NOM_DE_MEDICAMENT
6020;pilule NOM_DE_MEDICAMENT gé risque
6021;on NOM_DE_MEDICAMENT prescription botte marche haute fracture tibia péroné redirige patient chez médecin pose
6022;oubli NOM_DE_MEDICAMENT 35 4eme jour faire
6023;NOM_DE_MEDICAMENT pris charge
6024;fait opéré luxation machoire sous l72 arrêté car dort très mal mal endormir lève encore plus fatigué dois faire
6025;en cas allaitement quel NOM_DE_MEDICAMENT délivre adec d
6026;vrai existe NOM_DE_MEDICAMENT allemagne contre les mycoses
6027;dermato prescrit NOM_DE_MEDICAMENT aimerai savoir si les effets secondaires fréquents
6028;enormement stressé NOM_DE_MEDICAMENT cause pb couples quel medicaments pourrais prendre détendre fondre larme NOM_DE_MEDICAMENT chaque tracas
6029;enfin trouvé NOM_DE_MEDICAMENT soulage yeux secs apis mellifica 8 dh NOM_DE_MEDICAMENT officinali 3 dh NOM_DE_MEDICAMENT officinalis 3 dh aa qsp 1 flacon professeur suit syndrome état général dit NOM_DE_MEDICAMENT muguet
6030;NOM_DE_MEDICAMENT liste 1
6031;bonjour merci NOM_DE_MEDICAMENT ceux auron prisle temps lire repondre voila explique probleme prend pilule NOM_DE_MEDICAMENT quesqui passer stress exams les soucis cheri oublier certaine pilules alor plus exactement pris pilule gros 1jour 2 NOM_DE_MEDICAMENT partir 11e 12e pilule arrivee NOM_DE_MEDICAMENT NOM_DE_MEDICAMENT 16e savais plus tout regles donc NOM_DE_MEDICAMENT 3 jours plus ren ca arreter bizare pasque regles durent super longtemps normalement env 7 jours mm pilule bref voila plus plus mal o ventre ca tire bas voila plus cycle fait quelqu peu aider dire si ca deja arriver quand dois reprendre pilule bon pense risque grossesse car pendant periode oubli NOM_DE_MEDICAMENT faire amour 1 fois NOM_DE_MEDICAMENT tt peter donc pense risque demande avis car honte aller voir docteur sachant fait avorter NOM_DE_MEDICAMENT 9 mois merci
6032;appris matin enceinte sachant pris NOM_DE_MEDICAMENT samedi dimanche ect NOM_DE_MEDICAMENT risques
6033;sous NOM_DE_MEDICAMENT 15 jours nouveau règles faible règles tout normal
6034;NOM_DE_MEDICAMENT NOM_DE_MEDICAMENT
6035;bonsoir prenais seroquel depuis 2006 200 POSOLOGIE 2012 décidé accord médecin arrêter progressivement depuis mois dose coucher 50 POSOLOGIE cette molécule NOM_DE_MEDICAMENT fait prendre 6 kilos pensez kilos arrivais perdre partirons peu après fin traitement
6036;NOM_DE_MEDICAMENT traitement équivalent NOM_DE_MEDICAMENT
6037;combien temp faut les vertiges partent sous NOM_DE_MEDICAMENT
6038;enceinte 3mois pris pendant 1 semaine NOM_DE_MEDICAMENT NOM_DE_MEDICAMENT quels les risques bébé
6039;le NOM_DE_MEDICAMENT grippe ordonnance bizone partie ald pris charge caisse patient
6040;oubli méliane prise norlévo risques
6041;prends NOM_DE_MEDICAMENT depuis 7 jours 1gr 3 fois dangereux prendre aussi longtemps
6042;pilule NOM_DE_MEDICAMENT peu dosée
6043;NOM_DE_MEDICAMENT les troubles anxieux généralisés
6044;NOM_DE_MEDICAMENT durée traitement
6045;après combien temps peut reprendre NOM_DE_MEDICAMENT
6046;faut ordonnance acheter NOM_DE_MEDICAMENT dt polio
6047;depuis 1 semaine prend patch NOM_DE_MEDICAMENT il décoller plusieurs fois recoller faire
6048;quel type atd NOM_DE_MEDICAMENT
6049;NOM_DE_MEDICAMENT médicament
6050;connaissez NOM_DE_MEDICAMENT massage argel7 merci
6051;aimerai savoir si les médicaments molécule NOM_DE_MEDICAMENT remboursé sous NOM_DE_MEDICAMENT POSOLOGIE 1 an raison 104 euros mois minimum sans aucun remboursements mutuelle va prendre charge difference
6052;j prescription bain bouche NOM_DE_MEDICAMENT injectable bicar doute règlementation on peut reconditionner NOM_DE_MEDICAMENT injectable
6053;peut prendre cortisone meme temps NOM_DE_MEDICAMENT
6054;bonjours NOM_DE_MEDICAMENT tout e aimerais savoir si prendre 12 comprimé NOM_DE_MEDICAMENT 1 POSOLOGIE grave 15 ans merci
6055;NOM_DE_MEDICAMENT dire
6056;combien temps puis utiliser NOM_DE_MEDICAMENT après avoir ouvert
6057;quelle NOM_DE_MEDICAMENT remplacer dtp
6058;j arrêt 7 jours prise pilule devais reprendre 1er comprimé plaquette vendredi pris samedi dois protéger
6059;quelqu NOM_DE_MEDICAMENT déjà pris NOM_DE_MEDICAMENT arrêter fumer
6060;savez si NOM_DE_MEDICAMENT fait grossir
6061;conservation NOM_DE_MEDICAMENT POSOLOGIE NOM_DE_MEDICAMENT
6062;tomber enceinte sous NOM_DE_MEDICAMENT quel risque
6063;cycléane 20 quel pillule commencer
6064;generique NOM_DE_MEDICAMENT
6065;combien temps attente après arrêt NOM_DE_MEDICAMENT
6066;utilise presque quotidiennement NOM_DE_MEDICAMENT contre les nausées voudrais savoir si dangereux santé
6067;après oubli mélodia faire
6068;peut prendre NOM_DE_MEDICAMENT pendant grossesse
6069;pharmacodynamie bétaserc
6070;le médecin NOM_DE_MEDICAMENT obligation mentionner pharmacien délivrera NOM_DE_MEDICAMENT
6071;NOM_DE_MEDICAMENT quelle classe traitements appartient NOM_DE_MEDICAMENT
6072;NOM_DE_MEDICAMENT NOM_DE_MEDICAMENT peut entrainer augmentassion NOM_DE_MEDICAMENT
6073;quelle posologie NOM_DE_MEDICAMENT olivier NOM_DE_MEDICAMENT europea
6074;NOM_DE_MEDICAMENT injectée NOM_DE_MEDICAMENT depuis jour mal tête quand fais certains mouvements pensez lié NOM_DE_MEDICAMENT
6075;commencé NOM_DE_MEDICAMENT premiére fois règles viennent juste finir voulais savoir si peux maintenant avoir rapports sans courrir risque tombé enceinte parcours forum question 7 jours parfois autres fois active premiére prise sais plus quoi penser
6076;le NOM_DE_MEDICAMENT peut entraîner alopécie
6077;comment séparer NOM_DE_MEDICAMENT
6078;NOM_DE_MEDICAMENT NOM_DE_MEDICAMENT beaucoup différences entre prendre POSOLOGIE jour POSOLOGIE
6079;quelle posologie laurier noble inhalation humide
6080;NOM_DE_MEDICAMENT peut conduire véhicule
6081;pourquo prendre dexorat
6082;quel bilan pré thérapeutique réaliser avant instauration traitement NOM_DE_MEDICAMENT
6083;supporte les antidépresseurs NOM_DE_MEDICAMENT
6084;veux prendre ths bout combien temps cela fait effet
6085;aimerais savoir si NOM_DE_MEDICAMENT nouveau disponible pharmacie actuellement
6086;possible décaler les règles NOM_DE_MEDICAMENT donné NOM_DE_MEDICAMENT arret entre les plaquettes
6087;pose questions sujet NOM_DE_MEDICAMENT NOM_DE_MEDICAMENT sécurité sociale rembourse entièrement les 3 injections
6088;NOM_DE_MEDICAMENT quoi sert NOM_DE_MEDICAMENT
6089;sous NOM_DE_MEDICAMENT trés mal NOM_DE_MEDICAMENT epaule droite quelqu peu dire plus
6090;NOM_DE_MEDICAMENT gé durant allaitement
6091;faut réaliser bilan ophtalmologique avant débuter traitement NOM_DE_MEDICAMENT
6092;pris NOM_DE_MEDICAMENT 35 pdt 10ans aimerais avoir bébé combien temps faut general tomber enceinte
6093;patch NOM_DE_MEDICAMENT applique combien temps avant NOM_DE_MEDICAMENT
6094;prescription renouvellable NOM_DE_MEDICAMENT
6095;quand prends ibuprofène puis prendre NOM_DE_MEDICAMENT aussi
6096;fait surdosage leger 8gr3 paracétamol peu propofan aussi 6 jours apres 1ere surdose ravale 10 gr paracétamol deux jours plus tard avale 4 gr NOM_DE_MEDICAMENT antalvic puis lundi 7 gr paracétamol mardi 305 gr paracétamol 5 diantalvic mercredi 6 5gr jeudi 8 gr vendredi 8 gr samedi dimanche 8 gr chaque jour deux jours plus tard reprends 8 gr 4 jours aprés avale 8 gr derniers comprimés cela fait mois prends plus aucun médicaments ts confondus encore moins surdosage hépatite médicamenteuse peut surgir 1 mois aprés alors médicaments NOM_DE_MEDICAMENT incriminé NOM_DE_MEDICAMENT supprimé concretement risque qlq chose pire derriere
6097;j palpitations NOM_DE_MEDICAMENT dois faire
6098;prend pilule mélodia car suportait NOM_DE_MEDICAMENT cette pillule prise continu 4 comprimés inactif voudrai avoir rêgle comment doit mis prendre cette pillule les avoir
6099;j souci médecin prescrit NOM_DE_MEDICAMENT patient tous les 15 jours délivrance 28 jours comment délivrer
6100;comment diluer NOM_DE_MEDICAMENT mère
6101;en combien temps effet NOM_DE_MEDICAMENT dissipe
6102;NOM_DE_MEDICAMENT contre angoisse
6103;combien dose normale NOM_DE_MEDICAMENT
6104;connait NOM_DE_MEDICAMENT
6105;passé NOM_DE_MEDICAMENT décontractyl myorelaxant pendant 5 jours après avoir arreté violent urticaire grosse plaque rouge épaisse accompagné violentes démangeaisons brulures prends célestamine locoïd depuis 5 jours composant décontractyl peut etre origine cet urticaire possible fasse allergie
6106;sous NOM_DE_MEDICAMENT déjà arrivé enchainer 2 plaquettes enchainant directement les comprimés dernière couleur viens seulement réaliser pris 2ème plaquette entière fait pertes sang tout mois peut etre signe quelque chose
6107;médecin NOM_DE_MEDICAMENT prescrit NOM_DE_MEDICAMENT comme antipalludéen les effets secondaires si terribles effet deprime
6108;le NOM_DE_MEDICAMENT peut être utilisé chez patient myasthénique
6109;chikungunya affecte réunion collègue NOM_DE_MEDICAMENT parlé NOM_DE_MEDICAMENT palustre 9 ch posologie 5 comprimés jour valable aussi les enfants
6110;sous mélodia avant sous tricilest cela fait quelques jours saingements alors milieu plaquette quelqu idée signe quelque chose
6111;sous NOM_DE_MEDICAMENT POSOLOGIE vraiment dangereux santé
6112;une patiente actuellement traitée NOM_DE_MEDICAMENT cristers souhaite diminuer les doses progressivement arrêter traitement coupe donc les comprimés deux peut continuer
6113;sous prosac cause produit bcp changé personnalité plus motivation les études foutiste insensible honnetement plus interet rien commence sentir triste cet état quelqu connait cet etat
6114;partie week end malheur oublié plaquette NOM_DE_MEDICAMENT résultat voilà 2 jours prise pillule dois faire prendre les 2 cachets prendre celui soir heure habituelle sachant rapport avant semaine car copain voyage affaire
6115;NOM_DE_MEDICAMENT mangeant
6116;dois faire rappel NOM_DE_MEDICAMENT dt polio NOM_DE_MEDICAMENT voulais savoir si pouvais faire quel endroit dois piquer
6117;NOM_DE_MEDICAMENT si pris 12h après heure habituelle
6118;recemment quitte NOM_DE_MEDICAMENT NOM_DE_MEDICAMENT peu habituee NOM_DE_MEDICAMENT nouvelle presentation plaquette oublie les 5 pillules derniere semaine apres avoir lu notice NOM_DE_MEDICAMENT repris normalement pillule 7 jours plus tard apprete NOM_DE_MEDICAMENT reprendre nouvelle plaquette 2eme depuis oubli souhaiterais savoir vaut mieux faire tout redevienne normal arreter pillule pendant plusieurs mois continuer prendre normalement
6119;effets secondaires mélodia combien temps
6120;dependant NOM_DE_MEDICAMENT
6121;pourquoi prendre NOM_DE_MEDICAMENT
6122;quel complément NOM_DE_MEDICAMENT
6123;NOM_DE_MEDICAMENT
6124;une patiente souhaite savoir si peut fumer prise NOM_DE_MEDICAMENT POSOLOGIE
6125;NOM_DE_MEDICAMENT effets secondaires NOM_DE_MEDICAMENT long terme
6126;NOM_DE_MEDICAMENT long terme danger
6127;gossesse NOM_DE_MEDICAMENT
6128;NOM_DE_MEDICAMENT délivré ordonnance seulement
6129;asthmatique sous NOM_DE_MEDICAMENT NOM_DE_MEDICAMENT tous les jours médicaments peuvent avoir influence taux NOM_DE_MEDICAMENT
6130;NOM_DE_MEDICAMENT cytochrome p450
6131;sous NOM_DE_MEDICAMENT depuis plus 5 mois impression effets physiques fourmillement vue perturbée maux tête lorsque manque sommeil peut renseigner problème
6132;lequel agit plus rapidement NOM_DE_MEDICAMENT NOM_DE_MEDICAMENT NOM_DE_MEDICAMENT
6133;NOM_DE_MEDICAMENT NOM_DE_MEDICAMENT NOM_DE_MEDICAMENT lisopaine peux
6134;NOM_DE_MEDICAMENT propos celestène question svp
6135;le contraceptif luthényl NOM_DE_MEDICAMENT effets gênants
6136;est normal prescrire NOM_DE_MEDICAMENT k bébé sous lait maternel
6137;guronsan dangereux
6138;NOM_DE_MEDICAMENT quels dosages existent
6139;NOM_DE_MEDICAMENT prise poids envie manger plus
6140;prise NOM_DE_MEDICAMENT silice compatible
6141;après mois traitements NOM_DE_MEDICAMENT dermato prescrit tetramysal dois prendre toujours deux cachets gélules seulement là les prises doivent plus faire pendant repas dehors sachant fais musculation mange régulièrement 6h15 10h 12h 16h 19h voudrais savoir quand pourrais prendre manière optimale les gélules sachant dois faire 2 prises jour gélule
6142;fais poser diu NOM_DE_MEDICAMENT mi mars NOM_DE_MEDICAMENT jour toujours cycle régulier bout combien temps cycles ils devenus réguliers
6143;c générique quel médicament NOM_DE_MEDICAMENT
6144;NOM_DE_MEDICAMENT efficace NOM_DE_MEDICAMENT partir quand
6145;NOM_DE_MEDICAMENT méthadone indication
6146;effets secondaires NOM_DE_MEDICAMENT
6147;NOM_DE_MEDICAMENT NOM_DE_MEDICAMENT chez nourisson
6148;fait installer NOM_DE_MEDICAMENT septembre 2001 quand dois changer
6149;harmonet remboursée
6150;NOM_DE_MEDICAMENT grossesse
6151;NOM_DE_MEDICAMENT risque accoutumance
6152;bonjour connaissez medicaments NOM_DE_MEDICAMENT contre les ronflements
6153;puis procurer NOM_DE_MEDICAMENT spermicide sans ordonnance
6154;lors instauration NOM_DE_MEDICAMENT 10 NOM_DE_MEDICAMENT folique indispensable
6155;quelqu connaît traitement les torticolis contractures très régulières deux fois semaine
6156;vient arrêter bustar lisanxia NOM_DE_MEDICAMENT trop problème sevrage
6157;4 NOM_DE_MEDICAMENT jour puis augmenter
6158;quelqu NOM_DE_MEDICAMENT déjà effets secondaire gattilier
6159;voudrais savoir si fois premiere prise pilule lumalia contraceptive fallait attendre
6160;biolectra NOM_DE_MEDICAMENT 240 forte
6161;prends NOM_DE_MEDICAMENT 2 jour medecin NOM_DE_MEDICAMENT dit remonté donc 2 5 jour cela va mieux top pensez fallait monter ad
6162;je sous pilule NOM_DE_MEDICAMENT ge rendu compte matin 6h oublié prendre pilule 14e jour est peux continuer normalement prise pilule faire pause normalement
6163;NOM_DE_MEDICAMENT 35 sous soleil
6164;quand revient NOM_DE_MEDICAMENT quinta
6165;NOM_DE_MEDICAMENT partir quel âge peut prescrire dapis stick boiron
6166;que faire contre myelite
6167;utilise NOM_DE_MEDICAMENT depuis 3 mois depuis 2 jours plaques rouges apparaissent corps normal
6168;souffre maux tête très forts souhaiterais suivre traitement fond homéopathique quelqu pourrait indiquer pistes plait
6169;j oublié prendre première pilule plaquette puis démarrer jour retard tout protégée
6170;pilule NOM_DE_MEDICAMENT mauvais
6171;qu NOM_DE_MEDICAMENT
6172;NOM_DE_MEDICAMENT protéines œuf NOM_DE_MEDICAMENT NOM_DE_MEDICAMENT
6173;quels effets secondaires NOM_DE_MEDICAMENT
6174;NOM_DE_MEDICAMENT NOM_DE_MEDICAMENT dangereux
6175;NOM_DE_MEDICAMENT adresse NOM_DE_MEDICAMENT gé
6176;dangereux faire vacciner grippe
6177;NOM_DE_MEDICAMENT NOM_DE_MEDICAMENT ça va ensemble
6178;quels spécialités disponibles les maux gorges autre NOM_DE_MEDICAMENT NOM_DE_MEDICAMENT
6179;début NOM_DE_MEDICAMENT 1 2cp
6180;prends actuellement tt fond e150 POSOLOGIE NOM_DE_MEDICAMENT traiter migraine faut arrêter traitement cas grossesse
6181;NOM_DE_MEDICAMENT antibiotiques
6182;je souhaiterez faire poser sterilet NOM_DE_MEDICAMENT aimerais savoir apres pose sterilet regles pendant combien temps quantite regle normale pendant 5 8jrs puis spotting
6183;prend NOM_DE_MEDICAMENT 0 POSOLOGIE dosage initial 0 comprimés si sens bien 1 si ca va bof 2 quand ca va suite problème personnel pris 3 comprimés aimerais savoir si peut avoir conséquences
6184;prendre decongestionen type dolirhum contre indiquer prise steroids
6185;NOM_DE_MEDICAMENT sert dormir
6186;voudrais consulter amie NOM_DE_MEDICAMENT problèmes excitation personnalité NOM_DE_MEDICAMENT témoignages
6187;connaissez médicaments contre acnée peau grasse
6188;prise NOM_DE_MEDICAMENT surdosage danger
6189;quel nom générique mélodia
6190;trinordiole principaux effets indésirables
6191;règles 10 jours aprés début plaquette NOM_DE_MEDICAMENT gé inquiétant NOM_DE_MEDICAMENT avis
6192;oubli mois précédent rend prise pilule qlaira inefficace
6193;quelle demi vie NOM_DE_MEDICAMENT
6194;comment décaler regles NOM_DE_MEDICAMENT patch
6195;prends habituellement NOM_DE_MEDICAMENT aujourdhui pharmacien NOM_DE_MEDICAMENT donné ludéal gé pilule
6196;remarquer aujourd hui vers 10h oublier prendre 3 pilules dernières plaquettes lundi mardi mercredi rapports non protégé mercredi jeudi matin risque grossesse
6197;aujourd hui très stressée voudrais reprendre calcibronate peut procurer pharmacie sans ordonnance
6198;NOM_DE_MEDICAMENT stimulant
6199;quelle alternative thérapeutique rupture NOM_DE_MEDICAMENT
6200;NOM_DE_MEDICAMENT hépatite NOM_DE_MEDICAMENT obligatoire
6201;NOM_DE_MEDICAMENT quoi servent médicaments NOM_DE_MEDICAMENT NOM_DE_MEDICAMENT
6202;NOM_DE_MEDICAMENT monodose peut être utilisé main
6203;question NOM_DE_MEDICAMENT
6204;enceinte 16sa ca fais 7mois vacciné rubéole pensez trop tot NOM_DE_MEDICAMENT agisse
6205;stopper les grignottages stress fallait prendre NOM_DE_MEDICAMENT amara 15ch probleme sais combien granules ni combien fois
6206;qui peut prescrire NOM_DE_MEDICAMENT
6207;acheter NOM_DE_MEDICAMENT contre grippe hier NOM_DE_MEDICAMENT quand dois faire NOM_DE_MEDICAMENT
6208;patch NOM_DE_MEDICAMENT disponible québec
6209;combien temps attendre avant les effets NOM_DE_MEDICAMENT
6210;voulais savoir si NOM_DE_MEDICAMENT NOM_DE_MEDICAMENT fait prendre poids
6211;maigrir NOM_DE_MEDICAMENT possible
6212;voulu mettre patch NOM_DE_MEDICAMENT haut fesse cependant mis plutôt bas dos ça peut poser problème
6213;NOM_DE_MEDICAMENT
6214;gynéco NOM_DE_MEDICAMENT prescrit NOM_DE_MEDICAMENT car depuis arrêté pilule règles revenues pb comprends ordonnance envie rappeler car peu aimable quand dois prendre quelqu ds situation merci
6215;NOM_DE_MEDICAMENT peut être dangereux
6216;dois faire vacin hépatite seulement dit ça faisait plusieurs injection vrai merci
6217;NOM_DE_MEDICAMENT traitement hormonal substitutif fait prendre poids
6218;quels maladies exactement couvre NOM_DE_MEDICAMENT tetra
6219;est NOM_DE_MEDICAMENT peut provoquer vomissements chez femme enceinte
6220;vaccins grossesse
6221;quand dois prendre NOM_DE_MEDICAMENT
6222;NOM_DE_MEDICAMENT dodo normal
6223;peut faire cure NOM_DE_MEDICAMENT minéraux prendre antidepresseur
6224;voudrai savoir si adépal fait grossir donne envie manger
6225;NOM_DE_MEDICAMENT NOM_DE_MEDICAMENT cause effets positifs contre les tocs obssesions pensées répétitives
6226;quel délai action NOM_DE_MEDICAMENT
6227;prends NOM_DE_MEDICAMENT oublié mercredi soir jeudi soir rendu compte vendredi matin hier pris pilule matin soir aujourd hui pareil rattraper les 2 pilules corps peut supporter 4 pilules 2 jours
6228;ordonnance étrangère NOM_DE_MEDICAMENT peut délivrer
6229;infection urinaire femme que choisir comme antibiotique
6230;lutényl grossesse
6231;pharmacien NOM_DE_MEDICAMENT donné NOM_DE_MEDICAMENT bichromicum 5 ch fille margot 6 mois 8 5 kg enrhumé combien donner
6232;langue enflée quand prend paracétamol peu aider
6233;fils fait NOM_DE_MEDICAMENT rhume rhume pédiatre NOM_DE_MEDICAMENT conseillé NOM_DE_MEDICAMENT oral ça fait longtemps ça existe
6234;voudrais savoir comment agit NOM_DE_MEDICAMENT homme puis attendre augmentation considerable testosteron
6235;9eme mois grossesse souffre hemorooides savez pendant combien jours dois prendre les granulés
6236;NOM_DE_MEDICAMENT pharmacien voudrait connaître taux remboursement NOM_DE_MEDICAMENT
6237;NOM_DE_MEDICAMENT utilise pourquoi
6238;insomnie sous NOM_DE_MEDICAMENT fréquence
6239;oublier pillule NOM_DE_MEDICAMENT prise 1 heure avant heure habituelle bonne action fais fais betise
6240;biceptine oeil grave
6241;mercilon bien pilule minidosée
6242;puce NOM_DE_MEDICAMENT premier NOM_DE_MEDICAMENT NOM_DE_MEDICAMENT jour gronchon pleure bcp veut les bras dort tres mal surtout mange peu tres peu pouvez dire combien temps ils peuvent durer
6243;est peut prendre NOM_DE_MEDICAMENT 1g pendant grossesse
6244;voulais savoir si NOM_DE_MEDICAMENT marcherait bien angoisse
6245;la prise poids effet indésirable commun NOM_DE_MEDICAMENT
6246;voudrai savoir parmi les internautes pris NOM_DE_MEDICAMENT cystéine NOM_DE_MEDICAMENT dérèglement niveau règles
6247;2ème plaquette NOM_DE_MEDICAMENT règles
6248;NOM_DE_MEDICAMENT quoi sert felden
6249;NOM_DE_MEDICAMENT contre hépatite NOM_DE_MEDICAMENT
6250;prend systématiquement poids NOM_DE_MEDICAMENT
6251;qu NOM_DE_MEDICAMENT
6252;les futures mamans peuvent elles prendre NOM_DE_MEDICAMENT
6253;NOM_DE_MEDICAMENT desir bebe possible
6254;prendre faire passer déprime post partum
6255;enfant sous traitement NOM_DE_MEDICAMENT
6256;19g NOM_DE_MEDICAMENT risque quoi
6257;bonjour prévu prenne pilule NOM_DE_MEDICAMENT prochainement connais bien les carectéristques NOM_DE_MEDICAMENT dit fallait fumer or fume depuis deux ans quels donc les risques courus effets merci
6258;le ciclosporine 0 5 goutte disponible ville pui
6259;NOM_DE_MEDICAMENT prévenir tétanost
6260;combien temps après arrêt NOM_DE_MEDICAMENT possible boire NOM_DE_MEDICAMENT
6261;NOM_DE_MEDICAMENT efficace les crises épilepsie
6262;quelqu pourrait renseigner les conséquences arrêt pillule NOM_DE_MEDICAMENT hormones mettent temps reprendre activité normale
6263;NOM_DE_MEDICAMENT heure prise
6264;combien coûte environ boite 100 30 comprimés tranquital
6265;paracétamol peut etre dangereux tous les jrs
6266;hello
6267;déja fait deux injections NOM_DE_MEDICAMENT NOM_DE_MEDICAMENT depuis état moral dégradé conseilleriez
6268;NOM_DE_MEDICAMENT combattre les infections nosocomiales
6269;que faire prévenir grippe chez enfant 5 ans
6270;viens prendre dupahaston mieux réguler cycles règles bpc plus abondantes habitude effet connu est prise poids peut etre effet indésirable
6271;version générique cycléane 30
6272;regles trés abondantes implanon aimerais savoir quelle NOM_DE_MEDICAMENT
6273;prix vignette NOM_DE_MEDICAMENT
6274;connait NOM_DE_MEDICAMENT
6275;sous pilule NOM_DE_MEDICAMENT pendant 3 mois puis repassé sous carlin20 notice NOM_DE_MEDICAMENT 20 marque les règles doivent intervenir les 7 jours suivant prise premier comprimé hors ça fait plus semaine toujours rien puis être enceinte
6276;NOM_DE_MEDICAMENT NOM_DE_MEDICAMENT alccol
6277;NOM_DE_MEDICAMENT NOM_DE_MEDICAMENT
